id,name,shares,comments,content,posted_on,image,post_url,image_content
pfbid0JZkHB953Qek19CjHZ3pzGixk8gTQjdDcKjkcHqKh5qzCuT4VeSTJ2ZrTc1Zv3ZBpl,قناة الحدث - AlHadath,0,0,انهيار بناية قرب جسر ١٤ رمضانفي بغداد,2023-11-12:18:18,h t t p s : / / s c o n t e n t . f t u n 1 5 - 1 . f n a . f b c d n . n e t / v / t 3 9 . 3 0 8 0 8 - 6 / 3 7 6 6 7 6 4 3 0 _ 7 1 3 8 9 3 6 1 7 4 4 5 7 9 7 _ 7 3 7 5 5 0 6 8 0 7 0 4 8 0 9 7 2 6 5 _ n . j p g ? s t p = d s t - j p g _ p 3 5 0 x 3 5 0 & _ n c _ c a t = 1 0 1 & c c b = 1 - 7 & _ n c _ s i d = 5 f 2 0 4 8 & _ n c _ o h c = t Z 6 D W p M b X u 0 A X 9 W z m a l & _ n c _ h t = s c o n t e n t . f t u n 1 5 - 1 . f n a & o h = 0 0 _ A f C 4 j _ e i D f n 2 N T - D - u c S y a Q h 3 k C L u B n Q 0 3 K s J 7 f t A R U h d g & o e = 6 5 5 6 3 7 8 6,https://www.facebook.com/alhadath.tv/posts/pfbid0JZkHB953Qek19CjHZ3pzGixk8gTQjdDcKjkcHqKh5qzCuT4VeSTJ2ZrTc1Zv3ZBpl?__cft__[0]=AZXw88dB7icF_4OlKvR9nLe_qqd7Fv31inGaSwHCBZwT0Hs3qXKWWGMZYcPHT-KyBV2shzF-8cmb2vQsT5JeRBosqc0Uma3ntD4avJZky-Ao9CP-slEMtyj8ijjTmwMZXlAj6f71r2vaVPC_8tX3Cxk2zyFH95t60KW_ScZj1Wfhob5aRqbtyYecbWZ-YF64K0wtBAiuK99ZdiWQw-3hWUIh&__tn__=%2CO%2CP-R,
pfbid07GVBnNJP2jpAwdbZCPGNrLsikY4Uj8znQ8dkXYTN97q9rCVihvsAHNdrtGe9gzyvl,قناة الحدث - AlHadath,0,10,وزير الداخلية يوجه بمعاقبة ضابط وإمرأة برتبة ملازم بعد شجارهما بالعاصمة بغداد.,2023-11-12:18:19,h t t p s : / / s c o n t e n t . f t u n 1 5 - 1 . f n a . f b c d n . n e t / v / t 3 9 . 3 0 8 0 8 - 6 / 3 8 2 4 5 7 4 2 6 _ 7 1 3 8 1 0 6 3 4 1 2 0 7 6 2 _ 4 9 3 4 7 4 2 2 9 5 9 5 7 8 3 0 4 7 0 _ n . j p g ? s t p = d s t - j p g _ p 5 2 6 x 2 9 6 & _ n c _ c a t = 1 1 0 & c c b = 1 - 7 & _ n c _ s i d = 5 f 2 0 4 8 & _ n c _ o h c = D Y C G d f 5 0 n y o A X _ o G 6 _ d & _ n c _ h t = s c o n t e n t . f t u n 1 5 - 1 . f n a & o h = 0 0 _ A f B 9 u K 2 U p G E d v t l Y a R t x - N Z _ 2 d X N p t x l 2 X 2 x _ 5 q s S g K W z w & o e = 6 5 5 6 5 3 1 C,https://www.facebook.com/alhadath.tv/posts/pfbid07GVBnNJP2jpAwdbZCPGNrLsikY4Uj8znQ8dkXYTN97q9rCVihvsAHNdrtGe9gzyvl?__cft__[0]=AZV1P4otDiQJ2GfXA9rwygKq-6Iexzca9qN-eUnP45eWOUmurGwhbMNCbJ2Kax3MiH-H0U9_3PACaGR9wGnFgeeUa9_kXtY4XnbVp0cCiSBZCIXFDupUwqxU4GAVXUEW0DqOWKE2MFUvm_ESafQQBB6coRWQ5Kxzg9qUpob_zoEyO2Zn7QAD44Tfacvmfz2MEKi4EEypoFXXVVknNadw-IFs&__tn__=%2CO%2CP-R,عاجل وزير الداخلية يوجه بمعاقبة ضابط وإمرأة برتبة ملازم بعد شجارهما بالعاصمة بغداد
pfbid0ZF3G8wEG3rgi4QrnxpuLSc6HmKAq2vfmwpJ3TxKffmmkRUMzJH5yP6EWhvgfKvspl,قناة الحدث - AlHadath,8,84,شاهد.. مشاجرة بين افراد من الشرطة وامرأة في بغداد,2023-11-12:18:19,h t t p s : / / s c o n t e n t . f t u n 1 5 - 1 . f n a . f b c d n . n e t / v / t 1 5 . 5 2 5 6 - 1 0 / 3 8 2 2 6 0 9 2 8 _ 1 7 0 1 1 4 7 0 2 6 9 6 4 6 0 6 _ 8 0 2 2 4 8 5 8 3 1 9 7 0 7 1 6 4 6 3 _ n . j p g ? _ n c _ c a t = 1 0 4 & c c b = 1 - 7 & _ n c _ s i d = 1 a 7 0 2 9 & _ n c _ o h c = a W Y c m T 6 _ v b U A X - S o K E 8 & _ n c _ h t = s c o n t e n t . f t u n 1 5 - 1 . f n a & o h = 0 0 _ A f C H K g 7 4 8 H l z a b h f H n K K b w 4 U B N y U a t p K 2 2 t W F _ 1 Y Z Z K l n w & o e = 6 5 5 5 1 3 3 A,https://www.facebook.com/alhadath.tv/posts/pfbid0ZF3G8wEG3rgi4QrnxpuLSc6HmKAq2vfmwpJ3TxKffmmkRUMzJH5yP6EWhvgfKvspl?__cft__[0]=AZXfewcErhfAfNjaUTNeOvdtE8XTHTXJlPhAUiXvZ1s-wKFG4e5Zb3vb8embLId2rxE6rRUz1Sa8BlzyLCurxHpFS_Th0M_-nkKRLOPqx0zxzLeTTNS_FgrtZR4eIVKkicfTYD5MR_iEpriKWsIjd7qWhhl_ZYSCJB6kHRw9L_UWNvYwpaG5cIbec9KrMxl00WymRiIhrNWJE5tBowy98sYj&__tn__=%2CO%2CP-R,| s ل‎ N ب‎ عر‎ 7 ً ١ سيد‎ (/) g | سم‎ ] ' N
pfbid02DPRCzaeexf5UYN9RG3A4MrwhuUM47SrbRUpPsrMUdvWTC2w112Yba4YoSnnc7wyYl,قناة الحدث - AlHadath,0,17,بالصور : شوارع العاصمة #بغداد تتزين وتتألق بإسم الرسول الكريم محمد صلى الله عليه وسلم,2023-11-12:18:22,h t t p s : / / s c o n t e n t . f t u n 1 5 - 1 . f n a . f b c d n . n e t / v / t 3 9 . 3 0 8 0 8 - 6 / 3 8 1 0 6 2 6 6 2 _ 7 1 1 6 8 8 2 2 7 6 6 6 3 3 6 _ 6 7 8 7 4 3 8 0 5 5 8 7 4 9 3 5 3 5 7 _ n . j p g ? s t p = d s t - j p g _ p 5 2 6 x 3 9 5 & _ n c _ c a t = 1 1 1 & c c b = 1 - 7 & _ n c _ s i d = 5 f 2 0 4 8 & _ n c _ o h c = O d T 5 A b 5 6 p K Q A X 9 1 y 5 - g & _ n c _ h t = s c o n t e n t . f t u n 1 5 - 1 . f n a & o h = 0 0 _ A f A s g e b - 9 9 n i s z N U x - f U l O 2 w g G X a o W a Q D F H t p C k 6 B k d t t Q & o e = 6 5 5 5 2 8 2 F,https://www.facebook.com/alhadath.tv/posts/pfbid02DPRCzaeexf5UYN9RG3A4MrwhuUM47SrbRUpPsrMUdvWTC2w112Yba4YoSnnc7wyYl?__cft__[0]=AZXlg7QSLF14SsR17ZHyYFP2dFvyWZ7k-NSedeHqSS1zWvdegaYS1IxeWiFEN_fnW8aPx9ZY79UHWQh2NrB0k1uTvFvgyIRew-ZQegymzH_IVg3gx9DBHZ9SnfLlxMVtUsWSk1TQmtGEmJVJlVrACXdXVaaRp9kaoZXdOK771ybuS42t_7DafUbTffLd-uy1Ojavrw6btLh0pV6rbRR6zPIK&__tn__=%2CO%2CP-R,"| S S [ لت . - دنا‎ s S 4 XY = i L أ‎ 0 ا‎ S e it 1 لياس‎ 1 e ل ا‎ e سرت را لح""‎ = - v الات‎ (7 0 َ ا وز 1 قم 1 حاط‎ 3 v 9 اا . وح‎ . ا ل‎ et | ,-”“1 ع‎ ا‎ S"
pfbid031z9eeCq8FfeLq7x4K4MhLtua7VZpUvpTs8WmvyuUQ2Pvqjg6n5nKUwawQMsM75Qul,قناة الحدث - AlHadath,2,6, عاجل/ الأمانة العامة لمجلس الوزراء: تعطيل الدوام الرسمي الأربعاء المقبل بذكرى ولادة الرسول الأكرم (ص),2023-11-12:18:22,h t t p s : / / s c o n t e n t . f t u n 1 5 - 1 . f n a . f b c d n . n e t / v / t 3 9 . 3 0 8 0 8 - 6 / 3 8 0 5 8 1 2 2 2 _ 7 1 1 4 4 8 3 6 1 0 2 3 6 5 6 _ 4 8 4 6 8 7 6 8 7 9 6 1 3 4 8 6 0 3 _ n . j p g ? _ n c _ c a t = 1 0 8 & c c b = 1 - 7 & _ n c _ s i d = 5 f 2 0 4 8 & _ n c _ o h c = s G 0 z H 1 p 1 w 0 Y A X 9 z C c L V & _ n c _ h t = s c o n t e n t . f t u n 1 5 - 1 . f n a & o h = 0 0 _ A f B 4 w F J m 8 9 i X C N J c c W l i b P 9 _ J g k z s G Q X 3 Y I D - p 3 3 R 8 F E R w & o e = 6 5 5 6 F 6 2 1,https://www.facebook.com/alhadath.tv/posts/pfbid031z9eeCq8FfeLq7x4K4MhLtua7VZpUvpTs8WmvyuUQ2Pvqjg6n5nKUwawQMsM75Qul?__cft__[0]=AZWxBrnkOLSK_RwM7roDQaqavvw_WXXAFDKpW2-uI3Op-jhBL-Q2Z-aBWY8cwvQsSbrHIkzQoT1uASR10KbuiStalI9PyrWbOoqyDKvWaHJv902T4fCVhyaRWMADrpuImBGuZQQIgmqapQL-Z7gwY-_dUJk2FMxG6XDXRAmicA3qHgOkJ9dJHdZ1oCAARXJmlOiTVJSA1csVL9N4KsJTbO_d&__tn__=%2CO%2CP-R,الحدث 1 عاجل Al-Hadath‏
pfbid05iPS6hN7SvqmdNKXz24hLznk1Dua3SsRTdU5YFEoeC9DfGMoWp1F2FLkDhM1rz6tl,قناة الحدث - AlHadath,0,4,مظاهرات في مطار بغداد بسبب تلكؤ عمل شركة فلاي بغداد المعتاد و التأخير في مواعيد الرحلات.,2023-11-12:18:24,h t t p s : / / s c o n t e n t . f t u n 1 5 - 1 . f n a . f b c d n . n e t / v / t 1 5 . 5 2 5 6 - 1 0 / 3 7 9 6 2 9 5 1 1 _ 1 0 3 9 1 5 5 7 1 0 8 3 1 1 5 3 _ 3 7 8 9 1 2 0 0 1 4 4 9 0 6 2 7 7 6 2 _ n . j p g ? _ n c _ c a t = 1 0 0 & c c b = 1 - 7 & _ n c _ s i d = 1 a 7 0 2 9 & _ n c _ o h c = s c L R m 6 t q n t A A X - V B r 8 J & _ n c _ h t = s c o n t e n t . f t u n 1 5 - 1 . f n a & o h = 0 0 _ A f D F d D 1 b O l f A w Q t L C g a z t Q x E 4 0 w Y b E M G r v v i R q w l C K j e G g & o e = 6 5 5 6 0 A 1 2,https://www.facebook.com/alhadath.tv/posts/pfbid05iPS6hN7SvqmdNKXz24hLznk1Dua3SsRTdU5YFEoeC9DfGMoWp1F2FLkDhM1rz6tl?__cft__[0]=AZVuofDkgQA0uYtHsXdgx0eV9p1ft9TsKF9iR5XpEzmQ2WdMujY4IuA6RYsRhYGRIyqRK1z2KlbfDEdMmar4ihaeumnmihPHlwr2fgBXF6fqUCsR5jN8VwWzvyBOmqIxNe1AxaLCcH19tEFkPAY2mGdBbkXpnEpoyryQ3qzjrChiYLcLhc7rgvJcvS6N8zNd73erfOY1Q5EBZs1yrEmfRSSK&__tn__=%2CO%2CP-R,"حرا ١ QWA | L‏ Vil‏ ا aS‏ 41 أده ,| , اد امرض لا | ا R :‏ ل"
pfbid02UXaQ8EURyvRRjh3kkZhdP5PkHcZAoEPWG7W4yD4oHeAbdF3xLmwTfYWuk2eCiqmSl,قناة الحدث - AlHadath,0,3, بالوثيقةيارالله يجري خمسة تغييرات في مناصب القيادات العسكرية.,2023-11-12:18:24,h t t p s : / / s c o n t e n t . f t u n 1 5 - 1 . f n a . f b c d n . n e t / v / t 3 9 . 3 0 8 0 8 - 6 / 3 7 6 8 8 5 8 0 7 _ 7 1 0 2 6 5 0 1 4 4 7 5 3 2 4 _ 6 6 2 4 8 0 2 4 2 0 6 6 6 1 7 2 7 0 0 _ n . j p g ? s t p = d s t - j p g _ p 5 2 6 x 2 9 6 & _ n c _ c a t = 1 0 4 & c c b = 1 - 7 & _ n c _ s i d = 5 f 2 0 4 8 & _ n c _ o h c = n a j a V G B i 4 4 E A X _ A G Z 0 z & _ n c _ h t = s c o n t e n t . f t u n 1 5 - 1 . f n a & o h = 0 0 _ A f D Q 8 9 a C j I Y d f T m N Q m R j b o C g E 5 s M r l J y I r p E 2 C z v f n p X w g & o e = 6 5 5 6 3 9 B 4,https://www.facebook.com/alhadath.tv/posts/pfbid02UXaQ8EURyvRRjh3kkZhdP5PkHcZAoEPWG7W4yD4oHeAbdF3xLmwTfYWuk2eCiqmSl?__cft__[0]=AZWr3z68p_EQa-iIy9xnqNBnvu6Pk8AyX19aSyGFlyEHlBIfXpCyN80x0mUN-1A-SShSd0FcfY553deSzrWHM4BTPNblBBiFZCAdq04C_cmbE54vCvlRLyaugpSzKxvPHOn64pNKs1-UXX5C-JE76rYNwyjtUGU7jrLRFv-26kLSMEiGoAoyQrgzxjJhOvr4NrurwTU09ZXO9LWl8dZVudiq&__tn__=%2CO%2CP-R,"gl ١‏ دائرة الادارة الموضوع نفل ضباط اب امائسة التسيز الام /1/ 17770 ٠١١١ TSV, PR‏ ب نفل الضباط المدرجة اسمانهم ادناه من والى المناصب المؤشرة ازاء كل منهم g -‏ انعد | رئيس ارا T i‏ قوتت قي اضورق | سكل عم عق ض )ري لكك T et‏ ا 41 G‏ | علاء قاطع حسين يد | مير o‏ الصليات قيدة فوات افبرية .رئيس الاركان Ul‏ ميات انفرع جو اتكاذ ما يلزم واعلامنا . ق خ الركن عبسد الاميمر الله o‏ الا gt‏ الاج"
pfbid02ocK3U4xW5XPgzHW4RwQee73w93ybKqnz5XadAxduY1iAohKQN6rsBnMQjtREHYGql,قناة الحدث - AlHadath,0,0,استشهاد المفوض وسام أحد عناصر حماية رئيس مجلس شيوخ عشائر الطارمية الشيخ سعيد جاسم المشهداني بعد اصابته منذ ايام بهجوم  استهدفت فيه رئيس المجلس المكلف بحمايته .,2023-11-12:18:25,h t t p s : / / s c o n t e n t . f t u n 1 5 - 1 . f n a . f b c d n . n e t / v / t 3 9 . 3 0 8 0 8 - 6 / 3 7 4 5 1 1 6 9 9 _ 7 0 9 6 0 4 5 9 1 2 0 8 0 3 3 _ 8 6 7 0 9 8 5 9 8 7 0 0 0 9 1 4 7 5 4 _ n . j p g ? _ n c _ c a t = 1 0 1 & c c b = 1 - 7 & _ n c _ s i d = 5 f 2 0 4 8 & _ n c _ o h c = L 9 Z 1 0 q Y C O v A A X 8 D r A X g & _ n c _ h t = s c o n t e n t . f t u n 1 5 - 1 . f n a & o h = 0 0 _ A f A H u e 3 O u f j q 2 2 3 4 i s 5 E h f 9 2 M 2 f L w R _ o B f f v g B u 2 n O C X M g & o e = 6 5 5 6 A 2 0 F,https://www.facebook.com/alhadath.tv/posts/pfbid02ocK3U4xW5XPgzHW4RwQee73w93ybKqnz5XadAxduY1iAohKQN6rsBnMQjtREHYGql?__cft__[0]=AZVnujGSsXqiNdr1kFE5bYeL6o0sub3Cz8U25Da8S1l6QxeHvD19zdJs-kFPiHN5WErRqbrSDrUvAVxmrovG26OMt1-DHLoCrh8X6oBCqo5kusEbdh_2bBp9uK8_E44n6_ACS8BrjEyYzdaswXfIepsrBvT-gSIiOoYjCN0o0fIDS_U52xAKnYuvufd0fEOPGP-mwta7b29krXCJ7wCBbDaS&__tn__=%2CO%2CP-R,"i 0""‏ ذ 2 08 : 0 1 70 > 7 & 0 ~ 5 N : B - A \ ? % « Y ه-‎ \ J A i T 0:"
pfbid0KFAtw4taiBgKigzUtUSjpa62hW6qLdYrDhqDnpLkSLYLca8XD292NwffseJtDtSSl,قناة الحدث - AlHadath,1,6,بالوثيقة.. السوداني يعفي وكلاء ومستشارين في 6 وزارات,2023-11-12:18:25,h t t p s : / / s c o n t e n t . f t u n 1 5 - 1 . f n a . f b c d n . n e t / v / t 3 9 . 3 0 8 0 8 - 6 / 3 7 6 5 0 3 9 1 1 _ 7 0 9 5 8 3 2 2 1 2 1 0 1 7 0 _ 3 5 9 7 9 8 0 8 8 5 8 4 8 5 7 8 9 0 2 _ n . j p g ? s t p = d s t - j p g _ s 6 0 0 x 6 0 0 & _ n c _ c a t = 1 0 0 & c c b = 1 - 7 & _ n c _ s i d = 5 f 2 0 4 8 & _ n c _ o h c = I C W s J T h 6 K q Y A X 8 Z w w n O & _ n c _ h t = s c o n t e n t . f t u n 1 5 - 1 . f n a & o h = 0 0 _ A f C 4 R U A 1 f 0 t V D O T G a y J J f d y 6 S w o j S I q h k V 2 Q 0 3 X Q x 2 a f i A & o e = 6 5 5 6 8 1 D C,https://www.facebook.com/alhadath.tv/posts/pfbid0KFAtw4taiBgKigzUtUSjpa62hW6qLdYrDhqDnpLkSLYLca8XD292NwffseJtDtSSl?__cft__[0]=AZUoHvUFL07yXPVCfVCwBEapST9BtSNp0Y6s8_KOhHvboDaeAD5YkKid2EuuwnNNLRKQVExKQ22rwCISVOJkwrcelaOeS3t_nUoJG3QfolUUINsk9miQWgQKftfHZHOvSJOjpSGz-TxJHFYZknKd_ZuHZ9N9rqmHhdXC4eD9yakAZ9i32fIKMQj14jPWrV2rWA_ObBiLtmaBKTL-1siHC4MJ&__tn__=%2CO%2CP-R,Republic of Iraq ﬁ | جمهوريةالغعراة‎ Prime Minister's Offce 0: مكتب رئيس مجلس الوثياء‎ 2397624 /3059 العدد:‎ التاريخ: 2023/09/14 232721 ديواني‎ A بناة على مقتضيات المصلحة العامة؛ وإستتاداً إلى مصادقة السيد رئيس مجلس الوزراء»‎ على المحضر رقم )1( للجنة تقييم الدرجات الخاصة المشكلة بموجب الأمر الديواني (22200) لسئة 2022 تقر ما ياتي: 5 إنهاء تكليف الذوات المدرجة أسماؤهم أدناه من المناصب المؤشرة o‏ إسم O‏ منهم: 1- السيد (عادل ناجج عباس محمد الفتلاوي) من مهلم وكيل وزارةالتريبة للشؤون العلمية» 2- السيد إفلاج محمود أحمد القيسي) من مهام وكيل Bl‏ للشؤون I‏ 3- السيد (أميد مصطفى عبد الله مصطفى) من مهام المستشار التريوي في وزارةالتربية. 4- السيد إصفاء لفتة يونس صالع) من مهام المستشار التزيوي في وز 5 5- السيد (طالب عبد | ن مهام وكيل وزاة النقل للشؤون الفنية. 6- امنيا [سعد بشير ن مهام مستشار في 8y‏ 8 والسياحة والآثار» 7- السيد (كاميران عل ) من مهام وكيل وزارة البيئة للشؤون الإدارية والمالية. 8- السيد (عيد ) مهام وكيل وزارة الشباب والرياضة لشؤون الرياضة. 9- السيد (مكي 5l S e‏ الصناعة والمعادن الشؤون الإذارية. طق يد الآ من ؛ ا ص 3 | 3 لول L 1 1‏
pfbid02ehkLoT4WtkK94YDJpkfzy2r2AtLsEfNKtUQcG3CH8cpSTSYcAn6k9krt1XeGUusCl,قناة الحدث - AlHadath,0,6,وزارة الداخلية العراقية تنشر اسماء المقبولين في عقود الامن. https://t.me/AlHadathNewsss/2951,2023-11-12:18:27,h t t p s : / / s c o n t e n t . f t u n 1 5 - 1 . f n a . f b c d n . n e t / v / t 3 9 . 3 0 8 0 8 - 6 / 3 7 4 5 7 1 7 6 6 _ 7 0 8 8 8 7 5 4 4 6 1 3 0 7 1 _ 8 5 3 2 4 2 5 1 8 6 4 3 0 2 3 9 0 1 8 _ n . j p g ? _ n c _ c a t = 1 1 1 & c c b = 1 - 7 & _ n c _ s i d = 5 f 2 0 4 8 & _ n c _ o h c = x r V x d s W w v o Y A X _ w G c 0 J & _ n c _ h t = s c o n t e n t . f t u n 1 5 - 1 . f n a & o h = 0 0 _ A f D A P C 9 1 O d q U 0 a b Y a n T c B D Q 8 k M g 4 E U d 2 Q B A V Q o Q a p f T t n w & o e = 6 5 5 5 C 7 1 8,https://www.facebook.com/alhadath.tv/posts/pfbid02ehkLoT4WtkK94YDJpkfzy2r2AtLsEfNKtUQcG3CH8cpSTSYcAn6k9krt1XeGUusCl?__cft__[0]=AZUE07stXPfSfO1WJl3PjdlESJEst3qxRXPfBwT2ASu5e5V6Z71YhOja2MRosG28uFTlseyQYqAW1ovr3kLVFB9o1JnStXuP8VYANNWoJ63Kzo-pX4vh6GjVWyOurUUZFIi24xCz70VV_xVDWZ4kFZH8nq8qwXMXhNrm_N9PkdIg-4Mk0qILjGDHxYhyE0GHs8b__Vji5m-N4fR2x2B3Z8N4&__tn__=%2CO%2CP-R,الحدث 1 عاجل Al-Hadath‏
pfbid02TFCnzyrovNz2tRmVMGXrsNmr9271SbTxTg3bAqGt8pACEFNgrFW9zgCZqLVxEGr3l,قناة الحدث - AlHadath,0,2,"اندلاع حريق كبير ببناية تجارية خلف محطة وقود ""ابو اقلام"" ضمن منطقة الكرادة وسط بغداد.",2023-11-12:18:28,h t t p s : / / s c o n t e n t . f t u n 1 5 - 1 . f n a . f b c d n . n e t / v / t 1 5 . 5 2 5 6 - 1 0 / 3 7 9 6 3 5 0 2 5 _ 1 3 0 3 2 6 8 8 0 7 2 4 3 7 6 5 _ 2 4 4 9 3 7 0 9 8 5 9 0 9 6 0 7 0 6 6 _ n . j p g ? _ n c _ c a t = 1 0 9 & c c b = 1 - 7 & _ n c _ s i d = 1 a 7 0 2 9 & _ n c _ o h c = P 5 U X K 9 E 6 d P E A X 9 W V K h n & _ n c _ h t = s c o n t e n t . f t u n 1 5 - 1 . f n a & o h = 0 0 _ A f B s v u d _ i q M s T h e r 5 U S c u - D U B 3 w s u h 1 o u R F x e 7 U P O o O N 2 Q & o e = 6 5 5 6 E E 0 9,https://www.facebook.com/alhadath.tv/posts/pfbid02TFCnzyrovNz2tRmVMGXrsNmr9271SbTxTg3bAqGt8pACEFNgrFW9zgCZqLVxEGr3l?__cft__[0]=AZVSRw3uQfgPvbQQEAU_vcU3sN5MWibnmvDvbLnjoOG56oZa463HfcZ0xqQBM1OMv5TkpzqBZ6kTAdOW3YaS5NUWgIwwLNWFy0DZgGOPu4X83MhG_A3R9F9k2jegRWuttSkY0po6ZIZqTd6aZRPgkxQbRJx7yQ5RdBypb1zSsRhnKid4_ZNJugsj6W_f3o-GdN8qCJrrKv3WXAGLecDviLco&__tn__=%2CO%2CP-R,""" |"
pfbid02ikDpFLqYG8M1ay8GhSmL1TyinNbnu7ivpdiUR98YFqvVrn3bHyCy7mMao3byoop2l,قناة الحدث - AlHadath,1,1,بلدية المنصور تنفذ حملة لرصد واعتقال اصحاب المرائب غير الرسمية وجباة وقوف السيارات على الارصفة والشوارع والازقة المخالفين .,2023-11-12:18:29,h t t p s : / / s c o n t e n t . f t u n 1 5 - 1 . f n a . f b c d n . n e t / v / t 1 5 . 5 2 5 6 - 1 0 / 3 7 9 6 4 2 4 0 6 _ 2 3 9 2 9 9 4 1 8 6 7 3 7 0 5 _ 8 4 7 9 0 5 6 2 2 6 8 1 8 0 8 5 4 2 2 _ n . j p g ? _ n c _ c a t = 1 0 4 & c c b = 1 - 7 & _ n c _ s i d = 1 a 7 0 2 9 & _ n c _ o h c = b a V G i F - 9 u 6 w A X - D a G 0 V & _ n c _ o c = A Q l a p T e 4 Y 7 t h 2 O l 2 O x j Y W g L 4 2 B 8 L U m A X 9 d H M O h f u Q z e f u Y W e D D o 2 K D X K A N q r - 8 K a z U M & _ n c _ h t = s c o n t e n t . f t u n 1 5 - 1 . f n a & o h = 0 0 _ A f A k D K h c K O Z 2 _ Y M n M V o P 7 w K x 2 k N p u j u B A 5 N o C 9 y 1 f t i W X A & o e = 6 5 5 6 5 2 1 8,https://www.facebook.com/alhadath.tv/posts/pfbid02ikDpFLqYG8M1ay8GhSmL1TyinNbnu7ivpdiUR98YFqvVrn3bHyCy7mMao3byoop2l?__cft__[0]=AZU2I2OzKi_w3QFzwjFi2e5a4VL9BYY6a_K3lg2ly99_HAGDuikVkLlOE8Mub0Tu7X7WSVJZkkIyRZNKfog7xQsdtRvCsPu5wTLv7jkorT7ieOynDuDEd4mKZ463dplyRfkNacls4RtLFMZeYMouNPOI9l1d-MxPOX2pqxCy_6MDaaCd4Zi2TbBaZ9Fy3bCEDQlGfWqCpC8eBRdy3lKjqbsD&__tn__=%2CO%2CP-R,e -‏ 1 سن 3 8 & ص
pfbid02oxxCpNbuYNQ2XrcBTQoJZshuGSgNCvyvofDkGvMdNkWH6AZqA8RrUDPoQQRX3nHHl,قناة الحدث - AlHadath,0,13,السيد السيستاني يستقبل الطالب المتفوق (سيف سعد بطاح) مع والده وإخوته، بعد نجاحه من السادس الاحيائي بمعدل 89.25.,2023-11-12:18:29,h t t p s : / / s c o n t e n t . f t u n 1 5 - 1 . f n a . f b c d n . n e t / v / t 3 9 . 3 0 8 0 8 - 6 / 3 7 4 2 0 2 9 0 0 _ 7 0 7 4 2 4 1 3 4 7 5 9 4 1 2 _ 4 9 1 1 0 3 3 8 3 8 0 6 6 4 4 5 0 4 0 _ n . j p g ? s t p = d s t - j p g _ p 8 4 3 x 4 0 3 & _ n c _ c a t = 1 0 9 & c c b = 1 - 7 & _ n c _ s i d = 5 f 2 0 4 8 & _ n c _ o h c = v Y w z 9 Z Z 8 b G U A X _ 7 H J J e & _ n c _ h t = s c o n t e n t . f t u n 1 5 - 1 . f n a & o h = 0 0 _ A f A Y 2 J t O t n t Z n q R M o 1 j 0 6 k n w B B b i g X A v 6 s e 6 h L c _ H U 5 m r g & o e = 6 5 5 5 D 3 2 A,https://www.facebook.com/alhadath.tv/posts/pfbid02oxxCpNbuYNQ2XrcBTQoJZshuGSgNCvyvofDkGvMdNkWH6AZqA8RrUDPoQQRX3nHHl?__cft__[0]=AZUXKwoLLtVZ0HQcl07M0N-RZU43Bzz-KiReKPrHQK67V3K4777hVFHQWOTt3PZXjd-E-ixvt2ybB67fiOq-L2-cr76rz1KR61GE3vpsXm3N7DZkiSfvAcVx_uG9xwbxxRtzGxxvF6pmSeUJfZuKbDKZkenFnWxJaaVfyuIdsm1A5MAMFNYvNeB6QXE2LuMLTHG5h_qUO0kp0tzHb7t7-h40&__tn__=%2CO%2CP-R,l e = ©
pfbid0UKM2ikqqSLdoWEjhgdkEEq8gZLaxGrZpWdKAjsE8eeXiLhHChb65qhHNUPTfCziSl,قناة الحدث - AlHadath,2,1,#عاجل تم فتح رابط التعيين بصفة جندي وزارة الدفاعرابط تقديم ‏https://t.me/AlHadathNewsss/2925,2023-11-12:18:30,h t t p s : / / s c o n t e n t . f t u n 1 5 - 1 . f n a . f b c d n . n e t / v / t 3 9 . 3 0 8 0 8 - 6 / 3 7 6 6 7 8 7 2 9 _ 7 0 7 1 5 8 3 0 1 4 5 2 6 6 2 _ 3 5 0 7 8 7 9 6 9 7 5 9 0 8 6 0 2 9 8 _ n . j p g ? _ n c _ c a t = 1 0 1 & c c b = 1 - 7 & _ n c _ s i d = 5 f 2 0 4 8 & _ n c _ o h c = Z 0 3 H N V 8 c k c E A X 8 V y Q Q P & _ n c _ h t = s c o n t e n t . f t u n 1 5 - 1 . f n a & o h = 0 0 _ A f B W 6 f a H L n k 2 0 2 n _ J m q c O Z N T Z M D b U 0 v E 8 c U 1 B O x W 2 f n P t w & o e = 6 5 5 6 D 3 B 0,https://www.facebook.com/alhadath.tv/posts/pfbid0UKM2ikqqSLdoWEjhgdkEEq8gZLaxGrZpWdKAjsE8eeXiLhHChb65qhHNUPTfCziSl?__cft__[0]=AZUT5PAXj7DfCnbmLWv--IE1AjVLIOis8CNaL950XQSZhqWYdJuEi3h5YDyh9vx_sje1LUIVBT2aHjAv6J5e6rS8fVyQ3ujRdvpwcMTJBwIcU2kHB7QLMD_upUMGXJ8Hah8ntwgMwdJbWg66UP74CKnLjNu7-YbBqB2CJbczp6bYP-sodjm3TDTs7LdzuqzVId8OSEtPloS4by8l8SCxQ3hI&__tn__=%2CO%2CP-R,الحدث 1 عاجل Al-Hadath‏
pfbid02iUw46CpC8TXvVdRgQdnGv1A9xNRyk7qVahL1wuwxyopJ5gvw3bupamFiJo7W6GMNl,قناة الحدث - AlHadath,0,5,مسرور بارزاني: أنا في بغداد على أمل حل المشاكل العالقة,2023-11-12:18:30,h t t p s : / / s c o n t e n t . f t u n 1 5 - 1 . f n a . f b c d n . n e t / v / t 3 9 . 3 0 8 0 8 - 6 / 3 7 6 5 7 6 9 3 2 _ 7 0 6 8 3 3 6 3 4 8 1 8 4 6 2 _ 7 3 4 0 1 2 3 6 7 7 6 0 0 0 9 9 9 2 8 _ n . j p g ? s t p = d s t - j p g _ p 8 4 3 x 4 0 3 & _ n c _ c a t = 1 0 8 & c c b = 1 - 7 & _ n c _ s i d = 5 f 2 0 4 8 & _ n c _ o h c = C g u z N o R O R o U A X 9 9 y 6 Z 1 & _ n c _ h t = s c o n t e n t . f t u n 1 5 - 1 . f n a & o h = 0 0 _ A f B l a z e w n 6 y b c _ b O s 5 M g e W Z t c 7 D f 4 B G d u G P U 9 o E i T o v p n w & o e = 6 5 5 6 8 E 5 0,https://www.facebook.com/alhadath.tv/posts/pfbid02iUw46CpC8TXvVdRgQdnGv1A9xNRyk7qVahL1wuwxyopJ5gvw3bupamFiJo7W6GMNl?__cft__[0]=AZU5bsScXbAAHCzRpr8MDIuwFYhvPt93DZOcG4ooSrZjy33XfsDeVOkkhzbZc__aNHzLQtRlBrM3qAKyXkKGKOKRerKgG4e1OsD7zae9COPVl4IK2QpT2BvoGFAag8UY1vJiF3y2JCdJlic-Ou8Q0ktn_rgQwhQ1SVynvuEfprrIzxQvtwzvuXaaAbYGLq5XSlK4_jpzGVqdN0x04gb1xj6G&__tn__=%2CO%2CP-R,"Masrour Barzani ©‏ 7 @masrourbarzani‏ \ أنا في بغداد اليوم لإجراء محادثات مع السادة رئيس الوزراء الاتحادي ورئيسي الجمهورية ومجلس النواب وعدد من زعماء القوى السياسية للتأكيد على ضمان حماية الحقوق الدستورية لمواطي إقليم كوردستان, على أمل أن نجد حلولاً للمشاكل العالقة. Translate post‏"
pfbid0LPu7G8fynVkb3kKNHjopxQTQjpDV62kd2Sxb2ppau4qHe7w39JMhd83oEE6qfZVwl,قناة الحدث - AlHadath,37,306,محافظة الأنبار تفخر بتخريج أكثر من 5000 الف  طالب وطالبة من حفظة كتاب الله.,2023-11-12:18:30,h t t p s : / / s c o n t e n t . f t u n 1 5 - 1 . f n a . f b c d n . n e t / v / t 3 9 . 3 0 8 0 8 - 6 / 3 7 6 5 0 3 9 1 5 _ 7 0 6 8 2 4 8 1 8 1 5 2 6 7 7 _ 7 7 9 3 5 9 2 2 8 3 7 3 1 6 4 6 5 6 4 _ n . j p g ? s t p = d s t - j p g _ p 3 2 0 x 3 2 0 & _ n c _ c a t = 1 1 1 & c c b = 1 - 7 & _ n c _ s i d = 5 f 2 0 4 8 & _ n c _ o h c = G J t k B G H e O y k A X - 4 2 L G b & _ n c _ h t = s c o n t e n t . f t u n 1 5 - 1 . f n a & o h = 0 0 _ A f D Q J X a B P E 7 T R 0 M o J 0 j f u O n q t 6 v 6 E N O g X J m 9 T A w 8 8 I l z 8 w & o e = 6 5 5 6 4 F F C,https://www.facebook.com/alhadath.tv/posts/pfbid0LPu7G8fynVkb3kKNHjopxQTQjpDV62kd2Sxb2ppau4qHe7w39JMhd83oEE6qfZVwl?__cft__[0]=AZUg23sHKNLAb5xRnP-dBjnBQtgyJxtFS_SGI1j1N1atcSlYBLJ_PC2F-evuTM_2XxJLSL2ChO97o632GEdne1uv0ReHwtFvVmXbc90tNcGASqUY0_hMFjNj8djk7zkeXoD0dk4x3P0c-NTJqmt95nhcgpe9OCRc4TuI5ADqcz_POfIqDVQ5tCen6pDX1b4LezLoQDKTR6ZeZhwkQBY26qbz&__tn__=%2CO%2CP-R,b R ot 0 ميان ل‎ || iy &h 0 4 B 1K T N T ل‎ M
pfbid02nGLS9N5RDyqzurB8vdduW3isHkpfYGykPZGAyd4qaCZ6LXaz2cjpQXh9twgUK2xwl,قناة الحدث - AlHadath,1,9,"الصدر يساند الضابط المحكومين بقضية اقتحام السفارة السويدية ويصف الحكومة بـ""العباسية""",2023-11-12:18:31,h t t p s : / / s c o n t e n t . f t u n 1 5 - 1 . f n a . f b c d n . n e t / v / t 3 9 . 3 0 8 0 8 - 6 / 3 7 6 8 0 8 4 9 1 _ 7 0 6 2 2 4 1 2 8 2 1 2 7 4 6 _ 7 1 9 3 0 3 3 3 9 9 5 9 2 9 6 2 8 5 6 _ n . j p g ? s t p = d s t - j p g _ p 5 2 6 x 2 9 6 & _ n c _ c a t = 1 1 0 & c c b = 1 - 7 & _ n c _ s i d = 5 f 2 0 4 8 & _ n c _ o h c = J F P W 5 5 p u T w Y A X 8 M y T S _ & _ n c _ h t = s c o n t e n t . f t u n 1 5 - 1 . f n a & o h = 0 0 _ A f C K f K z E r 3 M t 5 e H g U n f h v u 1 q A 6 7 Q F u I A i s j S s W I k H 6 7 S W g & o e = 6 5 5 5 8 D 4 F,https://www.facebook.com/alhadath.tv/posts/pfbid02nGLS9N5RDyqzurB8vdduW3isHkpfYGykPZGAyd4qaCZ6LXaz2cjpQXh9twgUK2xwl?__cft__[0]=AZUDRD6ZKn82npwVpBtZWSugY9p5M5EmDF4qW_nStZ4A_MMeRyaT8rvSWWrNjlzzgjo69Q_Lh8IMwkiTrc5CUU05MOb23Yn790iVu-XxhFxJkYiEZpnuI0TTrC0tJtYg_2lN1uBok7M2OD0DvBk0gsyt5AcdLI4EhST_hfQW5VoeJbW1BqDeNu2HaJBROWwynOOuVqj7pyzREg2JE1FzqERI&__tn__=%2CO%2CP-R,"st‏ مقتتدول ليور حاضع امون B‏ عئ المفيسات السلا عليكم ررض انه دبركاته عن P‏ الرناط o‏ الح sV K‏ 0 B‏ نهم لي e e G A s‏ رس يدي 5 دعزبرى e‏ جدورم e P s o0‏ i 8 - G‏ o‏ امام عل نان اليا بالرسى «الجزد في روم A At‏ سيدنا:. حشالق انح الحنابة e‏ 7Y‏ صللك b‏ ناش بكفة سنا دج تل لط اال كط v i e S e g‏ O AR‏ & B Sy e Tt 2‏ (العباسية o L‏ ...ميسن i‏ الا 7 e‏ 2L o Rty T‏ را مال الم امس r)m,\g;\g,.a;v'_a_‏ 8 م"
