id,name,shares,comments,content,posted_on,image,post_url,image_content
pfbid0rpJDrSArXKdmYZ8EbcWVNiBvYTLZzoY61ppCV7GXFSzq6PYMBHxRbyqSu55ZP4HFl,Arab-London عرب لندن,0,1,موجز أخبار بريطانيا من موقع ومنصة #عرب_لندن الأربعاء: 1 نوفمبر/ تشرين الثاني 2023https://arab-london.com/posts/22761https://arab-london.com/posts/22771https://arab-london.com/posts/22763https://arab-london.com/posts/22767https://arab-london.com/posts/22768,2023-11-04:20:42,h t t p s : / / s c o n t e n t . f t u n 1 5 - 1 . f n a . f b c d n . n e t / v / t 3 9 . 3 0 8 0 8 - 6 / 3 9 8 3 5 1 2 5 4 _ 8 1 0 5 9 1 9 7 7 7 3 9 3 4 8 _ 2 0 6 1 1 8 7 2 5 2 0 3 8 9 3 1 8 1 9 _ n . j p g ? s t p = d s t - j p g _ p 5 2 6 x 2 9 6 & _ n c _ c a t = 1 0 3 & c c b = 1 - 7 & _ n c _ s i d = 5 f 2 0 4 8 & _ n c _ o h c = 0 L s O M U t Q 3 z A A X 9 h y Y Q t & _ n c _ o c = A Q l C I 5 Z D U f _ V S v o C j c v e 8 Y 5 P u J W g k Z I _ c W W 1 W e 8 N e 0 5 r 0 H K x f e 9 F 6 O M 2 c g R M y X Q u S E 4 & _ n c _ h t = s c o n t e n t . f t u n 1 5 - 1 . f n a & o h = 0 0 _ A f A - N r D - I N H Y t U P O W W c 5 S 8 2 m 4 2 5 K r F e 6 3 2 1 E T q T A Q 6 s j l w & o e = 6 5 5 6 D 6 9 9,https://www.facebook.com/arablondon4/posts/pfbid0rpJDrSArXKdmYZ8EbcWVNiBvYTLZzoY61ppCV7GXFSzq6PYMBHxRbyqSu55ZP4HFl?__cft__[0]=AZXIrynUUuToOSvr69Z5fKSudH5NppFL_2VAE515MnxWJlF5Yd730fjASUlzEy-Z85nsgRLZVwtgxYxrSFqp90iVQutuO2MsIoaHCWNT6le8JNqH-1NHEAFZquKRSkhX6lXoVzatV78mlkwSMOC22Oo_DOkpb6Qt6XRNkTlUBWwSknI7lusk8EtG0CkxktNIjMxxhoz4U8hdfOvCL6txwvZ8&__tn__=%2CO%2CP-R,"- o عرب‎ | J 1 4 N 3 4 1 زعيم حزب العمال البريطاني يرد على منتقديه بشأن يمسا‎ @ 8¢ موقفه من الحرب في‎ وثائق بريطانية: إسرائيل وضعت خطة سرية لترحيل‎ @ 1971 آلاف الفلسطينيين من غزة إلى العريش عام‎ الملك تشارلز: لا يمكن أن يكون هناك ""عذر"" للفظائع.‎ o الاستعمارية في كينيا‎ المستشار الخاص السابق لجونسون: ""برافرمان معادية‎  ® للمسلمين ولا يمكنها أن تكون وزيرة للداخلية""‎ المستشارة السابقة في وزارة الداخلية تكشف بأن.‎ - & عنصرية واستهتار بريفرمان كانت السبب وراء استقالتها‎ ol كم تفاصيل لأخبار على صفحانا على مواقم التواصل‎ مسسيسم‎ @ arsondont - يف2‎ www.arab-london.com"
pfbid02UqVCuUFUEVEihwygeZHzmK8eHVj2geZd2RxTBtZoqpY28dKntwBVP5iENSFd8By8l,Arab-London عرب لندن,0,0,منظمة أنقذوا الأطفال البريطانية تطلق حملة تبرعات عاجلة للأطفال المتضررين في غزةوأشارت المنظمة غير الربحية  إلى أنها تجمع التبرعات لدعم المجتمعات المتأثرة من هذه الأزمة. وأوضحت أنه ستُسْتخدَم التبرعات لدعم الأطفال في غزة، عندما يصل مبلغ التبرعات للهدف الذي تسعى المنظمة لجمعه.#عرب_لندن,2023-11-04:21:07,h t t p s : / / s c o n t e n t . f t u n 1 5 - 1 . f n a . f b c d n . n e t / v / t 3 9 . 3 0 8 0 8 - 6 / 3 9 8 2 9 0 3 3 9 _ 8 1 0 5 7 5 0 4 4 4 0 7 7 0 8 _ 3 1 2 9 7 5 2 1 1 5 2 9 2 6 2 8 2 8 7 _ n . j p g ? s t p = d s t - j p g _ p 1 8 0 x 5 4 0 & _ n c _ c a t = 1 0 2 & c c b = 1 - 7 & _ n c _ s i d = 5 f 2 0 4 8 & _ n c _ o h c = I x d R w R K j U E g A X - u j r d j & _ n c _ h t = s c o n t e n t . f t u n 1 5 - 1 . f n a & o h = 0 0 _ A f A o - d 8 x Z t 2 d q Z j O O 4 A s 7 e u n 7 k g s a p v P Q 8 _ H 2 v r 7 c 7 y E W w & o e = 6 5 5 5 3 A 9 B,https://www.facebook.com/arablondon4/posts/pfbid02UqVCuUFUEVEihwygeZHzmK8eHVj2geZd2RxTBtZoqpY28dKntwBVP5iENSFd8By8l?__cft__[0]=AZV0E8sxNP2znjrCIY4yAu_wmOLPb0hjOpL9nAOiQqNI54gefM3ufzZeCxkIbuv1Vw6NpIoEj0iwX0HD4btcfZkBbxrJeJO8flQWLb-GQ_3Dzd0W36Wh468wlhvXgf4AW6WJLBv7sCG2BBH_PlnXbaIH9QDAkVqGJw_gD_dIiNThJnuydZMlRMSSKp5FYSDEM3f0LmKfr8K1m9A7f_QZ3Rcq&__tn__=%2CO%2CP-R,"ol | N ‘ . م ٍ عا‎ - ! © ببكهة‎ . 1 : . الي‎ ١ i 1 اللا‎ | 7 - 4 1 © ال‎ | i g B 7 A "",:A_ { |7 "" ,5-.“ - - ب‎ - i 0 ا‎ 2 - - ١ - اده‎ Lo 2 5 - 2 S p حو‎ il نج & 1 16 ا ا بحتام .""م‎ ومنو 2 ضهنا ل‎ 1 2 ل‎ - ¢ BN A a?, ]يي _ ا ا ل‎"
pfbid0JKSW2bCZnwM4e8qaJ4b7jcsR95gsUMLmDuzQTgQed2teuCX89uYsfUBjcdjSEgEnl,Arab-London عرب لندن,0,0,السفير الفلسطيني لدى لندن حسام زملط: المجتمع الدولي يطبق القوانين الدولية عندما يتعلق الأمر مع أي شعب إلا الشعب الفلسطيني#عرب_لندن,2023-11-04:22:18,h t t p s : / / s c o n t e n t . f t u n 1 5 - 1 . f n a . f b c d n . n e t / v / t 1 5 . 5 2 5 6 - 1 0 / 3 8 4 5 3 2 2 9 6 _ 9 2 0 9 9 8 4 8 3 0 0 4 6 8 3 _ 5 3 7 7 8 0 0 1 0 7 5 8 1 6 6 1 7 1 6 _ n . j p g ? s t p = d s t - j p g _ p 9 6 0 x 9 6 0 & _ n c _ c a t = 1 1 1 & c c b = 1 - 7 & _ n c _ s i d = 1 a 7 0 2 9 & _ n c _ o h c = Q _ 7 F P K A _ A L o A X 9 a H 2 4 L & _ n c _ o c = A Q n 1 H 3 g y V H R 8 e U b l W A M i k 2 K I v o 8 4 9 K d S K z l K B s A r 6 Q n - Y Q j I 6 O z a p a t 6 X 6 B K 6 p K Q e J E & _ n c _ h t = s c o n t e n t . f t u n 1 5 - 1 . f n a & o h = 0 0 _ A f B 5 O d m z o 4 T M V e p Y q Q 5 F E W w x C W v K Z P 2 g H o _ 3 T e Z K o j q p n w & o e = 6 5 5 5 B A 6 1,https://www.facebook.com/arablondon4/posts/pfbid0JKSW2bCZnwM4e8qaJ4b7jcsR95gsUMLmDuzQTgQed2teuCX89uYsfUBjcdjSEgEnl?__cft__[0]=AZVOn8_sjy2WirsMIEfIrkZcDI5X-pCUZzTfBa1OYh-t78csFcjjhU6OWU08Vtjqgkd66td6D-Aku902I7Jk9n0uHK2q6iRdX1SAuFLISwyrpEIQvneuPxQ2ikFazFq6M4dRCb-T9EwRT1tglEvkqbp2zSXcNK7mVl_aOFz5L0qGpS7TPRmDu-6b7YrLt_uuVZLqbXe77JIHONegYPhT6W_i&__tn__=%2CO%2CP-R,sk A القوانين واضحة والتوجيه‎ الأخلاقي للقانون‎
pfbid02ZejkAvkHv3uErnN7gCaPaTMucf9AL4CQ3G8KcC9dopkd5cQxnsXWL2xixsTCVxfQl,Arab-London عرب لندن,0,0,متحدثة باسم الجيش الإسرائيلي تؤكد أن دولتها لا تستهدف المدنيين ومذيع بريطاني يحرجها ويكشف كذبها.#عرب_لندن,2023-11-04:22:55,h t t p s : / / s c o n t e n t . f t u n 1 5 - 1 . f n a . f b c d n . n e t / v / t 1 5 . 5 2 5 6 - 1 0 / 3 7 0 2 3 2 4 4 7 _ 8 1 2 7 9 6 3 5 0 6 2 5 0 4 0 _ 7 0 8 3 4 7 4 1 6 2 4 2 8 8 5 7 2 4 7 _ n . j p g ? s t p = d s t - j p g _ p 9 6 0 x 9 6 0 & _ n c _ c a t = 1 0 9 & c c b = 1 - 7 & _ n c _ s i d = 1 a 7 0 2 9 & _ n c _ o h c = p h 0 P w X Z x 3 l c A X _ E C o Q s & _ n c _ h t = s c o n t e n t . f t u n 1 5 - 1 . f n a & o h = 0 0 _ A f A p 2 k X 9 k T X K X W 5 q l O b z E 3 Z m 8 p V W K V 6 Y A H _ B 9 Z G 7 w K C m p w & o e = 6 5 5 5 9 2 9 B,https://www.facebook.com/arablondon4/posts/pfbid02ZejkAvkHv3uErnN7gCaPaTMucf9AL4CQ3G8KcC9dopkd5cQxnsXWL2xixsTCVxfQl?__cft__[0]=AZWX8ao9q0kwBRfiF7us0Fs6FO6_Ib7eEbyhRCddo_F7okA2cuNKrHs_pzty6_eI0D4-PIk85kzDHtL28LAsiwCC4Y37A_FEPAISNYdgmunt3kqy62ClSU16uYVIt6dKC2Lcpg9MWlNbfbn93QIVdBe3chF2I41zIS0zQ3IrjBN9XkSHvS12ruD663fTPOrc5d48JHUcR3GKZ0Qtpn2ewxyd&__tn__=%2CO%2CP-R,1 TIMES (8 لتدل‎ W) R 2 2 Y . ‘ 7 ) ١ 3 ًَ 1 0 0 يتعين علينا أن نجدهم وان نضمن بانهم غير قادرين
pfbid06jubAPLPFUc9ypfeTgbqxfFg6Ud3uUZ2ay7esAvUFG1DWJFGS5AbEkXJG4TezyY4l,Arab-London عرب لندن,1,2,"الحكومة البريطانية تحظر الكلاب من سلالة ""أميريكن بولي اكس ال"" #عرب_لندن ",2023-11-04:23:40,h t t p s : / / e x t e r n a l . f t u n 1 5 - 1 . f n a . f b c d n . n e t / e m g 1 / v / t 1 3 / 1 6 4 0 4 2 3 4 7 5 6 0 8 6 8 5 8 7 7 4 ? u r l = h t t p s % 3 A % 2 F % 2 F a r a b - l o n d o n . c o m % 2 F u p l o a d s % 2 F p h o t o s % 2 F 2 0 2 2 % 2 F s h a r e s % 2 F 0 6 % 2 F 6 5 4 1 4 5 0 5 6 e 9 1 a . j p g & f b _ o b o = 1 & u t l d = a r a b - l o n d o n . c o m & s t p = c 0 . 5 0 0 0 x 0 . 5 0 0 0 f _ d s t - j p g _ f l f f f f f f _ p 5 0 0 x 2 6 1 _ q 7 5 & c c b = 1 3 - 1 & o h = 0 6 _ A b F E p x v 9 f k c E G M 0 Q a u W i f l T b G t J _ W 9 q d y F - Q Y _ 9 D r J 1 Q K g & o e = 6 5 5 2 7 3 A 1 & _ n c _ s i d = d b a d 3 9,https://www.facebook.com/arablondon4/posts/pfbid06jubAPLPFUc9ypfeTgbqxfFg6Ud3uUZ2ay7esAvUFG1DWJFGS5AbEkXJG4TezyY4l?__cft__[0]=AZVe4Nks7OHVjjKPdL1dUyS8AcIjiXNfze_xb96vSfxPCETdRNNuv49tjvPV58Pe0dCg6iMNu0OL7I9tshM_JORD_L_LVAk503jFAar9-8RS_gp9kmRIdtLyb-nxZ3sXJLFL9fBSkbBcDuBRGDm4jwe8zUWySwPfM9xfKWiboy0zgTKvBlsePoCbPEcJLJ-5vN63-SF35B8AYFIdYnTMgCm4&__tn__=%2CO%2CP-R,"- —\A.‘ ا د‎ A ١ : B2 1 "" L) ربلا‎ e )"
pfbid08ZWkLNASz4Ds5AveQQFFDRAkd2JhWCnZnrNGyB7VRSWvkCNttFpXDcs51k7jLegol,Arab-London عرب لندن,13,1,صادق خان في اتصال مع المذيع جيمس أوبراين، يؤكد أن المظاهرات المناصرة لفلسطين سلمية ويدعو سويلا بريفرمان لإعادة التفكير في توصيفها إياها بأنها مسيرات كراهية#عرب_لندن,2023-11-05:01:29,h t t p s : / / s c o n t e n t . f t u n 1 5 - 1 . f n a . f b c d n . n e t / v / t 1 5 . 5 2 5 6 - 1 0 / 3 8 4 6 7 5 3 7 1 _ 6 9 4 9 4 3 7 4 9 2 4 0 6 9 8 _ 7 1 8 7 8 9 5 3 9 3 8 8 0 2 5 1 9 4 3 _ n . j p g ? s t p = d s t - j p g _ p 9 6 0 x 9 6 0 & _ n c _ c a t = 1 0 4 & c c b = 1 - 7 & _ n c _ s i d = 1 a 7 0 2 9 & _ n c _ o h c = Q I L v k f s 0 I 0 0 A X 8 7 5 u 0 z & _ n c _ h t = s c o n t e n t . f t u n 1 5 - 1 . f n a & o h = 0 0 _ A f A S 7 j S Z T V K q g E B 3 2 O F R q 4 M x c X a 6 H 4 1 n h 3 I z V N I h M B n g X w & o e = 6 5 5 6 7 6 6 E,https://www.facebook.com/arablondon4/posts/pfbid08ZWkLNASz4Ds5AveQQFFDRAkd2JhWCnZnrNGyB7VRSWvkCNttFpXDcs51k7jLegol?__cft__[0]=AZWTESnbgRylTC3NQ4jiIxYmHq413FJa5ED6Z6BhRHTR6yzK6AV5cSQuoOBaws6KDZM71druCyhF23x-BevfEJL8_2d7x4QaPxJP66kZ95RePukEFlAR4thKdQEG4efCL20PFP2getb1Ps9UYj0w0v3KL0hjQgxJlXLI-JVdmAxU8Dbyi_Sa_n4fWp2Yu3OA14SlU4kOZdTwJP2pETIzoLo5&__tn__=%2CO%2CP-R,"i 80 3 2 ا‎ i RS | 1 o N | LEADING B/ g 5 ""0 |(8710؟‎ . oy v 7 ؤ‎ A وكانت هناك أقلية صغيرة‎ في المنطقة الرمادية‎"
pfbid0h1kSyM29S6h5RnWak4vRVM2ymeNFkj93d6pBG9uFzr42KLBSfL1Nd9AHFtPdM9kkl,Arab-London عرب لندن,0,5,"إدارة نادي سيلتك تقوم بسحب التذاكر الموسمية لقسم من مشجعيه، و المعروف باسم  غرين بريجايد ""اللواء الأخضر""  إلى أجل غير مسمى، بذريعة عدم التزامهم بقواعد النادي والملعب.ويأتي ذلك في أعقاب تحدّي هؤلاء المشجعين مؤخراً لمناشدات سيلتك بعدم رفع الأعلام الفلسطينية في المباريات.لكن النادي يقول إن الإيقاف لأجل غير مسمى نجم عن سلسلة من الحوادث في مباريات أخرى على مدى فترة طويلة من الزمن.#عرب_لندن",2023-11-05:05:08,h t t p s : / / s c o n t e n t . f t u n 1 5 - 1 . f n a . f b c d n . n e t / v / t 3 9 . 3 0 8 0 8 - 6 / 3 9 8 4 8 9 7 1 9 _ 8 1 0 3 3 3 9 2 4 4 3 1 8 2 0 _ 2 0 1 5 6 3 2 8 1 8 8 8 5 2 8 0 8 1 8 _ n . j p g ? s t p = d s t - j p g _ p 1 8 0 x 5 4 0 & _ n c _ c a t = 1 1 0 & c c b = 1 - 7 & _ n c _ s i d = 5 f 2 0 4 8 & _ n c _ o h c = r O U v v q Y A t A g A X 8 Z v s p 1 & _ n c _ h t = s c o n t e n t . f t u n 1 5 - 1 . f n a & o h = 0 0 _ A f B x 9 l Y a r Z q a - l A z 4 X c E b 4 X x c O - 3 B j g P b Q m L 3 Y M h K K i R j Q & o e = 6 5 5 5 5 9 5 2,https://www.facebook.com/arablondon4/posts/pfbid0h1kSyM29S6h5RnWak4vRVM2ymeNFkj93d6pBG9uFzr42KLBSfL1Nd9AHFtPdM9kkl?__cft__[0]=AZVdB6kDyL3hwexxr0VVX6dvMnzVihkqVPTbTNqu1W7Zd-P6Cc6UzFwVkNH5IJOoLosE0skbdEj3mNrWUkSs12Oc2Xk2Ivxl6J9pdMJggXaA2eUMrCEquEA0wpIM7qawkIDP722HAv9A0vJC4rEpgzAEpYiTLA4xQW6cwPt0XfZMGXDrLrqF9F83xXR8EBssnydopPT4txWZ-gsbhGDLOCWO&__tn__=%2CO%2CP-R,"ST |‏ s e‏ اا ا ® بار ال ا vy i SR R LUy‏ 99 | - ل د ار اميه ا ا اا ب oy‏ 1 ليع ارا Sl‏ P +‏ ححا ل TR,‏ بحا . A‏ ل ا ا ل ل ا 8 A O Rt‏ عاج e‏ 3 ابي بارا ل ل يا حا وا %Y‏ ال ا 86 5 ٍ ما ال AT‏ ع 1 حي اا ا ا تددر b‏ ووه i N‏ لومس د b 78 ١‏ / > ل اك J‏ A 8 |‏ ) ‘ : وا 9 & لت اخ امعد أ سس ا ¥ =. & 2 جا v‏"
pfbid0j4niEFgVMYX3PceQg9Zks7AAtcXo1q3Hwjwwty4dVatCEg1F9sQ3Bb78v58EtUxHl,Arab-London عرب لندن,2,12,زعيم حزب العمال ما زال يرفض دعم وقف إطلاق النار في غـ.ـزة كير ستارمر يحثّ إسرائيل على الالتزام بالقانون الدولي، لكنه يرفض دعم الدعوات لوقف إطلاق النار ، في الوقت الذي يسعى فيه لرأب الانقسامات المريرة المتزايدة داخل حزبه بشأن الصراع في غزة.وفي محاولة لتهدئة النواب وأعضاء المجالس الذين هدّدوا بالانسحاب من الحزب بسبب هذه القضية، وجّه ستارمر انتقاده المباشر للقصف الإسرائيلي وحثّ الحكومة الإسرائيلية على السماح للوقود بالعبور إلى غزة.#عرب_لندن,2023-11-05:07:18,h t t p s : / / s c o n t e n t . f t u n 1 5 - 1 . f n a . f b c d n . n e t / v / t 3 9 . 3 0 8 0 8 - 6 / 3 9 8 3 1 1 5 1 2 _ 8 1 0 3 3 0 2 8 7 7 6 5 5 1 7 _ 4 7 5 9 1 4 5 0 4 9 9 5 6 1 2 0 8 3 5 _ n . j p g ? _ n c _ c a t = 1 0 6 & c c b = 1 - 7 & _ n c _ s i d = 5 f 2 0 4 8 & _ n c _ o h c = w X L e H e W x A M c A X 8 Y H W M 4 & _ n c _ o c = A Q m i B I s J w F X m A l B v 3 W 6 E 4 d A U Z a 9 d V N u N k R Z s k 4 7 7 q D r 6 g - - I T 5 b q J q 7 K 9 V G a 5 T J f b T A & _ n c _ h t = s c o n t e n t . f t u n 1 5 - 1 . f n a & o h = 0 0 _ A f B Z T p C q t d H Z 4 L 4 O O 5 F f d l Y Q c T Y _ Y N g _ h p j Y r Y K 6 E r 8 - p Q & o e = 6 5 5 6 6 8 E F,https://www.facebook.com/arablondon4/posts/pfbid0j4niEFgVMYX3PceQg9Zks7AAtcXo1q3Hwjwwty4dVatCEg1F9sQ3Bb78v58EtUxHl?__cft__[0]=AZVKi7eFXUOCCDad1UQuypUuBFOCSmgYfhGpK-6eZJvwmP5bqSflu9vx9aprGKi1EaNl-jzwnEimmE63Yfc3_91O6Y7wipPyGz99fx_7TfNqLU03sq1YTIYtZ3JFd-XyQGlmj2_5CRyjgzo0Y40xi3nY6Mx_GFFjZ9umzVdtgxhTEUF6DtebHzJQPDHLBkIdk2lGtDZ4LwQsxeUjKTj-sBnb&__tn__=%2CO%2CP-R,
pfbid0t5Mnx265bsCJhAYFNiUmYVjLaydYKfTajGfK2xXYQswB5GyouY4tCQY58g8diCWEl,Arab-London عرب لندن,781,84,"السفير الفلسطيني لدى المملكة المتحدة الدكتور حسام زملط عن قصف مخيم جباليا للاجئين في غزة: ""ما فعلته إسرائيل هو حرب ضد الإنسانية"". #عرب_لندن",2023-11-05:08:32,h t t p s : / / s c o n t e n t . f t u n 1 5 - 1 . f n a . f b c d n . n e t / v / t 1 5 . 5 2 5 6 - 1 0 / 3 8 4 5 2 8 5 4 5 _ 3 1 4 3 2 3 7 6 1 2 3 0 2 7 2 _ 8 8 6 2 2 1 5 2 9 5 0 9 3 0 3 2 1 8 3 _ n . j p g ? _ n c _ c a t = 1 0 3 & c c b = 1 - 7 & _ n c _ s i d = 1 a 7 0 2 9 & _ n c _ o h c = - f h R Q b 0 V Q E 4 A X _ N s 7 y G & _ n c _ o c = A Q k f W U O W M p K p 3 N 1 z a P M U z j 4 v P a o M Z f b V 0 H n y i 4 f H c y N K q i 4 K b S 1 U 2 Y I D X Y a c z 2 P Y B R U & _ n c _ h t = s c o n t e n t . f t u n 1 5 - 1 . f n a & o h = 0 0 _ A f C T 8 x b T d X G c i i R m E a H l _ m N 7 a 0 W Y c 0 I d 6 g a Z w x e V g o m u Y Q & o e = 6 5 5 5 5 A F C,https://www.facebook.com/arablondon4/posts/pfbid0t5Mnx265bsCJhAYFNiUmYVjLaydYKfTajGfK2xXYQswB5GyouY4tCQY58g8diCWEl?__cft__[0]=AZVqgdWg_UexNv_L7xIPvwfpFtlPMazBjxh89Ea5fg3HY2RGlHzq2Q-HAmJOGIjKFkNjGpd5lg8rEatcM4eYI2QjXm7ay89UdPfqprdwcXKmMZz0zIX2g-woeHpRe2AoMydnASajOMAsxrdK1R5FpC212onKPuVj58IySgoHL6PESFFAOYS-NHxsVVlOvX0ihpU9I0MF2TW3NOzfPPO-DCu1&__tn__=%2CO%2CP-R,188 ) ) l\\ حي‎ |
pfbid0q62opzA4ZGKDB2QW2MzXXqXejw5kGuuSunRgvK3egmh8eehMzSCXFbDSMUmumHbl,Arab-London عرب لندن,0,1,"تابعونا في برنامج ( بريطانيا اليوم )  مع الأستاذ وسيم خماجة - نائب المدير التنفيذي لمؤسسة Action for Humanityللحديث حول :""كيف يمكن لعرب بريطانيا إغاثة سكان غـ.ـزة؟"" يوم الأربعاء 1-11-2023 الساعة 6:00 مساءً بتوقيت لندن.#عرب_لندن#بريطانيا_اليوم",2023-11-05:11:23,h t t p s : / / s c o n t e n t . f t u n 1 5 - 1 . f n a . f b c d n . n e t / v / t 3 9 . 3 0 8 0 8 - 6 / 3 9 8 1 4 6 2 2 8 _ 8 1 0 3 1 8 5 1 4 4 3 3 3 6 1 _ 5 6 5 0 9 8 7 3 7 7 6 3 3 8 2 4 1 0 0 _ n . j p g ? s t p = d s t - j p g _ p 5 2 6 x 2 9 6 & _ n c _ c a t = 1 0 2 & c c b = 1 - 7 & _ n c _ s i d = 5 f 2 0 4 8 & _ n c _ o h c = t 5 M R l - k d R b M A X 9 k o W p 2 & _ n c _ h t = s c o n t e n t . f t u n 1 5 - 1 . f n a & o h = 0 0 _ A f A 6 U S 5 k f c 1 X F R 3 2 m 3 q 0 Y p A 2 y p B D H y h M 6 z a T B M V p b 7 4 n c Q & o e = 6 5 5 6 1 6 1 9,https://www.facebook.com/arablondon4/posts/pfbid0q62opzA4ZGKDB2QW2MzXXqXejw5kGuuSunRgvK3egmh8eehMzSCXFbDSMUmumHbl?__cft__[0]=AZU7IfrptKiMaoBN71s7d5uaKythoG6KtvoNbDXxFPdStVDk6EZ8-O_U_0ePrFDxNpP-EDONjjAW_OCrzKizHBxWRZRKeto80_KRSRtT4qF5jBkjM9tq-KYeMA1FCFun8auUvL69FFDuFnB186ce8NCr5U5b0AtFrhaRnuPFdCWznBYvM_WcaViVoKm8jRonWvbCHXBkcnPV3iYkeQ5gG0MI&__tn__=%2CO%2CP-R,ل ل انتظرونا في برنامج «بريطانيا اليوم» للحديث :Jga‏ كيف يمكن لعرب بريطانيا إغاثة سكان غزة؟ v/ I‏ الذا g‏ تقدمه وسيم خماجة أ. مي عابد نائب المدير التنفيذي لمؤسسة. 4 اميا ction‏ i‏ 1 وقيت لندن مجه جات أي مر
pfbid04s8nkzu4GjscPD9s18Z1Cquqt1bPsRjeHJTWS8T5Yee7Lhz5L5DXafMNrxKMCk91l,Arab-London عرب لندن,0,0,موجز أخبار بريطانيا من موقع ومنصة #عرب_لندن الاثنين: 13 نوفمبر/ تشرين الثاني 2023https://arab-london.com/posts/22936https://arab-london.com/posts/22939https://arab-london.com/posts/22938https://arab-london.com/posts/22937https://arab-london.com/posts/22932,2023-11-13:13:28,h t t p s : / / s c o n t e n t . f t u n 1 6 - 1 . f n a . f b c d n . n e t / v / t 3 9 . 3 0 8 0 8 - 6 / 3 9 8 6 0 6 6 6 4 _ 8 1 7 9 2 1 6 1 3 6 7 3 0 5 1 _ 5 3 5 0 1 3 9 8 6 3 2 3 0 3 6 3 0 6 0 _ n . j p g ? s t p = d s t - j p g _ p 5 2 6 x 2 9 6 & _ n c _ c a t = 1 0 1 & c c b = 1 - 7 & _ n c _ s i d = 5 f 2 0 4 8 & _ n c _ o h c = L P u E U 6 q p _ T A A X - p L o s H & _ n c _ h t = s c o n t e n t . f t u n 1 6 - 1 . f n a & o h = 0 0 _ A f B Z v 6 N 9 v O T K f k x i K 6 y e l b v Y X d 0 m Y m L h y G 4 K y j E i 7 q g U W g & o e = 6 5 5 6 1 B 4 F,https://www.facebook.com/arablondon4/posts/pfbid04s8nkzu4GjscPD9s18Z1Cquqt1bPsRjeHJTWS8T5Yee7Lhz5L5DXafMNrxKMCk91l?__cft__[0]=AZXrnxYDihjm-AWGZtI8lq84GzptA7a4gyU6YA0AvTAwFSLi7z_tfg8iv55qN_k-NyoZcGeod20izruyDBF3-LyJqpFdEcmmCNGKzokJXLinGc4GUnMs5DzhXmsj6ifgb-tZ5xFhdiQO1iaOLs6h9HyXWKoOTULbPjZLlp_TQXTXuqNkM_R1dDzObGYtuSbXqpBnoCODKqusavSa_AfHfID2&__tn__=%2CO%2CP-R,"a [,L""""“ be 13 2023 . إقالة وزيرة الداخلية البريطانية سويلا برفارمان‎ @ تعيين رئيس وزراء بريطانيا السابق ديفيد كامرون.‎ @ وزيرا للخارجية.‎ من وزير للخارجية إلى وزير للداخلية: ريشي سوناك‎ » يعين جيمس كليفرلي خلفا لسويلا برافرمان.‎ عاصفة ديربي تضرب المملكة المتحدة وتؤثر على‎ © استقرار الطقس مع إطلاق تحذيرات واسعة.‎ م شاهد: مقدم البرامج التلفزيونية المصري معتز مطر‎ يتعهد بمقاضاة حكومة بريطانيا لاستعادة إقامته.‎ تام تفاصيل 3 على صفحانا على مواقم التواصل الاجتماعي‎ مق - سس يسيس‎ www.arab-london.com"
817921700339709,Arab-London عرب لندن,1,2,موجز أخبار بريطانيا من موقع ومنصة #عرب_لندن الاثنين: 13 نوفمبر/ تشرين الثاني 2023https://arab-london.com/posts/22936https://arab-london.com/posts/22939https://arab-london.com/posts/22938https://arab-london.com/posts/22937https://arab-london.com/posts/22932,2023-11-13:13:28,h t t p s : / / s c o n t e n t . f t u n 1 6 - 1 . f n a . f b c d n . n e t / v / t 3 9 . 3 0 8 0 8 - 6 / 3 9 8 6 0 6 6 6 4 _ 8 1 7 9 2 1 6 1 3 6 7 3 0 5 1 _ 5 3 5 0 1 3 9 8 6 3 2 3 0 3 6 3 0 6 0 _ n . j p g ? s t p = d s t - j p g _ p 5 2 6 x 2 9 6 & _ n c _ c a t = 1 0 1 & c c b = 1 - 7 & _ n c _ s i d = 5 f 2 0 4 8 & _ n c _ o h c = L P u E U 6 q p _ T A A X - p L o s H & _ n c _ h t = s c o n t e n t . f t u n 1 6 - 1 . f n a & o h = 0 0 _ A f B Z v 6 N 9 v O T K f k x i K 6 y e l b v Y X d 0 m Y m L h y G 4 K y j E i 7 q g U W g & o e = 6 5 5 6 1 B 4 F,https://www.facebook.com/arablondon4/posts/817921700339709?__cft__[0]=AZWaMrgH5e3xyaFbzPYZK_Ycawg8r6IiCPqFX3QJb1YYw758X6qW1_2XaB_fJ-3JFF2snGgkQaHR_98OexOA9DHug0bJXmlQGqpr2vdjcylHPgK-OIT9JTIOcb26VS-yQwDLx14KqoCqShykUjQpDyCDj59jwm0Xp3rYOS6DeII5JvhGxN8w8mPX5kRmRCiS72LxWTeSZCFRkL7cazRfliLb&__tn__=%2CO%2CP-R,"a [,L""""“ be 13 2023 . إقالة وزيرة الداخلية البريطانية سويلا برفارمان‎ @ تعيين رئيس وزراء بريطانيا السابق ديفيد كامرون.‎ @ وزيرا للخارجية.‎ من وزير للخارجية إلى وزير للداخلية: ريشي سوناك‎ » يعين جيمس كليفرلي خلفا لسويلا برافرمان.‎ عاصفة ديربي تضرب المملكة المتحدة وتؤثر على‎ © استقرار الطقس مع إطلاق تحذيرات واسعة.‎ م شاهد: مقدم البرامج التلفزيونية المصري معتز مطر‎ يتعهد بمقاضاة حكومة بريطانيا لاستعادة إقامته.‎ تام تفاصيل 3 على صفحانا على مواقم التواصل الاجتماعي‎ مق - سس يسيس‎ www.arab-london.com"
817917757006770,Arab-London عرب لندن,36,5,يهودي بريطاني يعتلي محطة انتظار الباصات للتعبير عن دعمه للشعب الفلسطيني#عرب_لندن,2023-11-13:13:26,h t t p s : / / s c o n t e n t . f t u n 1 6 - 1 . f n a . f b c d n . n e t / v / t 1 5 . 5 2 5 6 - 1 0 / 3 8 6 4 4 2 9 1 5 _ 3 0 4 4 9 5 8 6 2 5 3 7 4 1 2 _ 7 8 5 9 4 2 0 6 1 4 3 1 6 7 4 7 4 0 7 _ n . j p g ? s t p = d s t - j p g _ s 9 6 0 x 9 6 0 & _ n c _ c a t = 1 0 7 & c c b = 1 - 7 & _ n c _ s i d = 1 a 7 0 2 9 & _ n c _ o h c = x J 1 p v T c V o C I A X _ U s 9 3 I & _ n c _ h t = s c o n t e n t . f t u n 1 6 - 1 . f n a & o h = 0 0 _ A f B _ D X Z b 5 O p y E 4 M p L c k w f 8 d 6 M w s O S R P 5 l X s q n L T K S t 8 V V A & o e = 6 5 5 7 B 5 A 6,https://www.facebook.com/arablondon4/posts/817917757006770?__cft__[0]=AZU14QrXeCBKgYiRySHFHmxCLhWgHsa7ML8gQiWK0D4HXPeDJqQcFr9OSfgf5G02rQtn2zFh5jp-daYMQdiRV7fOeb2RIH4r4adFWNlip70Gl7FXIH8aAYaDQgd5gKsRb8nRn6dsHPG9UnZeB7-e6-zBuc5cQQlitGCdcgP1cTQ_vTuZaMGYBfCx_1kZlaUDeAs04R9BPq5RBqJUbMePibNs&__tn__=%2CO%2CP-R,ARV 0 3 ) S e‏ اله i عت‎ S e -‏ - يهودي بريطاني يعتلي محطة انتظار الباصات للتعبير عن دعمه > تتا يي توح «م
817898513675361,Arab-London عرب لندن,24,82,وزير الدفاع البريطاني غرانت شابس يؤكد على حق إسرائيل في قتل المدنيين بينما يتم ملاحقة حـ.ـمـ.ـاس.#عرب_لندن,2023-11-13:13:26,h t t p s : / / s t a t i c . x x . f b c d n . n e t / r s r c . p h p / v 3 / y 9 / r / Z - d b C l Q D X L v . p n g,https://www.facebook.com/arablondon4/posts/817898513675361?__cft__[0]=AZUbErDcGa-g71kTrbqWzVXrHupVQlnl_Z0wAIl8-hNij6bNWLRXFYnS21vkdHMs-5ITkbfHOX2FkF10k5xCRaPCB-uS_34qCXNWJy5BivbAZ2juXhgHP8erVM9MMc8BfZ7w2xLx-cSVLQM9s5-2BvT-sFD-F8HFQs8ylqN-9uhWqMkMJycJ8lCOzeDwAYDnRcUUmPL-5A2vBAIZ1rLJ7mn1&__tn__=%2CO%2CP-R,1
817890057009540,Arab-London عرب لندن,33,31,إقالة سويلا برافرمان للمرة الثانية من منصب وزيرة الداخلية.#عرب_لندن,2023-11-13:13:26,h t t p s : / / s c o n t e n t . f t u n 1 6 - 1 . f n a . f b c d n . n e t / v / t 1 5 . 5 2 5 6 - 1 0 / 3 9 8 3 2 9 0 5 0 _ 2 3 9 9 2 7 2 8 4 3 6 0 8 0 7 2 _ 4 8 9 0 5 3 5 8 3 1 9 3 7 1 8 0 0 3 2 _ n . j p g ? s t p = d s t - j p g _ p 1 8 0 x 5 4 0 & _ n c _ c a t = 1 0 7 & c c b = 1 - 7 & _ n c _ s i d = 1 a 7 0 2 9 & _ n c _ o h c = Y A R u r 9 r h Y o g A X 9 w 9 _ T a & _ n c _ h t = s c o n t e n t . f t u n 1 6 - 1 . f n a & o h = 0 0 _ A f A h 9 G v E 3 N r a d Z 0 S o d s O W g X 2 Z f L i t 0 s C y M H K j l T a i D B 2 N g & o e = 6 5 5 6 A F 6 4,https://www.facebook.com/arablondon4/posts/817890057009540?__cft__[0]=AZUv4yeDclyM0AlRjRg0G7Jv0M8mDDRQrOxoPN9OXtgEGhPgWGUhPtYLMjTRf7F-M_Nt3hWPC9mLrhqI-QBq0Rm-2NmV7pN4VnMEbHnAYNlWNuyppoLtgYrPwfxl_VsKmdUpCaMzMRuMisuLqS2ot33zQQr8oFng8CPZS0iYDYfWA-6yyMUGrik50lgijit7sLRSyZvDz5HTtqhsedj6atIE&__tn__=%2CO%2CP-R,"د ناه ١‏ = e |‏ 7‘ 5 3 + - ل — 3 > م S‏ \‘,»\ . 25 حل b L, P‏ اس ا et g [l ١‏ A g‏ NS . -‏ اح ملق قبل عام في أعقاب الفوضى التي تركتها ليز تراس"
