id,name,shares,comments,content,posted_on,image,post_url,image_content
pfbid02MQyqtZ5tbpEbQhLd6brXCj6CohxWVaNgqmgGewTq7faHPkikgEqLw1xJS6r2bUAbl,Arab-London عرب لندن,0,0,موجز أخبار بريطانيا من موقع ومنصة #عرب_لندن الأحد: 5 نوفمبر/ تشرين الثاني 2023,2023-10-07:22:56,h t t p s : / / s c o n t e n t . f t u n 1 5 - 1 . f n a . f b c d n . n e t / v / t 3 9 . 3 0 8 0 8 - 6 / 3 9 8 8 9 7 1 5 7 _ 8 1 3 1 1 2 1 4 0 8 2 0 6 6 5 _ 7 3 8 3 5 0 3 2 3 9 1 1 1 7 0 7 4 6 5 _ n . j p g ? s t p = d s t - j p g _ p 5 2 6 x 2 9 6 & _ n c _ c a t = 1 0 5 & c c b = 1 - 7 & _ n c _ s i d = 5 f 2 0 4 8 & _ n c _ o h c = K N Y 2 P f N N V B U A X 9 W n 9 u j & _ n c _ h t = s c o n t e n t . f t u n 1 5 - 1 . f n a & o h = 0 0 _ A f D e j W Q c H I B o 8 - s e E h k a H 6 E n o B _ e 6 o Y H 3 A g Q _ N 1 q e g 0 k n g & o e = 6 5 5 5 7 E A D,https://www.facebook.com/arablondon4/posts/pfbid02MQyqtZ5tbpEbQhLd6brXCj6CohxWVaNgqmgGewTq7faHPkikgEqLw1xJS6r2bUAbl?__cft__[0]=AZXakSUGwY3F_P9t-oJtIQJqCLStH-z9HvrwEabxNCC3J8kfO2qDCZ65Qhkxpm9o7YTo9Jy3nbnp74iVndQFWdg1_NRpk1qMjjcjiJfPYIHULHMk40TsVl9J1MjgVihO5Wixij7-C2yFfyE-3keAVpL9M-fDNWBLm4FbW3Wmp7K8h-UMEvGnLtHNFhXQF2YKBm5etpxkqrJ3LLm3j18Yu2YT&__tn__=%2CO%2CP-R,1= 5 ع 2023 - o‏ أول مؤتمر صحفي يعقد في gail‏ لأهالي شهداء غزة o‏ رغم تحذيرهم .. مسيرات حاشدة في لندن ومدن بريطانية أخرى تضامنا مع الفلسطينيين م سويلا بريفرمان تعتزم التصدي للمشردين الذين يسكنون الخيام في الشوارع العامة ® تغطية خاصة لعرب لندن للوقفة المناصرة لغزة بلندن.. شاهد أبرز الخطابات والشعارات. » لينكر لبريفمان: التظاهر من أجل السلام ليس مثيرا للكراهية ترم تفاصيل Al‏ على صفحانا على مواقم التواصل الاجتماعي. مضق - بسع | @iz‏ www.arab-london.com‏
pfbid05e26DppE9ngF21KPf5rvyWTjiTNYU8QSWWkANJexiS2osmnScQkHnmpCFt6e6pxWl,Arab-London عرب لندن,26,35,"المذيع البريطاني إيان ديل يقول لمتصلة ""أنتِ تثيرين اشمئزازي"" بسبب مدافعتها عن المسيرات المناصرة لفلسطين.#عرب_لندن",2023-10-07:22:58,h t t p s : / / s c o n t e n t . f t u n 1 5 - 1 . f n a . f b c d n . n e t / v / t 1 5 . 5 2 5 6 - 1 0 / 3 8 4 5 3 9 0 1 4 _ 2 7 6 6 8 0 8 8 8 6 9 0 1 8 0 _ 4 0 0 5 7 9 2 9 2 4 5 4 8 8 1 6 4 9 0 _ n . j p g ? s t p = d s t - j p g _ p 9 6 0 x 9 6 0 & _ n c _ c a t = 1 0 7 & c c b = 1 - 7 & _ n c _ s i d = 1 a 7 0 2 9 & _ n c _ o h c = n l R T b 4 P s 1 7 o A X 9 g y i O k & _ n c _ h t = s c o n t e n t . f t u n 1 5 - 1 . f n a & o h = 0 0 _ A f D V d u u p Q 0 K T q L K 4 n o 6 N 6 Y t - X c a a Q H z Q j U 2 s m E o D V A U m c Q & o e = 6 5 5 5 A D 1 A,https://www.facebook.com/arablondon4/posts/pfbid05e26DppE9ngF21KPf5rvyWTjiTNYU8QSWWkANJexiS2osmnScQkHnmpCFt6e6pxWl?__cft__[0]=AZXF_yFpOF-sjP8Og_o8Xy6tgfo4oIJEx-N2zZYmfyeNLkEt6mnZIOmRiZSQSW3IqQcXcXa-Okqs8rZCHt3X3kNWIx8tGO_P5Y52CV5Mv2x756X65hRSV86w3rJe4mQouML8tno07c8Sk-a90IVo5b6ZDHx6ItOmhHuxXOFMtGaeHug7Lbh0vkF0SfYylUWgcJZu3WYZc12C562Zte_9AqjE&__tn__=%2CO%2CP-R,"LBC | عب‎ ب‎ XA LEADIY ‘ JONVERS لال 86 يا إلهي أنت تقلبين الطاولة الآن 4 B < -,"
pfbid02YaNu9y9syXp2Wyotd4TzzHEBcTQtQ2WAFWSZG5XmWB4qBZuvkhRq29eq1ZQcwCV4l,Arab-London عرب لندن,55,11,تغطية خاصة لعرب لندن للوقفة المناصرة لغزة بلندن.. شاهد أبرز الخطابات والشعارات  #عرب_لندن,2023-10-08:02:02,h t t p s : / / s c o n t e n t . f t u n 1 5 - 1 . f n a . f b c d n . n e t / v / t 1 5 . 5 2 5 6 - 1 0 / 3 8 5 5 2 6 9 2 8 _ 1 0 6 4 0 7 2 7 8 4 8 3 4 4 9 7 _ 7 1 3 4 9 2 5 5 4 3 0 0 4 2 0 2 4 6 3 _ n . j p g ? _ n c _ c a t = 1 0 2 & c c b = 1 - 7 & _ n c _ s i d = 1 a 7 0 2 9 & _ n c _ o h c = _ B y U M t m - t O E A X _ R x 3 J 7 & _ n c _ h t = s c o n t e n t . f t u n 1 5 - 1 . f n a & o h = 0 0 _ A f A B i w g z t d a T g X J H R 7 Q _ 7 3 b c M W w P 8 b 7 X i f W e g l J 6 e y 6 f k w & o e = 6 5 5 5 2 C 1 3,https://www.facebook.com/arablondon4/posts/pfbid02YaNu9y9syXp2Wyotd4TzzHEBcTQtQ2WAFWSZG5XmWB4qBZuvkhRq29eq1ZQcwCV4l?__cft__[0]=AZW_8CIu8lpXhXyJzlfe6Jen1bsAM-fLJyfb4wbh14WMu0H0Gl6dyGIAegnY4KaX3lAt9tQmzW2rnmxq_rd-bc24xf8_3NLoiEDf0IrKbJTEyeyJgVhVtmVmAyqA3IkV8jlP4O-2iZablRpq8UB246MPkJEfJXmmg2lygs7gR7vJg45e88dzkz79ylGinzVldKLPbguuVVNCnf-DdlJeycCq&__tn__=%2CO%2CP-R,"il 5 e -{""[[‘ [l.‘ | st ا‎ § ا ل A‏ = Y gy.,,;’ - = الال تا عي"" o J LY RSN 3 ¥ EJ' ‘(l’ تغطية خا ""لخر للوقفة المتاضرة لغزة بلندن..‎ { 3 B 3 -"
pfbid02gzL3XVJuw3SYdymcPXSKqC32zBZ3Jf5JkX2F3E53Rd9qEQXSjrBzHgifmYeGt4ZCl,Arab-London عرب لندن,6,22,نائب رئيس الوزراء أوليفر دودن يصف المسيرات المناصرة لفلسطين بأنها مليئة بالكراهية وأن الهدف منها هو التخويف والاستفزاز.#عرب_لندن,2023-10-08:02:13,h t t p s : / / s c o n t e n t . f t u n 1 5 - 1 . f n a . f b c d n . n e t / v / t 1 5 . 5 2 5 6 - 1 0 / 3 8 5 4 7 9 3 7 9 _ 1 0 0 9 0 9 5 4 5 6 8 3 6 1 4 7 _ 6 8 5 7 8 5 4 7 5 6 7 9 4 5 7 6 6 5 1 _ n . j p g ? s t p = d s t - j p g _ p 1 8 0 x 5 4 0 & _ n c _ c a t = 1 1 1 & c c b = 1 - 7 & _ n c _ s i d = 1 a 7 0 2 9 & _ n c _ o h c = S f C l Z 4 X c B y I A X 9 i 9 D d p & _ n c _ h t = s c o n t e n t . f t u n 1 5 - 1 . f n a & o h = 0 0 _ A f D Q L O b w E 3 n P p y F v d E M M G O r L E V j n Y n g T p K Z e V - o Q Q F h L E w & o e = 6 5 5 6 C 3 5 7,https://www.facebook.com/arablondon4/posts/pfbid02gzL3XVJuw3SYdymcPXSKqC32zBZ3Jf5JkX2F3E53Rd9qEQXSjrBzHgifmYeGt4ZCl?__cft__[0]=AZUhLDMMbPHACH-LhUmbRXbfI7RaF3jXHIQgKfzAOsiESJY2chwo5P-_jPVICDyJtOpg5gINwyZxaOlhu4C3yQZq3ELotlPRSYjS3pTprMx4vNE3jw5292nTI7m8Ua8K5CUqvJzZiYLLu8fjXVqUboGH7FzMREqhLnmvZUk-5-HhqwGBZ8LY-2RchIl3UbmuxUu8R_bEa_H0HTi12elwjuMc&__tn__=%2CO%2CP-R,"| m 1 بيجا‎ ¥ 'V يبدل‎ PR ١ ا‎ s “ل‎ أو ""من النهر إلى البحر"" ندرك أن الهدف من ذلك‎ ."
2441227472722891,Arab-London عرب لندن,0,0,"علاج واعد لمرض الزهايمر برنامج ""طبيبك في بريطانيا"" يأتيكم كل يوم أحد الساعة ١١ صباحا بتوقيت لندنحصريا على منصات ""عرب لندن"" على شبكات التواصل الاجتماعيwww.arab-london.com",2023-10-08:06:37,h t t p s : / / s c o n t e n t . f t u n 1 5 - 1 . f n a . f b c d n . n e t / v / t 1 5 . 5 2 5 6 - 1 0 / 3 9 4 7 6 0 6 4 1 _ 1 2 8 0 1 3 7 9 2 2 6 7 8 8 0 4 _ 9 1 8 2 1 7 0 9 9 3 1 2 7 2 3 9 9 0 6 _ n . j p g ? s t p = d s t - j p g _ p 1 8 0 x 5 4 0 & _ n c _ c a t = 1 0 2 & c c b = 1 - 7 & _ n c _ s i d = 1 a 7 0 2 9 & _ n c _ o h c = D I T e P L r u S r I A X 9 q c 6 2 P & _ n c _ o c = A Q l p b - N 0 1 M H s 4 g E x J q O V J M T x 0 o O p 4 e b o a t 9 f y H f 9 R G A W 7 K K 8 9 4 r 9 o v W d y m H N u D j 3 X f Y & _ n c _ h t = s c o n t e n t . f t u n 1 5 - 1 . f n a & o h = 0 0 _ A f D R h N L T r D s L N k u t Q J Q - Y 7 4 - c A 2 N _ J n _ 5 J a D S A 5 6 2 q Z t t A & o e = 6 5 5 5 B 0 D 5,https://www.facebook.com/arablondon4/videos/2441227472722891/?__cft__[0]=AZXjL1l--9xDLcydiXk-okUs0cFISfU-HXMnRGdikqU4lF2LUW6xwFrVN0Q9Ew2m3U7lpTfs3VuzmAtuyqbvSRmnZLkFzLmewX-W6GEhmmfJZZAmJDQbqxfsyGBVzokwqa7PnJgefdimm98ODlYo91xsKr_fV1wCX_f82saPLIMibaDxbIq3yq_mYF0VeEt5dc0qCvMd7Iyk4BwiS1EVh_Mo&__tn__=%2CO%2CP-R,"ot‏ ال - 2 | 1= L | 0‏ ا نط E""I‏ Ei 8 % T B‏ T‏ ان ص Farahat Mai abid ./ 01‏ 8"
pfbid02LtcwUDGYWjfZiqzADdvbRXdf69UjJuqqME6vj5ameZnuo37NQu35pV4g7DPeHDwNl,Arab-London عرب لندن,0,0,نائبة أميركية من أصل فلسطيني تتهم بايدن بمشاركة إسرائيل في حربها على غـ.ـزة.#عرب_لندن,2023-10-08:07:09,h t t p s : / / e x t e r n a l . f t u n 1 5 - 1 . f n a . f b c d n . n e t / e m g 1 / v / t 1 3 / 1 6 7 7 5 2 8 1 4 6 3 4 4 4 6 5 3 1 0 0 ? u r l = h t t p s % 3 A % 2 F % 2 F a r a b - l o n d o n . c o m % 2 F u p l o a d s % 2 F p h o t o s % 2 F 2 0 2 2 % 2 F s h a r e s % 2 F 0 6 % 2 F 6 5 4 6 8 e 0 b e c 1 3 4 . j p g & f b _ o b o = 1 & u t l d = a r a b - l o n d o n . c o m & s t p = c 0 . 5 0 0 0 x 0 . 5 0 0 0 f _ d s t - j p g _ f l f f f f f f _ p 5 0 0 x 2 6 1 _ q 7 5 & c c b = 1 3 - 1 & o h = 0 6 _ A b G b d i T 2 N V B 8 7 u 4 w Y _ S U g 1 w A A R v o F V A r F U T U R L C B X s a F N Q & o e = 6 5 5 2 B E 6 5 & _ n c _ s i d = d b a d 3 9,https://www.facebook.com/arablondon4/posts/pfbid02LtcwUDGYWjfZiqzADdvbRXdf69UjJuqqME6vj5ameZnuo37NQu35pV4g7DPeHDwNl?__cft__[0]=AZVKgjyR_i2fSLxYVEeOHg39LKPWj0yxc_X4gi1ZPr7gGCalTCV18EnZuq7mS9q4IiDz-at_m65Il_Dh28Es1INXO_HruuGGkXiVLIbbOdPNSbuUAxsFBgUK9CKRNFBtMLTM7T_fDMZmG3BAMp0bPMZD0BafIthM1kFeHxxBdMJJwd81Cs2IjSjec0EhmRIJlW8Zx-rRpiYFzMJ6o4LByRWc&__tn__=%2CO%2CP-R,ا 2 i‏ ٍ ل ا ا ا
pfbid0Kk17za95oVWXt5sFsSdd1i5opPqyiogmCoLXvEH51sP4bVdmyshF1ypucCTobPJGl,Arab-London عرب لندن,0,0,الشيف الفلسطيني أبو جوليا في مظاهرات لندن المناصرة لفلسطين : على قادة العالم أن يضعوا نفسهم مكان الناس في غـ.ـزة. #عرب_لندن,2023-10-08:08:30,h t t p s : / / s c o n t e n t . f t u n 1 5 - 1 . f n a . f b c d n . n e t / v / t 1 5 . 5 2 5 6 - 1 0 / 3 8 4 5 4 2 0 6 1 _ 1 8 4 1 5 3 1 4 2 9 6 9 5 6 8 0 _ 4 5 4 7 6 9 2 1 6 6 1 0 6 9 3 6 3 6 4 _ n . j p g ? _ n c _ c a t = 1 0 6 & c c b = 1 - 7 & _ n c _ s i d = 1 a 7 0 2 9 & _ n c _ o h c = r S V P G n W P x 7 Y A X 8 L X 8 Y p & _ n c _ h t = s c o n t e n t . f t u n 1 5 - 1 . f n a & o h = 0 0 _ A f A p Z i - y e f z 9 p W J d j v g _ 5 N I s m D o 8 e 5 C T q D w W W e 7 F v Z _ X L w & o e = 6 5 5 6 E B D 2,https://www.facebook.com/arablondon4/posts/pfbid0Kk17za95oVWXt5sFsSdd1i5opPqyiogmCoLXvEH51sP4bVdmyshF1ypucCTobPJGl?__cft__[0]=AZVVjjeyDFdapHsOzn19OyqoWfJ-wkBCVpwE7wOseA1dRNf1_4qzOQ1I122cuFBRZQ8-2qf2NUvZ6oXk758_A0q7v52x8XjCcAqum6VET34DULLKpCLgOoVXIcInT9yWGPUIbGx99KWv6YaISrGRuRu36MOA2jGKw9uKM9bwtLwbeCl6YigIBw-y8mGNGIWbBvEXXZGWol8AKS-KDNXUwK8v&__tn__=%2CO%2CP-R,AESINAL MARGg| FORF OP.T F ﬁ—%vw ' ا اد ا 9 نا له
pfbid02Vujh6zT1QQsScywKyKZQxNKByHhnCqCNLPLYtusz9HvyPLkxgBzWmeohDPmAgFm7l,Arab-London عرب لندن,0,0,"غضب من تصريحات برافرمان بأن التشرد هو ""خيار نمط الحياة""تعرضت سويلا برافرمان للإنتقادات من قبل أحد كبار نشطاء حزب المحافظين بعد تصريحاتها بأن حياة المتشردين هي "" نمط حياة"" إختاروه.وقال بوب بلاكمان، رئيس المجموعة البرلمانية لجميع الأحزاب لإنهاء التشرد، إن برافرمان كانت مخطئة في مناقشة قضية معقدة وخطيرة باستخدام هذه المصطلحات، ونصحها باستخدام لغة ""أكثر حكمة"".وقد نشرت برافرمان على موقع إكس: ""لا يمكننا  السماح بالاستيلاء على شوارعنا من قبل صفوف من الخيام التي يشغلها الناس، وكثير منهم من الخارج، الذين يعيشون في الشوارع كخيار لنمط الحياة"". وقالت أنها تخطط لاتخاذ إجراءات صارمة لحظر وضع الخيام في المناطق الحضرية.#عرب_لندن",2023-10-08:09:15,h t t p s : / / s c o n t e n t . f t u n 1 5 - 1 . f n a . f b c d n . n e t / v / t 3 9 . 3 0 8 0 8 - 6 / 3 9 9 8 6 9 2 2 0 _ 8 1 2 9 3 1 3 3 0 8 3 8 7 4 6 _ 3 6 9 1 4 7 7 0 5 9 0 0 7 4 7 3 6 0 _ n . j p g ? _ n c _ c a t = 1 0 3 & c c b = 1 - 7 & _ n c _ s i d = 5 f 2 0 4 8 & _ n c _ o h c = w O U H 6 r n 9 v f s A X 9 l o p m r & _ n c _ h t = s c o n t e n t . f t u n 1 5 - 1 . f n a & o h = 0 0 _ A f B 4 U _ c D S P f v F r v _ i 0 F G z A V k 7 P E 7 8 D 2 p A 5 2 z p X u 7 a K 2 1 U A & o e = 6 5 5 5 E 9 3 E,https://www.facebook.com/arablondon4/posts/pfbid02Vujh6zT1QQsScywKyKZQxNKByHhnCqCNLPLYtusz9HvyPLkxgBzWmeohDPmAgFm7l?__cft__[0]=AZXuWbTAL6Zk6LGaLFZltWEz_5AlAbQh6cYjekK-uI-Wif658nLsVbzOUyH3xxIIFVwSXfzGvgjZUDycPjTD-bEFbteXvMYD5MoLSd8FhNntGoopZRMczlnZH14NUR9JWIYqHulo7QtrXgrojqs49su2O8cGxEOHjoBVIjM1ugEh_mRr9Zn_C0W0qNMzduyjwfYtpMQ5ysaUDoVoiabT7FAC&__tn__=%2CO%2CP-R,"I' = | - E ا‎ > § L i 8 اي‎ اا‎ S "" TR K 1 4 )"
pfbid02h6LRadpWzWYh7WC1XQ1rEMUGNSZz3XxXp1B2s5oVYAMEt2Bm4zXtqHhUADqpeunel,Arab-London عرب لندن,340,118,كلمة الشيف الفلسطيني الشهير أبو جوليا في مظاهرات لندن المناصرة لفلسطين. #عرب_لندن,2023-10-08:11:59,h t t p s : / / s c o n t e n t . f t u n 1 5 - 1 . f n a . f b c d n . n e t / v / t 1 5 . 5 2 5 6 - 1 0 / 3 7 6 3 8 8 0 7 0 _ 6 7 4 8 4 6 2 9 8 0 7 2 7 1 3 _ 3 7 5 5 9 1 6 6 8 7 4 3 9 1 4 4 4 5 4 _ n . j p g ? _ n c _ c a t = 1 0 1 & c c b = 1 - 7 & _ n c _ s i d = 1 a 7 0 2 9 & _ n c _ o h c = q X K N e g 3 l k S I A X 8 k A d 9 v & _ n c _ h t = s c o n t e n t . f t u n 1 5 - 1 . f n a & o h = 0 0 _ A f D F B G m 0 z J t b x 1 H p V 8 t a s S T c n 0 3 5 f l K 4 5 g G H 5 l x t I q p h z A & o e = 6 5 5 6 A 2 8 4,https://www.facebook.com/arablondon4/posts/pfbid02h6LRadpWzWYh7WC1XQ1rEMUGNSZz3XxXp1B2s5oVYAMEt2Bm4zXtqHhUADqpeunel?__cft__[0]=AZX9GUwJA0SbC8A9iJeAe4StvVWtZ6YZlnCo0wXlPo1Wy0818LCQR82UsYytElBXOcdUAx7vuyWJK-wWroHvojG4kMFMXLDKYrwGR58x_C1-t7wTs51e861UvfPbhWp5lghtmVZBJbqbG4vxyhrYG9AXmQRI32eJy_BU1qgHvo8vt1fKusi4F_L659-ZflnwG4cGeqt8gNEW6ShsGzxmi1Ie&__tn__=%2CO%2CP-R,"( الع‎ M BT AR الله‎ ; ام‎ ON | 2 18 4 1] "" = FOA"
pfbid0H6THCrd4MRBHJ7WQsa65UYy5p8jMGgqxBiDwcRp83msgWywKEBoz5F5M8TRU3vXNl,Arab-London عرب لندن,63,10,طفلات يهتفن لفلسطين في تظاهرات السبت بلندن.. #عرب_لندن,2023-10-14:10:08,h t t p s : / / s c o n t e n t . f t u n 1 5 - 1 . f n a . f b c d n . n e t / v / t 1 5 . 5 2 5 6 - 1 0 / 3 7 1 5 0 3 0 9 7 _ 3 0 0 4 9 1 2 8 9 4 5 5 6 1 7 _ 3 8 4 7 0 8 5 3 0 5 2 2 1 5 4 4 2 7 _ n . j p g ? _ n c _ c a t = 1 0 4 & c c b = 1 - 7 & _ n c _ s i d = 1 a 7 0 2 9 & _ n c _ o h c = i s 1 9 k Q a K H _ g A X 9 d _ d Z Q & _ n c _ h t = s c o n t e n t . f t u n 1 5 - 1 . f n a & o h = 0 0 _ A f B T O y g m q K x x 5 z w H X z e z b m 4 t t t 5 R g z r 6 E 0 b Y k P E 3 b J v F x g & o e = 6 5 5 5 B 2 2 A,https://www.facebook.com/arablondon4/posts/pfbid0H6THCrd4MRBHJ7WQsa65UYy5p8jMGgqxBiDwcRp83msgWywKEBoz5F5M8TRU3vXNl?__cft__[0]=AZVTQdR1DfHOiOUvSByJm0Y06f4mRiFTezt3621gkaLdW96VY1GY5hwo4mouIaOrsTAWZZKwETMrQTsLOR7OqsS93EkqoghTqlNWi6d8ey5Z7uov4Dp-8Dm6lno1YfybFbSgzf4oRycJy4Mb4QKL-8suKD-ZQePkdUuwVofIoKY1lBRJx7bi0WgG5XO7z_oIeRrwVGWTGWfl-uIZK6rmubir&__tn__=%2CO%2CP-R,"U ا‎ - عد‎ e ا 2 = ندل‎ 1 i Y. A g. 2ص«‎ ""9 ! 7 2 \ / 7 | N 2 ¢ - Y a;ﬂ;ﬁpﬂlﬂl)ﬁLﬁigﬂba.}hudﬁlaAim_Gujy;jlouﬁb"
pfbid0fwPdPd4qLLYfdXUYz66Q2eViWbf1sDDBX9HZpqnFgu19zAVa7gjYaC8GBBpNqoZCl,Arab-London عرب لندن,664,99,خلال مقابلة مع الجزيرة ….المتحدث باسم الأونروا يجهش بالبكاء لهول ما رأى في غزة..#عرب_لندن,2023-10-14:11:38,h t t p s : / / s c o n t e n t . f t u n 1 5 - 1 . f n a . f b c d n . n e t / v / t 1 5 . 5 2 5 6 - 1 0 / 3 6 8 1 1 8 4 1 4 _ 3 5 1 2 9 9 4 0 4 0 8 2 1 3 3 _ 5 4 1 0 3 5 0 2 3 7 0 0 4 8 8 0 7 1 _ n . j p g ? s t p = d s t - j p g _ p 1 8 0 x 5 4 0 & _ n c _ c a t = 1 0 0 & c c b = 1 - 7 & _ n c _ s i d = 1 a 7 0 2 9 & _ n c _ o h c = T K P Q Z 5 D b q 5 U A X - H U B s z & _ n c _ h t = s c o n t e n t . f t u n 1 5 - 1 . f n a & o h = 0 0 _ A f B _ B E u y a 4 g 5 4 p 4 k H q a m 7 m N v m K i 7 J 9 4 Q Z B M 3 7 Q F p C R x 7 H Q & o e = 6 5 5 5 E 6 B D,https://www.facebook.com/arablondon4/posts/pfbid0fwPdPd4qLLYfdXUYz66Q2eViWbf1sDDBX9HZpqnFgu19zAVa7gjYaC8GBBpNqoZCl?__cft__[0]=AZVmraQ7ZGJiHjfc0HiqcxyZDvt9rNLuqNzhvkHyGIkXlpWbU5sfb_ZlofQtY5UglZ8dAIllqUaXPcCvlIadoF8mCGK-M35TjrHPQFQI0rmHjAAcm19LId89iv4N8uOrQg5zJW265htQwq6yzEwuOFDqxQhp1p752k37yTTz5jJbl5dcy41y-pGvDMEeWKUCawB4g4BzTCM21XtY_1yLjDJ3&__tn__=%2CO%2CP-R,g N إ‎ & 1 0# و ليحرت‎ - L بج جما‎ | LS e . 8 اي‎ u‘ - ض‎ S - / -
pfbid0hbH3VZixSdABLuGVr9yZ92DKJrnWQpVPpX5CHT9W8iEnY9Ss1uEXvr5ncnyH5dPJl,Arab-London عرب لندن,47,3,"تظاهرات مناصرة لفلسطين في اشهر شوارع لندن في ""أكسفورد"" برغم تحذيرات وزيرة الداخلية #عرب_لندن",2023-10-14:14:44,h t t p s : / / s c o n t e n t . f t u n 1 5 - 1 . f n a . f b c d n . n e t / v / t 1 5 . 5 2 5 6 - 1 0 / 3 7 1 5 2 4 6 7 4 _ 1 3 5 8 1 3 4 4 9 5 1 3 0 0 1 2 _ 5 9 6 2 8 3 1 1 0 2 0 4 0 3 6 8 3 6 8 _ n . j p g ? _ n c _ c a t = 1 0 6 & c c b = 1 - 7 & _ n c _ s i d = 1 a 7 0 2 9 & _ n c _ o h c = - c t O g d s 8 x l M A X 9 k 7 B m 2 & _ n c _ h t = s c o n t e n t . f t u n 1 5 - 1 . f n a & o h = 0 0 _ A f C d 6 m I o f B e 4 n v 0 E B V b V p M x 6 X Z _ 3 q c J - V x w J m J 1 h 7 6 4 w p g & o e = 6 5 5 5 B 2 3 C,https://www.facebook.com/arablondon4/posts/pfbid0hbH3VZixSdABLuGVr9yZ92DKJrnWQpVPpX5CHT9W8iEnY9Ss1uEXvr5ncnyH5dPJl?__cft__[0]=AZVuu2Csz2--BjLgBHmCPrWnB0HBfJqQcaOO-8p37v4461f55xTvH46KAnA-EUg2OYfINrMGZZLRJ15zRuBV8scLI7MIoGqvO-5Pwvp1EDu2PeEl-WlUB633bvA28na93sEsinfdlMvTFmkX3aU97UH7B3tiMLfg0HUkcSIpCN0v0sQurspRG_ThxQOaLb3emm-mGQ8aO32NGTrAEHd1nft1&__tn__=%2CO%2CP-R,b =‏ | ض أ [ ©“ ٠‏ 08 ا ب 5 !%‘\' - 3 و بم 3 ما رفوا ؤؤؤ را م ب«اعطلت فك f e ¥‏ : - د ابد لصتاف ١‏ تظاهرا ةكناصرة 5 ين في اشهر شوارع لثدن في «أكشفورد» برعم تحذيرات وزيرة الداخلية
pfbid0wohpHWDchhuHKDFuuKRoQUWbqTpLpdYdfH8UwGEERr3sgVwkn8s1nPxQtX6BRFjml,Arab-London عرب لندن,6,8,"رجال الشرطة البريطانية يتعهدون باستخدام ""كل سلطاتهم"" لمنع المتظاهرين المؤيدين لفلسطين من تعطيل احتفالات يوم الهدنةتعهد رجال الشرطة باستخدام ""كل سلطاتهم"" لمنع المتظاهرين المؤيدين لفلسطين من تعطيل احتفالات يوم الهدنة (يوم توقفت الجيوش عن القتال في الحرب العالمية الاولى) والذي يصادف يوم 11 نوفمبر.وقالت شرطة العاصمة إنها لن تتهاون مع اي تظاهرات تتسبب بتعطيل إحتفالات يوم الهدنة أو احتفالات ذكرى الأحد.#عرب_لندن",2023-10-14:19:54,h t t p s : / / s c o n t e n t . f t u n 1 5 - 1 . f n a . f b c d n . n e t / v / t 3 9 . 3 0 8 0 8 - 6 / 3 9 8 7 3 8 6 0 9 _ 8 1 2 5 6 7 1 5 4 2 0 8 4 9 7 _ 5 4 1 4 6 4 1 1 6 4 9 4 3 7 3 4 5 7 _ n . j p g ? s t p = d s t - j p g _ p 1 8 0 x 5 4 0 & _ n c _ c a t = 1 0 2 & c c b = 1 - 7 & _ n c _ s i d = 5 f 2 0 4 8 & _ n c _ o h c = Y w p Z W K _ w 7 c Y A X 8 A 4 n c r & _ n c _ h t = s c o n t e n t . f t u n 1 5 - 1 . f n a & o h = 0 0 _ A f C E q _ o x U 9 w i w I p u - g G s B i 7 U x I - h 1 3 9 d G P u h a h V S y C 2 3 K w & o e = 6 5 5 6 0 E A 4,https://www.facebook.com/arablondon4/posts/pfbid0wohpHWDchhuHKDFuuKRoQUWbqTpLpdYdfH8UwGEERr3sgVwkn8s1nPxQtX6BRFjml?__cft__[0]=AZWDAMcuvDMPUxhLHlAKbYmEqJUgQw2BjgadBpqWqWCQUrwFazZAuoFNwRS5mqBRzL_mqCQaPaxJVAN95OaAvQv7i8aUQylEX9Ak8F4ANWcb4Rb0K5W50uCMTjn-eDWhOA4pt7tV-6i43yr7LJF4zsCvtU7-YBirAC5gHSE52nNI7ik7d57Wcqao8DrruK2LATwxw-FEbAwlDDJuOrg8HdQh&__tn__=%2CO%2CP-R,"م L‏ ‘ = ال سا b;‏ ¢ S ""ok‏ ,. جح د | ا يا 5 0 ل % ب م داريا * سيا لي v‏ 7 د A‏ 9 [ 2\l‏ ! A‏ P‏ د o‏ g5 +‏ - 4 W‏ / - 4"
pfbid0hc3PAz1NwbXHNRpTGgmstMoJaniMH78hwLa1LTxekfyfaN5mCpLunECbi6p3ETKvl,Arab-London عرب لندن,13,36,"المستشار القانوني دانييل جانير يطالب الشرطة بتقييد المظاهرات المناصرة لفلسطين بحجة أنها ""داعمة للإرهاب"".#عرب_لندن",2023-10-14:20:04,h t t p s : / / s c o n t e n t . f t u n 1 5 - 1 . f n a . f b c d n . n e t / v / t 1 5 . 5 2 5 6 - 1 0 / 3 6 7 5 8 9 3 2 0 _ 6 8 9 3 7 6 1 3 1 0 6 6 0 4 2 2 _ 3 5 3 0 1 8 6 2 3 6 7 1 9 7 9 2 6 8 0 _ n . j p g ? s t p = d s t - j p g _ p 1 8 0 x 5 4 0 & _ n c _ c a t = 1 0 3 & c c b = 1 - 7 & _ n c _ s i d = 1 a 7 0 2 9 & _ n c _ o h c = u y W 4 4 E p Q M Y Y A X _ 0 3 u s C & _ n c _ h t = s c o n t e n t . f t u n 1 5 - 1 . f n a & o h = 0 0 _ A f D y F A o K B o s R o y h 0 z 0 T l 6 P 7 7 j T D U Z D 2 z c f 0 x F J b V P b b O X w & o e = 6 5 5 6 7 C F 1,https://www.facebook.com/arablondon4/posts/pfbid0hc3PAz1NwbXHNRpTGgmstMoJaniMH78hwLa1LTxekfyfaN5mCpLunECbi6p3ETKvl?__cft__[0]=AZXQ5EBbLNCIYB__siYRsxg4tEgZgK9GJCck_2doaOFKQUuzrH9JIuwqdeEVCLvhHp4_jqnKNqK_v-0Zk7V0cJTqDRWIV1sLAA9XEoquGV4HKNeHb6YR7HUKKvb_0EJMexo9WEx--MNFyxHPzKdeoJtKH2Wf1tedTLV8tUc-VX9Hie3L2N1YYNGi2g9GZ319gLZsXn5DAidF_GceCBYNDJeA&__tn__=%2CO%2CP-R,"QLT g ¢ 7‏ ما لتدل 2د 0 لا BN‏ مضي ات 3 الريك Al L L‏ ٍ ا Ny, gt‏ جنا ذنم - ا VA i: N5‏ ل . 1"" رلا ا #0 ُُ ا ا o Q'‏ “يت يو ا نا 0 1 اند 7 , f‏ 7 سٍِ ل .4 - - ٍ ف . كي الهم A o | B‏ وهذا يعني أن على الأشخاص أن يتمتعوا بحق التظاهر"
pfbid02YnAzVrfYEog5kHEHoaiNvT9wLWYCSGHJEWNuUXXkLPYGjQ2BZgfrqMTVJKmdDWDel,Arab-London عرب لندن,0,0,موجز أخبار بريطانيا من موقع ومنصة #عرب_لندن السبت: 4 نوفمبر/ تشرين الثاني 2023,2023-10-14:21:18,h t t p s : / / s c o n t e n t . f t u n 1 5 - 1 . f n a . f b c d n . n e t / v / t 3 9 . 3 0 8 0 8 - 6 / 3 9 8 7 8 3 9 2 5 _ 8 1 2 5 3 9 5 5 4 2 1 1 2 5 7 _ 1 5 4 9 4 9 9 3 2 9 9 0 2 1 8 3 8 0 5 _ n . j p g ? s t p = d s t - j p g _ p 5 2 6 x 2 9 6 & _ n c _ c a t = 1 1 1 & c c b = 1 - 7 & _ n c _ s i d = 5 f 2 0 4 8 & _ n c _ o h c = w P k w E 1 L y e X k A X 8 x l W Q F & _ n c _ h t = s c o n t e n t . f t u n 1 5 - 1 . f n a & o h = 0 0 _ A f D 1 5 b R 5 L U K S 2 0 g 2 6 O D b I i x y 3 t W k C r A V D k A T 4 X x 8 i H 9 4 h w & o e = 6 5 5 6 0 C 1 A,https://www.facebook.com/arablondon4/posts/pfbid02YnAzVrfYEog5kHEHoaiNvT9wLWYCSGHJEWNuUXXkLPYGjQ2BZgfrqMTVJKmdDWDel?__cft__[0]=AZVRvyzRetGURmNPwhtwoYDda-mdmzvLbjx7ytq2ddehE5vT7Hl9SnlMKPuPdV1PjI5wJlMYTo06lU4FMgaUQpn-hMJXu2IDIXUofPFQXtFOKQ_A9LFpfGn-jVj9HotUwan2ModwYFpe7vG0xe0eSWD4Upf20j08CaRX2M1jkIJ81uumrwT9oiBjAUmzHZvzFkwqW9LYQsVcuF6ZuMfRiKAJ&__tn__=%2CO%2CP-R,"1 [ o f 4 عر‎ 2023 م مركز حقوقي يطالب الخارجية البريطانية بتفسير سبب‎ سفر بريطانيين للمشاركة في العدوان على غزة‎ فيديو: معرض وثائقي في لندن يروي محنة‎ @ الفلسطينيين منذ النكبة‎ محتجون يحاصرون أكبر محطة للقطارات في لندن‎ @ تضامنا مع غزة‎ بريطانيا تحاكم سيدتين بتهمة ""الإرهاب"" إثر‎ @ مشاركتهما في تظاهرات مناهضة لما يقع في غزة‎ سوناك ينتقد المظاهرات الداعمة لفلسطين‎ © كم تفاصيل 3 على صفحانا على مواقم التواصل الاجتماعي‎ بسسيسى‎ (T R مق‎ www.arab-london.com"
pfbid06DmMWT2b25we8AWw7z2X5sRK58PW6dfdoFcPCH7Mv6xvQ1ajBgrDUvUGamnibbezl,Arab-London عرب لندن,0,0,سوناك ووزيرة داخليته سويلا تركوا أشغالهم وتفرغوا لمهاجمة التظاهرات المناصرة لفلسطين بدلا من وقف العدوان الإسرائيلي؟!!!#عرب_لندن #بريطانيا_في_دقيقة,2023-10-15:02:54,h t t p s : / / s c o n t e n t . f t u n 1 5 - 1 . f n a . f b c d n . n e t / v / t 1 5 . 5 2 5 6 - 1 0 / 3 7 0 1 9 0 9 1 0 _ 2 9 3 6 4 6 8 8 0 2 9 0 2 3 2 _ 3 7 1 0 6 0 0 7 9 8 1 2 5 0 7 4 7 5 4 _ n . j p g ? s t p = d s t - j p g _ p 1 8 0 x 5 4 0 & _ n c _ c a t = 1 0 9 & c c b = 1 - 7 & _ n c _ s i d = 1 a 7 0 2 9 & _ n c _ o h c = P x u Z U 4 L Z A p g A X _ I p T 5 q & _ n c _ h t = s c o n t e n t . f t u n 1 5 - 1 . f n a & o h = 0 0 _ A f C K 1 Q V D e t N p C a 2 7 6 5 z 7 _ p H n x u w y 8 L m v K d U i N P m J b a s P y Q & o e = 6 5 5 5 1 2 6 8,https://www.facebook.com/arablondon4/posts/pfbid06DmMWT2b25we8AWw7z2X5sRK58PW6dfdoFcPCH7Mv6xvQ1ajBgrDUvUGamnibbezl?__cft__[0]=AZXBb2Fsxt180a4ifh5ww_38FgFVFBp0d8J0_VZQDAiYRD7Q1tVKi8K_PBlGOH3hZFtgAuXeUAGYwWi3X1qIz6F6HpHlP50gwj2o468QJ6EhW4GznKxwY2zvNyqyuthalPCEpZnVthES9G5jnxZ4l-Alo98ti8_eUjtsDft5Zpp64elUhSe3kdcD3fPuNyO2YuHhOXzddSxVUC1d_DHRzgql&__tn__=%2CO%2CP-R,"انييس خض | 5= ال oo‏ 4 دفلظة ا s‏ /[ ا _قبي Yy -7 s‏ _ صصح ' 1 e‏ 7 0:2 ا = o‏ X‏ \% : ب 5 % & 1 ١‏ “ََ ِ / ابر ل » . ع 7 "" ~— ١ ١‏ وناك ووز «اعيته اهرهم أذ في i‏ م سد ا تاج 1 جب بدلا من Giag‏ العدوان MLl‏"
