id,name,shares,comments,content,posted_on,image,post_url,image_content
pfbid0CJJ7CfK5o8PjFYvupdSMi4r5wVMniV6dW4AjriPy6kcHk7pyreFrke21aVPMfAEQl,Arab-London عرب لندن,9,11,"رفض وزير الدفاع غرانت شابس القول ما إذا كانت سويلا برافرمان ستظل وزيرة للداخلية الأسبوع المقبل وسط دعوات متزايدة لإقالتهاوقال شابس إن ""أسبوعا هو وقت طويل في السياسة"" وإنه ""لن يتنبأ أبدا بهذه الأمور"" لأنها مسألة تخص رئيس الوزراء.وجاء رفضه لدعم برافرمان في الوقت الذي تواجه فيه ضغوطاً متزايدة للاستقالة، بعد إتهامها بتحريض حشد من المتظاهرين اليمينيين المتطرفين على النزول إلى لندن ومهاجمة الشرطة في يوم الهدنة.#عرب_لندن",2023-11-12:17:12,h t t p s : / / s c o n t e n t . f t u n 1 5 - 1 . f n a . f b c d n . n e t / v / t 3 9 . 3 0 8 0 8 - 6 / 4 0 1 2 8 4 7 4 5 _ 8 1 7 3 5 7 7 4 7 0 6 2 7 7 1 _ 3 4 7 1 8 3 8 6 9 6 9 8 0 1 9 9 6 5 6 _ n . j p g ? _ n c _ c a t = 1 0 4 & c c b = 1 - 7 & _ n c _ s i d = 5 f 2 0 4 8 & _ n c _ o h c = u T d f 3 R p x 6 g U A X - n S 2 X e & _ n c _ o c = A Q m c T D _ X 2 v o g m K W 8 D a 6 2 V S V r X N 2 9 E d Z A C t 1 n e 7 z j a I T z C 5 M i 3 R B r o J F F H s 0 q F w d P 7 p I & _ n c _ h t = s c o n t e n t . f t u n 1 5 - 1 . f n a & o h = 0 0 _ A f D m o - _ G - 4 u u A s 6 m p k 0 u T z L k 7 j e L A L E X G X o 9 7 n 9 t m 6 G K u Q & o e = 6 5 5 6 6 1 6 1,https://www.facebook.com/arablondon4/posts/pfbid0CJJ7CfK5o8PjFYvupdSMi4r5wVMniV6dW4AjriPy6kcHk7pyreFrke21aVPMfAEQl?__cft__[0]=AZXnmLdx2zRWaN6UE6vKBVK22yTNrH4dLDJQEsCzTVezWwUeyi_xgzA_VoBz3u7s2phwwWhUHYL09VjfAirbyHd4atDDfYqdO1WueHwFYyhWDoguMYSnA8znTbfVTVHwQDAKOff07dPE530uqULr_gfyNUvFilyuQBBVIr54rExQ4fklOneieLdGBusLnTQCJHin5viLr5-yioo7wn6PIB_x&__tn__=%2CO%2CP-R,"i 13 % \ , 2 i _ = % الذي‎ ™ ® ويس‎ - - VS ل‎ — PN - - F . = . A w ‘ .ل‎ 0 2 0 ا‎ s ض‎ - — 1 م‎"
pfbid0pDv2J8G6KW475zmF85mkTUmy9z8rWcxWCFYFk4zgERfXBZAYSeu9dFomFR6q8wwCl,Arab-London عرب لندن,24,44,"شاهد: مقدم البرامج التلفزيونية المصري معتز مطر يتعهد بمقاضاة حكومة بريطانيا لاستعادة إقامتهحيث قال مطر: ""أعتبر أنا أول أجنبي تلغي وزارة الداخلية البريطانية تأشيرته، وتضعه على قائمة المراقبة"". وأشار مطر إلى أنه سيقاضي حكومة بريطانيا على هذا القرار، بمن في ذلك رئيس الوزراء البريطاني ريشي سوناك ووزيرة الداخلية البريطانية سويلا برافرمان"".وأوضح مطر أنه سيذهب إلى القضاء البريطاني مباشرة، قائلاً: ""إن بريطانيا ليست سوناك أو برافرمان."" وكان مطر قد قال في تصريحات سابقة له ""إن حمـ.اس ليست منظمة إرهابية"".وقارن مطر ما تقوم به المقاومة في فلسطين بالمقاومة الأوكرانية ضد الاحتلال الروسي على حد قوله، وقال: ""هل تعتبر الحكومة البريطانية دفاع أوكرانيا عن نفسها إرهابا؟ كما تعتبر دفاع الفلسطينيين عن أنفسهم إرهاباً؟ مع فارق أن الاحتلال الإسرائيلي على فلسطين منذ أكثر من 70 عاماً"".#عرب_لندن",2023-11-12:14:12,h t t p s : / / s c o n t e n t . f t u n 1 5 - 1 . f n a . f b c d n . n e t / v / t 3 9 . 3 0 8 0 8 - 6 / 3 9 8 5 7 6 7 9 8 _ 8 1 7 2 9 1 8 9 3 7 3 6 0 2 3 _ 8 1 3 5 3 4 8 8 8 9 5 0 8 2 0 3 0 2 5 _ n . j p g ? s t p = d s t - j p g _ p 1 8 0 x 5 4 0 & _ n c _ c a t = 1 0 3 & c c b = 1 - 7 & _ n c _ s i d = 5 f 2 0 4 8 & _ n c _ o h c = 5 i x f 6 S 7 B y o w A X 8 p G K S r & _ n c _ h t = s c o n t e n t . f t u n 1 5 - 1 . f n a & o h = 0 0 _ A f D f g V Q l s b j W _ x R U W F f I i M d n B I l E p j e V c X 2 e Q E s v 5 0 w I 8 A & o e = 6 5 5 5 F 3 4 D,https://www.facebook.com/arablondon4/posts/pfbid0pDv2J8G6KW475zmF85mkTUmy9z8rWcxWCFYFk4zgERfXBZAYSeu9dFomFR6q8wwCl?__cft__[0]=AZWrNf15IXi1j6ecxf8sIBWsxamOgcEq7K9mFXTQ_LY5NMlNBiyR7GnqHlHuaWFoyHMrTcRJbL5ufyokH4TVzNgJn1Q7dYM_UZ_M8q8EUDQoaqfJAXU65CM3ZrHTtBNOClL3CcMTj47X6ExMDgc3YIRbpqiii9cn3uuJCKFAu93W6pOVSiJOD_7oKceG93yMNUikz3FyNVNUpR1IJp4ymRcq&__tn__=%2CO%2CP-R,< i 7 A (G NS j
pfbid02zVseE6bAqeL8sVsrHXXyNn5jASM8rdpbNQdFCqA96oUgvh7WTjqNCQuDZtUHDNU8l,Arab-London عرب لندن,3,5,"إصابة تسعة من ضباط الشرطة البريطانية وهم يحمون النصب التذكاري من "" اليمينيين المتطرفين العنيفين ""الهوليغانز""وقد أدانت الشرطة سلوك ""الهوليغانز"" الذين ""أمضوا معظم اليوم في مهاجمة أو تهديد الضباط"" الذين يحمون النصب التذكاري.وقد اعتقلت قوات الشرطة عدداً من مثيري الشغب يوم السبت.#عرب_لندن",2023-11-12:14:12,h t t p s : / / s c o n t e n t . f t u n 1 5 - 1 . f n a . f b c d n . n e t / v / t 3 9 . 3 0 8 0 8 - 6 / 4 0 1 1 9 1 5 6 0 _ 8 1 7 2 8 9 2 1 0 4 0 2 9 5 8 _ 7 0 7 3 7 7 7 7 8 9 2 9 7 8 5 7 3 0 6 _ n . j p g ? _ n c _ c a t = 1 0 2 & c c b = 1 - 7 & _ n c _ s i d = 5 f 2 0 4 8 & _ n c _ o h c = I M 5 o P O r X u a E A X 9 a T E 2 g & _ n c _ h t = s c o n t e n t . f t u n 1 5 - 1 . f n a & o h = 0 0 _ A f C M E i 7 H s G p G o X G j 2 c Z v L E A D e Y E r - p a h C h P 5 y N v O Y q 0 O v w & o e = 6 5 5 6 6 3 1 B,https://www.facebook.com/arablondon4/posts/pfbid02zVseE6bAqeL8sVsrHXXyNn5jASM8rdpbNQdFCqA96oUgvh7WTjqNCQuDZtUHDNU8l?__cft__[0]=AZWrQ7kfEqMcyA63iB-G0ZGHIDsowSGz_3-8GwQs9hr-gAmskHlKiBEqz97td7ikN9tLEdTVDdrEASiwXpZPI4EhjGpcj4kgdLvyQLETNQ8CTsTUwPkeCCm57XoFLNkztnIpugMh1L0ngkBqqIzcfhI5pfm1L-ZWy8y9wo7Cehq6Fl6E6t9Nqyr-Kl8Ar_sY0Hs4rxRj1Le9DcOtnDfjrpes&__tn__=%2CO%2CP-R,"AN U= a2 Jacdit. 8 ! , ا ا اج‎ = eSS ["" تسر وك - & بال‎ سن‎ N \ A A - نا‎"
pfbid0gZsGgYnfFNDYGE81hTxTGLcB7eHFTztbXhYjLfZWFFxmMXmubSZcRknwm2D8KTASl,Arab-London عرب لندن,0,2,موجز أخبار بريطانيا من موقع ومنصة #عرب_لندن الأحد: 12 نوفمبر/ تشرين الثاني 2023https://arab-london.com/posts/22928https://arab-london.com/posts/22930https://arab-london.com/posts/22927https://arab-london.com/posts/22924https://arab-london.com/posts/22920,2023-11-12:14:12,h t t p s : / / s c o n t e n t . f t u n 1 5 - 1 . f n a . f b c d n . n e t / v / t 3 9 . 3 0 8 0 8 - 6 / 3 9 8 5 8 6 3 0 1 _ 8 1 7 2 7 5 4 7 3 7 3 7 6 6 5 _ 3 3 7 7 9 7 3 8 9 3 2 1 6 9 6 4 3 6 7 _ n . j p g ? s t p = d s t - j p g _ p 5 2 6 x 2 9 6 & _ n c _ c a t = 1 1 1 & c c b = 1 - 7 & _ n c _ s i d = 5 f 2 0 4 8 & _ n c _ o h c = 9 4 7 E i Q j _ a w A A X 8 P 4 9 z B & _ n c _ h t = s c o n t e n t . f t u n 1 5 - 1 . f n a & o h = 0 0 _ A f D e E q N K H a c d p x k - l P a C e K t 2 A K 7 a 9 J e G e t 9 Z u 2 o v I V b - I A & o e = 6 5 5 6 B E 5 2,https://www.facebook.com/arablondon4/posts/pfbid0gZsGgYnfFNDYGE81hTxTGLcB7eHFTztbXhYjLfZWFFxmMXmubSZcRknwm2D8KTASl?__cft__[0]=AZUsrHmAOLJExUz_eRZhFAJ0Bkbgayl5UDJyRXkG6lCgHVIL_O0aAcj-v0EN-fAvFgwkSJNufv69uBv0f6kDQ43xlW1DcDPUWtvuOg3d9IudiTdo6HpkcM21ZwIYWMmV-3daVR90SCcKqHOTK6k3kaGIlUUZG0r5mDDeohERzHcWutTIWjsZ_LjiGW3aioiYwEtgoNXkqzfYgoZvMzJRelwA&__tn__=%2CO%2CP-R,انك 2 12 اع 2023 @ فيديو/ بريطانيا في دقيقة: مليونية السبت دعم لفلسطين وتنديد بعنصرية سويلا برافرمان o‏ - شاهد: تغطية خاصة لعرب لندن لمليونية السبت. المناصرة لفلسطين بلندن @ يمينيون متطرفون يعتدون على مؤتمر حول فلسطين في فرنسا o‏ شرطة لندن تشيد بتظاهرة التضامن مع فلسطين. © شاهد . انهيار طبيبة بريطانية أثناء قراءتها رسالة. من مدير مستشفى الشفاء &4y‏ كم تفاصيل 3 على صفحانا على مواقم التواصل الاجتماعي يف6 - تتسسسى . مسسيسم www.arab-london.com‏
pfbid0RVXkWkjttBEBmfjTbzKGH2Vz4BMGHJz6eZY3uAFeqhzHhnr4VTQcyiAu9B8vPwMMl,Arab-London عرب لندن,4,1,مليونية السبت: دعم لفلسطين وتنديد بعنصرية سويلا برافرمان#عرب_لندن,2023-11-12:13:12,h t t p s : / / s c o n t e n t . f t u n 1 5 - 1 . f n a . f b c d n . n e t / v / t 1 5 . 5 2 5 6 - 1 0 / 3 8 6 4 3 5 9 5 2 _ 1 4 4 6 3 9 2 9 4 2 5 9 2 0 0 8 _ 1 0 0 0 0 4 2 1 2 8 8 1 9 1 6 7 4 4 5 _ n . j p g ? s t p = d s t - j p g _ p 1 8 0 x 5 4 0 & _ n c _ c a t = 1 0 1 & c c b = 1 - 7 & _ n c _ s i d = 1 a 7 0 2 9 & _ n c _ o h c = y B a c K b a Q G d c A X 9 L 5 X u T & _ n c _ h t = s c o n t e n t . f t u n 1 5 - 1 . f n a & o h = 0 0 _ A f D y 3 s b R L p f h a d 9 h O Y z 7 8 2 C O j M H T w E u s J 6 d k h B m b A Y E J j A & o e = 6 5 5 5 5 F 4 5,https://www.facebook.com/arablondon4/posts/pfbid0RVXkWkjttBEBmfjTbzKGH2Vz4BMGHJz6eZY3uAFeqhzHhnr4VTQcyiAu9B8vPwMMl?__cft__[0]=AZUcL1ZtbXKBHg116Ir0joxKytvK1REx-P5dBseM829BXEmZ_RaX5sUxztmsotq3rs9twm1rrygbfqWod1w4v_xfb8BMUVmAyIVb8FN7-JVOJmOGzw64L-ISAZLxIpr2SDeSxKr57W6qZdpqdtx-_7s-QJpqunSzfUHFzjHzah6ygSzRvHvZsJYE98f44aBY8zWd8b325DhFZnsrLqdXUIhF&__tn__=%2CO%2CP-R,f e LR ks ١‏ عل بريطاتيا o o‏ ا عاتم - - 1 ان للد لتدل د دح لاا 7 الوا ب ات واه ا - محمد آامين = 1 B‏ شاهد . مليون شك ص بلندن يهتقون تفلسطين ويطالبون بوقف العدوان وإنهاء الاحتلال L]‏ Y 0:03‏ R i |‏ LR gl‏ ار الاي o s gt g s i‏
pfbid07pGQk7HhM5E4egpnGB9XTs45GfFV3jXuN6dRKu7UUSM8WWauSzMeNxpgrJdxemjil,Arab-London عرب لندن,42,5,هذا ماقاله مناصرو فلسطين في مظاهرة السبت المليونية بلندن… #عرب_لندن,2023-11-12:13:12,h t t p s : / / s c o n t e n t . f t u n 1 5 - 1 . f n a . f b c d n . n e t / v / t 1 5 . 5 2 5 6 - 1 0 / 3 8 6 4 5 3 9 6 2 _ 3 4 3 2 6 8 3 6 4 9 1 7 3 1 7 _ 8 4 4 9 5 6 1 0 1 4 0 2 7 1 1 6 2 2 8 _ n . j p g ? s t p = d s t - j p g _ p 1 8 0 x 5 4 0 & _ n c _ c a t = 1 1 1 & c c b = 1 - 7 & _ n c _ s i d = 1 a 7 0 2 9 & _ n c _ o h c = g x s s u R r g q C I A X 8 J P i Y H & _ n c _ h t = s c o n t e n t . f t u n 1 5 - 1 . f n a & o h = 0 0 _ A f B G b t 4 V Q R C c 0 j 6 f v e 0 x 3 g v h q s t V 3 z U f o 0 0 e s T V W U a N L v w & o e = 6 5 5 6 A 9 1 A,https://www.facebook.com/arablondon4/posts/pfbid07pGQk7HhM5E4egpnGB9XTs45GfFV3jXuN6dRKu7UUSM8WWauSzMeNxpgrJdxemjil?__cft__[0]=AZV973rBMZUxJLZq_sx5H7bwACV_PXq9fSuUZRfXIrg_JZEvTt60nN5SUWGGf3xqHW-3uixz1WVqSrfpZBU0ruq1TCDau1g4W36wxW-mdWyOckUtYipEM-SgZheVVIaMTyNyFMzs0830gEkUiMyH1Yj0_8bimq6-Wv_BeQ7ztiI2ifKJNQstt__xTBTHK1c8XOR0NzO6neCIRk7SurqAgyB0&__tn__=%2CO%2CP-R,ال ا سا دا ] يوا _‘ d;:!-'‏ < ام وا S 7 \‏ ََِ © / g S \ L 8 - ‘‏ ) 7 - b » ١ - ;‏ s‏ هذا ما قاله مناصزو فلسطين 0 في مظاهرة السبث المليونية بلندن
pfbid02aXJSyXYqup88qEUUyYeGnMUSUep3arY2iZB3aHVL2L9GP9FYnq29CjYPNCGqJFJul,Arab-London عرب لندن,0,0,"الملك تشارلز سيقود  قداس ذكرى يوم الأحد في موقع النصب التذكاري ""سيناتوف"". ويأتي ظهور الملك في المراسم بعد يوم واحد فقط من قيام محتجين مناهضين لليمين المتطرف بأعمال شغب عند النصب التذكاري يوم السبت، واشتباكهم مع الشرطة .وكانت الشرطة قد اعتقلت حوالي  100 شخص بعد محاولتهم الوصول إلى المسيرة المؤيدة لفلسطين التي كانت قي طريقها عبر لندن.#عرب_لندن",2023-11-12:11:12,h t t p s : / / s c o n t e n t . f t u n 1 5 - 1 . f n a . f b c d n . n e t / v / t 3 9 . 3 0 8 0 8 - 6 / 4 0 0 7 5 3 3 6 7 _ 8 1 7 2 0 3 5 1 0 4 1 1 5 2 8 _ 1 0 2 6 8 6 4 7 8 6 5 7 7 0 8 8 7 8 2 _ n . j p g ? _ n c _ c a t = 1 0 0 & c c b = 1 - 7 & _ n c _ s i d = 5 f 2 0 4 8 & _ n c _ o h c = 4 i N L P X 8 4 T - s A X 8 M p H C d & _ n c _ h t = s c o n t e n t . f t u n 1 5 - 1 . f n a & o h = 0 0 _ A f B W q W 9 6 2 E Z g m D V J F S Y Y G a U 3 Z U k u N Q c m m l 8 H L L K L C m l G l w & o e = 6 5 5 6 8 B 2 6,https://www.facebook.com/arablondon4/posts/pfbid02aXJSyXYqup88qEUUyYeGnMUSUep3arY2iZB3aHVL2L9GP9FYnq29CjYPNCGqJFJul?__cft__[0]=AZULtg4y902TaTPkfZ7ExzOs0rLMtey7EI7xHOacTkulthBF2CoCBtHOSU9B1_89nSC5_1t712QQj_oahal7C10wCwWZMOXFnQf6wGc4MNTjtAC0QRLtwv2V7aiEhH0lkw-oLtV0noBHa6t-pAi95fSEP_qnkGg0YIw1JjGxZaZxbvk9PQzcPeeVDwmV5lw1KWh31ZM-7zSj1CZo_64wrJqx&__tn__=%2CO%2CP-R,"o v -‏ g v © , 7‏ ا a———‘‏ "" 8 ما قا بيه و % ن 0 L 4‏ \ يا 4 ® مور"
pfbid0i1rEdAYFKhv57Ta1nkcwbsLia3NyXiuNDkasjF228JHKvmUFtTjDkMjHmXvyQppcl,Arab-London عرب لندن,0,0,جايكوب ريس موغ في دفاعه عن اسرائيل مع ضيفه  الصحفي المتضامن مع فلسطين !!#عرب_لندن,2023-11-12:10:12,h t t p s : / / s c o n t e n t . f t u n 1 5 - 1 . f n a . f b c d n . n e t / v / t 1 5 . 5 2 5 6 - 1 0 / 3 8 5 5 3 4 4 1 7 _ 1 4 0 0 4 9 2 1 7 7 4 9 2 1 7 8 _ 6 5 0 6 1 2 5 2 2 1 0 7 1 1 5 6 6 9 _ n . j p g ? _ n c _ c a t = 1 0 9 & c c b = 1 - 7 & _ n c _ s i d = 1 a 7 0 2 9 & _ n c _ o h c = e W f c Y T 2 E Q 7 8 A X 8 t M 3 k v & _ n c _ h t = s c o n t e n t . f t u n 1 5 - 1 . f n a & o h = 0 0 _ A f D L t z 6 K - Y Z J s V t 1 w Z O P H M b 7 B - 0 n j B D f W Z r 1 E j F f u E 9 p J Q & o e = 6 5 5 5 F E E E,https://www.facebook.com/arablondon4/posts/pfbid0i1rEdAYFKhv57Ta1nkcwbsLia3NyXiuNDkasjF228JHKvmUFtTjDkMjHmXvyQppcl?__cft__[0]=AZVMaX5FPaZuWGE0s3SQCW0jT47EKkVBX1fM9c19YYtVKwYOqG4CDMSBQNAJ5wzbI48DlHXtaf-4Jz1pyfpjTuw8RNunGhCsnUrWTsI9lmyC9PbJS9xiIhGUVFY_DBg0z9OXgezraC-UC9L2xgzvy3FRnp0bav0sQfszP7myqF2sDoyxva5NZlB9RM3ukdnSXw03UDyaak9ejlxR3EedXeLt&__tn__=%2CO%2CP-R,N R v VEED ل يسم‎ captions forvid 17 سح ححص‎ =\ ki 1 -~ للد‎ : ا‎ @ ) 0 .. . . - — - _ ~ لا و‎ A ! + = 7 اضطروا الى الذهاب هناك هرباً من الإضطهاد حيث كانوا يعيشون‎ T ¢ PROTESTS ON ARMISTICE DAY PM brands planned pro Palestine marches for weekend 'disrespectful’ GEWEWS.COM + م11 لمحيو‎ to critically ill British baby Indi Gregory who is at the centre of a life-suppa 2
pfbid096kJP6Ntf674tqHHWGJVFEe8rhHNW9eqQJzH3T66D16bEAyEx1umAh3ZGxwSBejWl,Arab-London عرب لندن,0,0,كبار المحافظين يحذرون:سوناك سيبدو ضعيفاً إذا فشل في إقالة برافرمان!!قال كبار المحافظين إن سلطة ريشي سوناك كرئيس للوزراء ستكون في حالة يرثى لها ما لم يتم إقالة وزيرة الداخلية المثيرة للجدل والمثيرة للانقسام ، سويلا برافرمان ، في غضون أيام.مع تزايد الغضب من مزاعمها بتحيز الشرطة والتحدي الصريح للحكومة، فإن التوقعات بين معظم المحافظين هي أن سوناك سيقيل برافرمان في وقت مبكر من هذا الأسبوع ، مما يفتح الطريق أمام تعديل وزاري يأمل حلفاؤه أن يعيد تنشيط رئاسته للوزراء. #عرب_لندن,2023-11-12:10:12,h t t p s : / / s c o n t e n t . f t u n 1 5 - 1 . f n a . f b c d n . n e t / v / t 3 9 . 3 0 8 0 8 - 6 / 4 0 0 7 5 9 3 4 1 _ 8 1 7 1 7 1 3 1 3 7 4 8 0 8 1 _ 9 2 0 7 7 8 6 2 5 4 8 8 5 3 5 0 7 3 0 _ n . j p g ? _ n c _ c a t = 1 0 8 & c c b = 1 - 7 & _ n c _ s i d = 5 f 2 0 4 8 & _ n c _ o h c = s Z N c K o 4 l B T E A X - l 6 Q Q 6 & _ n c _ h t = s c o n t e n t . f t u n 1 5 - 1 . f n a & o h = 0 0 _ A f B r f t q s p R v D G O 2 b q 9 Y u p m l 5 r E - i G j U V 5 F e j R 8 P Y R 3 j V m A & o e = 6 5 5 5 4 4 0 F,https://www.facebook.com/arablondon4/posts/pfbid096kJP6Ntf674tqHHWGJVFEe8rhHNW9eqQJzH3T66D16bEAyEx1umAh3ZGxwSBejWl?__cft__[0]=AZVeRWoHzH21A8aCIKsuVYRAtIngG3MKH4OKXc5KNKlWc-Jgl01K6sPVGRTjIulNd3hZh0khj_VeP-gzb0EU1qSCUDCZaOSK_8ZiKj5pWsdUTtb1mrsX1qtOa0Ms3hv91wKzz4NMW694AW5ff6-V_4UyPXldzh_OtvXnleEA4kg5N7Q35FNJeKnCaEYoHYKwUHkjbluaNpUpVvKetRt3IzKo&__tn__=%2CO%2CP-R,"Y S a 3 h D) 0 L 0 W ( *’:%:,“. 2 [ِ ا ا‎ 1 ل‎ W | | B g ’». 0 3 ١ 7 ل‎ ١ ’ | SO فق ل‎"
pfbid02DTtugtbR2NHFqcr7F6bAZEXNcjCXhix8btpg85aw4Xan75M9W7jnry6GmoxA8vtHl,Arab-London عرب لندن,22,3,"في ""الهايد بارك"".. فرقة موسيقية تدعم فلسطين بطريقتها الخاصة.#عرب_لندن",2023-11-12:09:12,h t t p s : / / s c o n t e n t . f t u n 1 5 - 1 . f n a . f b c d n . n e t / v / t 1 5 . 5 2 5 6 - 1 0 / 3 6 7 9 8 5 6 8 6 _ 8 6 2 2 7 4 2 4 8 6 6 4 3 6 3 _ 8 0 5 2 7 1 4 0 5 4 0 7 0 1 5 8 7 9 1 _ n . j p g ? _ n c _ c a t = 1 0 6 & c c b = 1 - 7 & _ n c _ s i d = 1 a 7 0 2 9 & _ n c _ o h c = 5 Q 3 z p K I 3 v b M A X - p z h 0 S & _ n c _ h t = s c o n t e n t . f t u n 1 5 - 1 . f n a & o h = 0 0 _ A f C 4 c a H x L N K A R x u 7 A Z 0 H M Q t T v O B 3 h q 4 S w W M K E Y x Y 7 n j 6 M g & o e = 6 5 5 6 7 E 1 5,https://www.facebook.com/arablondon4/posts/pfbid02DTtugtbR2NHFqcr7F6bAZEXNcjCXhix8btpg85aw4Xan75M9W7jnry6GmoxA8vtHl?__cft__[0]=AZWQ0K36J9YoQtZeJZyhCbiruMS_z7Tc5HVTUGNMupYJC5YCoSWOfYe3LC5VCjze2jD3zmHP140DzhJQr9AI6n85uKFyYcixk3hjyK3SDGw-hEcOERWyj21pYhosfLtkEAgtOiNLtn2So_LmeI18etRnHU-gBTB5G-Fs5DcDHVEmLtkQHFHLV8TALhI6mMd5dV5elubi-PlK6WSvGoGpVpc0&__tn__=%2CO%2CP-R,"حسم عرب 4 < ب"" P‏ f = e 2‏ R‏ 0 طم _ ~- - ""الهايد بارك.."" فرقة موسيقية تدعم فلسطين بطريقتها الخاصة ا م ا"
pfbid0Dybqr19B8fpyK7iwTpWs9DnM8ec1LRnB27YUSgH38KAj69hZoRnHe96BNXq9YnB7l,Arab-London عرب لندن,2,1,الآلاف يتظاهرون في بروكسل: أوقفوا الإبادة الجماعية#عرب_لندن,2023-11-12:08:12,h t t p s : / / e x t e r n a l . f t u n 1 5 - 1 . f n a . f b c d n . n e t / e m g 1 / v / t 1 3 / 1 6 8 9 3 3 0 1 3 4 3 7 6 9 6 8 7 9 7 3 ? u r l = h t t p s % 3 A % 2 F % 2 F a r a b - l o n d o n . c o m % 2 F u p l o a d s % 2 F p h o t o s % 2 F 2 0 2 2 % 2 F s h a r e s % 2 F 0 6 % 2 F 6 5 4 f c e f d 7 9 0 4 6 . j p g & f b _ o b o = 1 & u t l d = a r a b - l o n d o n . c o m & s t p = c 0 . 5 0 0 0 x 0 . 5 0 0 0 f _ d s t - j p g _ f l f f f f f f _ p 5 0 0 x 2 6 1 _ q 7 5 & c c b = 1 3 - 1 & o h = 0 6 _ A b G z 8 D d j e L O j D G _ y q Q d I m Y Y X n f j T 7 k 9 i 7 - _ q u N 2 m f a z J L A & o e = 6 5 5 2 D D 7 6 & _ n c _ s i d = d b a d 3 9,https://www.facebook.com/arablondon4/posts/pfbid0Dybqr19B8fpyK7iwTpWs9DnM8ec1LRnB27YUSgH38KAj69hZoRnHe96BNXq9YnB7l?__cft__[0]=AZX25d1jwVbP6i6Lyt-d-5LZaY-MOXbKzLqTqk-eTFrx15r3xwazGV187vRSDT7PEOEhG5uHOfeTufyYY1FWjIQt7v-j9K0pSPQQvtFpW_zRxrOdDNyZferocs7s28IVfQ9mfbc5W5Jvbd441MI_p59OBJR9ot7lOL3FTfYTUubCxsQBirjlr4lX8gIQvYtUI_3TXVApQ7psvusdv6F_3rDa&__tn__=%2CO%2CP-R,g~ 7د سبع‎ ا ل ا‎ W
pfbid037C7g6afyCCdHgsirKYqS8VVtNShq3rEJpQSVxDB4S1K4pUHLgukXPLb2TvdLSrnol,Arab-London عرب لندن,961,91,الشرطة البريطانية تشيد بالمظاهرات الداعمة لفلسطين وتندد بالعنف في مظاهرات اليمين المتطرف.#عرب_لندن,2023-11-12:04:12,h t t p s : / / s c o n t e n t . f t u n 1 5 - 1 . f n a . f b c d n . n e t / v / t 1 5 . 5 2 5 6 - 1 0 / 3 7 1 1 5 6 3 4 3 _ 3 1 7 2 7 3 2 5 9 9 7 0 0 0 2 7 _ 2 3 5 4 1 7 9 6 2 5 2 7 1 8 8 9 4 1 6 _ n . j p g ? _ n c _ c a t = 1 & c c b = 1 - 7 & _ n c _ s i d = 1 a 7 0 2 9 & _ n c _ o h c = t z x Q 1 V n I 5 X Q A X _ 8 5 a H g & _ n c _ h t = s c o n t e n t . f t u n 1 5 - 1 . f n a & o h = 0 0 _ A f A - G t o Q I I c g R 1 z k _ s O u V f N 5 J Y q 3 a S v x F 7 9 k 6 J x c w A q 1 d Q & o e = 6 5 5 5 1 1 3 6,https://www.facebook.com/arablondon4/posts/pfbid037C7g6afyCCdHgsirKYqS8VVtNShq3rEJpQSVxDB4S1K4pUHLgukXPLb2TvdLSrnol?__cft__[0]=AZXoioV34z13ClRIMFZI97Mq8-StkLo8Ue16901yfvueIAXWWtMnyNBwbhwJ_Kn8NrEzaJcMuyclsJvvD8BDnXG400BUjHG6DQNx01mYYP72lmwGz4R8PZ7q-nojpcK1_ULadm9o-LgHky_lf5HwpuJnezvpKncKZrj0-pPgQOd0KC1d4AuaPOgFPaAPU97RcFbltVH1K3MgBoUlTNUkox_4&__tn__=%2CO%2CP-R,"Y 1"" T علب‎ ] L 1 Jad تياس‎ ! - Y § = ١ 1 1 لي‎ ""ّ 1 1 0 N3 f L { % ب‎ ' 0 هناك بعض المجموعات‎ ضمن هذه المظاهرات المناهضة‎"
pfbid05Kzx4PHQyQwYn42ChBVAPwkErnJFTTprxhY934Ky4UzdSv4DTQxujh3UQog4VXQBl,Arab-London عرب لندن,13,24,"بريطانيا تلغي تأشيرة مقدم البرامج التلفزيونية المصري معتز مطر  بسبب ""دعمه حمـ.ـاس ""أصبح معتز مطر مقدم البرامج المصري أول مواطن أجنبي تلغي وزارة الداخلية البريطانية تأشيرته بحجة أنه دعم علناً حركة حمـ.ـاس، وقد تم وضعه على قائمة المراقبة، مما يعني أنه لا يستطيع العودة إلى بريطانيا.ويأتي هذا الطَرد تحت خطط سويلا برافرمان، وزيرة الداخلية، وروبرت جينريك، وزير الهجرة لتضييق الخناق على الرعايا الأجانب بسبب سلوك أو تعليقات معادية للسامية في أعقاب هجوم حمــ.ـاس على إسرائيل. #عرب_لندن",2023-11-11:20:12,h t t p s : / / s c o n t e n t . f t u n 1 5 - 1 . f n a . f b c d n . n e t / v / t 3 9 . 3 0 8 0 8 - 6 / 4 0 1 3 6 4 1 5 2 _ 8 1 7 1 7 0 8 3 3 7 4 8 1 2 9 _ 8 3 5 9 6 7 1 9 2 8 2 5 5 7 1 2 8 6 4 _ n . j p g ? s t p = d s t - j p g _ p 1 8 0 x 5 4 0 & _ n c _ c a t = 1 0 1 & c c b = 1 - 7 & _ n c _ s i d = 5 f 2 0 4 8 & _ n c _ o h c = o B R I W T u f K K M A X _ l R x T 6 & _ n c _ h t = s c o n t e n t . f t u n 1 5 - 1 . f n a & o h = 0 0 _ A f B x 6 F 3 l x n _ L E a E E y k H 2 I W 7 - X n C A B J G G i L o R u x H k U V 9 I u w & o e = 6 5 5 5 3 5 7 6,https://www.facebook.com/arablondon4/posts/pfbid05Kzx4PHQyQwYn42ChBVAPwkErnJFTTprxhY934Ky4UzdSv4DTQxujh3UQog4VXQBl?__cft__[0]=AZV0Fde5EqV187iXNJyNTo6W61Uqc3a4FfBVe1Q6sH1rkvPIfq_CrISZRG0YjMPKmTmgwC8Qmo9KFioRBytQP_Qk0zib4Cc2mg59UovFLFbwwnkXUzQ7tDky3O8mQdp8jOt5XJ0SjubZoQnBQLiPSkHFVCJcnPLQcW1Le2yfOgYYIjNfHkJ6kJaSGgabsaYsy-N5tG9EcLxLtnE5JGDPFRGB&__tn__=%2CO%2CP-R,] 27 1 م ص AV . | [‏ 1 بدا ¢ | B‏ ا | 1
pfbid02EN6g6zznd9qCBE9nneTnYpc897x9vNPM8XBpPkgscvnWQK9akGQ7KXkCrvr98tMDl,Arab-London عرب لندن,919,141,مسؤولون في الاحتـ.ـلال ... عندما قالوا الحقيقة في زلة لسان#عرب_لندن,2023-10-07:20:56,h t t p s : / / s c o n t e n t . f t u n 1 5 - 1 . f n a . f b c d n . n e t / v / t 1 5 . 5 2 5 6 - 1 0 / 3 8 5 5 4 5 0 3 3 _ 1 0 0 0 7 7 5 1 8 7 8 5 4 2 4 9 _ 7 4 4 9 1 9 6 5 5 7 2 3 5 2 3 6 5 0 5 _ n . j p g ? s t p = d s t - j p g _ s 9 6 0 x 9 6 0 & _ n c _ c a t = 1 0 4 & c c b = 1 - 7 & _ n c _ s i d = 1 a 7 0 2 9 & _ n c _ o h c = c g S 0 I z q Z D C 8 A X _ m Y v Y T & _ n c _ h t = s c o n t e n t . f t u n 1 5 - 1 . f n a & o h = 0 0 _ A f A 3 _ r 2 i f N O x O B 9 R m e H E p m E t 8 H e 8 Z 6 o T 3 G B Z N 3 _ k 6 j b l O Q & o e = 6 5 5 6 2 F 5 E,https://www.facebook.com/arablondon4/posts/pfbid02EN6g6zznd9qCBE9nneTnYpc897x9vNPM8XBpPkgscvnWQK9akGQ7KXkCrvr98tMDl?__cft__[0]=AZXrc7O9h4evmy9Fk_dVwXptsNDiPwlIGgnqRFgC1nUl8t3KvDn2juozDyPDOpfnUXh4XrUwaZUVhYyCC3UtHUmxb9n7dYWfIgq4Avu7QsdaMgZoTdspUT-YpMPhajGBqtzmDcMX6kb3uVVAfeJA4ruZmDLqgbeflkX1JH8robsDz1xPLRFFN2jchuKUze1WsfaV5Wrg9wGr_JCD8T64SpTY&__tn__=%2CO%2CP-R,"للك True Colors‏ لفك PM‏ 8:41 21 الناطق باسم رئيس الوزراء الاسرائيلي نتنياهو تال هينريك MP WAS FROM ISRAELI AIRSTRIKE‏ °M Netanyahu S&P . 16.65‏ K 081, 21, IS SCHEDULED TO APPEAR NEWS GENTRAL‏ ولكن يمكنني أن أخبركم بأننا"
pfbid02Lai8gyVWGEPJxvPwnKwU4LcKKmd3HvLoEYgpug5MW9XxZ7VAisS6wW5MspD2A82nl,Arab-London عرب لندن,0,28,"بلينكن يحذر من ""التهجير القسري"" لفلسطينيي غزة والعنف الذي يتعرض له فلسطينيو الضفة الغربية.#عرب_لندن",2023-10-07:21:35,h t t p s : / / e x t e r n a l . f t u n 1 5 - 1 . f n a . f b c d n . n e t / e m g 1 / v / t 1 3 / 4 4 2 3 8 9 1 7 8 4 7 5 9 5 3 7 7 5 ? u r l = h t t p s % 3 A % 2 F % 2 F a r a b - l o n d o n . c o m % 2 F u p l o a d s % 2 F p h o t o s % 2 F 2 0 2 2 % 2 F s h a r e s % 2 F 0 6 % 2 F 6 5 4 7 8 3 9 8 c 0 6 d 0 . j p g & f b _ o b o = 1 & u t l d = a r a b - l o n d o n . c o m & s t p = c 0 . 5 0 0 0 x 0 . 5 0 0 0 f _ d s t - j p g _ f l f f f f f f _ p 5 0 0 x 2 6 1 _ q 7 5 & c c b = 1 3 - 1 & o h = 0 6 _ A b E j 1 w n T s k w t T 6 m T J c L q Q h I f 4 Y 8 u X 5 2 7 m T q O 1 o b 3 0 K C u h A & o e = 6 5 5 2 7 F 9 9 & _ n c _ s i d = d b a d 3 9,https://www.facebook.com/arablondon4/posts/pfbid02Lai8gyVWGEPJxvPwnKwU4LcKKmd3HvLoEYgpug5MW9XxZ7VAisS6wW5MspD2A82nl?__cft__[0]=AZVLIVV7FFFAFwvtSjT8p45IYqzD6zCeRCw5OH4obB754oPtjRwNQGRRkIbCosIAwUfLrYGT8ms2WdKkI0WCvFo-nutQV-p2nEy9tRg8DT_ig2S_wFMQbI0JoWhEwp9ZVAuw7WbfvQu_5jdLzUd87Nt9BMdI6kFATIBFz0bvFq75c1i15LRRDsC82ELXA9dZSxo4V_4Ma-3Mdc4gUu3byOTM&__tn__=%2CO%2CP-R,A S e ١ 8“ 4 ا‎
