id,name,shares,comments,content,posted_on,image,post_url,image_content
pfbid02vM4jhym1wvEYduhWMjooGatWtZsp7HQytMubHYXmtNXSfsfJo6vQPEBMBm21TPAZl,Arab-London عرب لندن,0,2,"موقف سيارات مطار لوتون الذي دمره حريق، سيتم ""هدمه بالكامل""إدارة مطار لوتون ستقوم بهدم موقف السيارات الذي تعرّض للحريق وأدى الى تدمير  أكثر من 1000 مركبة،  وقالت الادارة إن أي سيارات متوقفة في الطابقين الأرضي والأول ""غير قابلة للانتشال""، وأن العمل جارٍ لإزالة حوالي 100 مركبة كانت متوقفة على السطح العلوي ""لتحقيق الاستقرار في الهيكل"".ويُعتقد أن الحريق بدأ عن طريق الخطأ الشهر الماضي، بسبب عطل في سيارة كانت متوقفة فيه.#عرب_لندن",2023-10-15:04:14,h t t p s : / / s c o n t e n t . f t u n 1 5 - 1 . f n a . f b c d n . n e t / v / t 3 9 . 3 0 8 0 8 - 6 / 3 9 8 7 7 5 5 6 9 _ 8 1 2 3 9 3 2 5 0 8 9 2 5 5 4 _ 7 8 7 8 5 5 2 4 2 6 9 0 5 2 1 7 3 0 8 _ n . j p g ? s t p = d s t - j p g _ p 1 8 0 x 5 4 0 & _ n c _ c a t = 1 0 3 & c c b = 1 - 7 & _ n c _ s i d = 5 f 2 0 4 8 & _ n c _ o h c = R K e 5 D 1 l A K _ s A X 9 q Y H _ y & _ n c _ h t = s c o n t e n t . f t u n 1 5 - 1 . f n a & o h = 0 0 _ A f B R j a k r E H a 8 C x M D o v I X g E o q l e Q Y t g 6 - W - L h J 0 K S l h q V 6 A & o e = 6 5 5 6 B 6 0 B,https://www.facebook.com/arablondon4/posts/pfbid02vM4jhym1wvEYduhWMjooGatWtZsp7HQytMubHYXmtNXSfsfJo6vQPEBMBm21TPAZl?__cft__[0]=AZXXI-C7rpiPIRNW3B2aKuSws407Cq8g2a58x-JBfcOf3kpDAcd3o5GpDYkyxCY_IdSB9m5ctNy8Z-JEqQaG7AXei3v57CRG83XnfVNzaECO_Mnz105N__xTV-V9piMVJ5fK-x5-qGUDgFZK7UXORw1bl8QdM3PUeO3ZEyOkUyMkyLHTItTIK9Y0TlHHra_tsYSG2gCyvMY4x8ANKmu85b_T&__tn__=%2CO%2CP-R,")أن i‏ نا 8 7 | 1 X -‏ . 27 B O ot/ A‏ s N "" '‏ 1 im“\«.\ . . RN ; 1‏ ‘"" ST‏ - - ل ا o‏ I‏ أ »م د ات عد ى عن عب إن لل a‏"
pfbid02kDqpNEYr6sQH9v1UF4BEu1VXUWUEVJm4GLrTHKZMgK2Y4y9CjxAtmUJYNfzxcVKhl,Arab-London عرب لندن,1,2,"إدانة نائب محافظ بارتكاب جريمة عنصرية مشددة للنظام العامأدين النائب المحافظ بوب ستيوارت بارتكاب جريمة عنصرية مشدّدة تتعلق بالنظام العام، وغرامة قدرها 600 جنيه إسترليني، وذلك بعد أن طلب من الناشط البحريني سيد أحمد الوداعي ""العودة إلى البحرين"" على إثر مشادة كلامية حصلت خارج منزل لانكستر التابع لوزارة الخارجية في وستمنستر في 14 ديسمبر.وقال ستيوارت للوداعي: ""أنت تأخذ المال من بلدي، ارحل"".#عرب_لندن",2023-10-15:06:06,h t t p s : / / s c o n t e n t . f t u n 1 5 - 1 . f n a . f b c d n . n e t / v / t 3 9 . 3 0 8 0 8 - 6 / 3 9 8 8 2 3 7 7 7 _ 8 1 2 3 6 5 4 6 0 8 9 5 3 3 3 _ 5 8 0 7 6 0 1 1 8 4 3 5 7 9 5 5 4 1 7 _ n . j p g ? s t p = d s t - j p g _ s 1 0 8 0 x 2 0 4 8 & _ n c _ c a t = 1 0 9 & c c b = 1 - 7 & _ n c _ s i d = 5 f 2 0 4 8 & _ n c _ o h c = X 7 W t 4 3 N h 1 s 8 A X - c q b V m & _ n c _ h t = s c o n t e n t . f t u n 1 5 - 1 . f n a & o h = 0 0 _ A f D t T j g h A R Z x f k B Z h g b 9 s x j l S p S 0 W R I d V 4 G B V n 2 S E 7 9 K 7 Q & o e = 6 5 5 5 8 E C 7,https://www.facebook.com/arablondon4/posts/pfbid02kDqpNEYr6sQH9v1UF4BEu1VXUWUEVJm4GLrTHKZMgK2Y4y9CjxAtmUJYNfzxcVKhl?__cft__[0]=AZVf-FVpsmnEFgQmf9zF_katgYi2cNdSH6doMzM3eizzjl8T-sY9rFDRzxUx1g0MmkTRAYKl3XclubEr_hHxw06Kas3JwXywgs4fqzzF-yhiuJPSRgXwkbDXIL6jLNyMbZTqbZLHBRgBnLDEurbl3RYW_JCGj2wbsyTdXyvlQ2fAhxXGp55OTAgJx96XSflP5ZPgYbYbxnNPXqKD11equbIC&__tn__=%2CO%2CP-R,"الى ال لح م ذم | إدذا sl | ;‏ ¢ ""“ -( : -__ جح عي ,ا \ S i لغ‎ 0 لأ يس / ما ا‎ | ١ | . 1 0 ب٠‎ i 3 4 — \> Clor— 9"
pfbid02KS6HBM6yxT7GqBB37FG5ph7wHsSAFJKeSLXcb5vvVM2iNFXWV6t4yf7QRLJd6iK9l,Arab-London عرب لندن,35,31,"غاري لينيكر يرد على برافرمان ويدعم المتظاهرين المؤيدين للفلسطينيين في مسيرة يوم الهدنةقال غاري لينكر في منشور له على منصة إكس ""إن المسيرة والدعوة إلى وقف إطلاق النار والسلام، حتى لا يُقتل المزيد من الأطفال الأبرياء، ليس في الحقيقة تعريف مسيرة الكراهية.""وذلك  رداً على منشور لسويلا برافرمان وصفت فيه مجدداً المسيرات المؤيد لفلسطين بانها مسيرات كراهية.وكان في وقت سابق من هذا العام، قد اضطر لينيكر، المذيع الأعلى أجراً في ""بي بي سي""، إلى التراجع عن دوره في برنامج ""ماتش اوف ذا داي"" بعد مقارنة تعليقات لسويلا برافرمان حول الهجرة غير الشرعية بلغة ألمانيا عام 1930.#عرب_لندن",2023-10-15:08:40,h t t p s : / / s c o n t e n t . f t u n 1 5 - 1 . f n a . f b c d n . n e t / v / t 3 9 . 3 0 8 0 8 - 6 / 3 9 8 8 7 1 3 5 6 _ 8 1 2 3 3 7 6 6 7 5 6 4 7 7 9 _ 1 3 3 0 3 1 9 2 1 2 6 4 2 4 0 0 0 9 0 _ n . j p g ? s t p = d s t - j p g _ p 1 8 0 x 5 4 0 & _ n c _ c a t = 1 0 4 & c c b = 1 - 7 & _ n c _ s i d = 5 f 2 0 4 8 & _ n c _ o h c = E 2 8 F 1 M X W x t I A X 8 e 3 Y 0 V & _ n c _ h t = s c o n t e n t . f t u n 1 5 - 1 . f n a & o h = 0 0 _ A f A 1 x 3 D P G c V t R o X - 0 d D N D U J R S z 8 6 s B g z C o K N N V l u d f l 3 C Q & o e = 6 5 5 5 1 5 4 E,https://www.facebook.com/arablondon4/posts/pfbid02KS6HBM6yxT7GqBB37FG5ph7wHsSAFJKeSLXcb5vvVM2iNFXWV6t4yf7QRLJd6iK9l?__cft__[0]=AZWSzXdY-5VL5D0HWVsOXryEPbSox0IOoFqMWH6_HzG5-SIPSPKie2EJDOD386Xh7HSnvQcR9A6VqOoSeO4pwMO2V8CxAPIX0Ofur2MMPFlLoAyh-LA8MVQHuhMyRk5Deb_pIdOcBVpM3_a2WPjn0XTAGV1tbebzNkm0G5mERBslvp_hVPeG1xHHgzfsw3nuOD4nRvfVONtxv_gQVe1nHSYl&__tn__=%2CO%2CP-R,"١ 0 . i‏ اهم ) دحج : 0 32 حت يرو ١‏ \ . >"" | /"
pfbid02TNrDEQL8kJAVoRoPV2EuH48MRKHUbKdyzi9J3efZncGcJF45UmdF78EF31e1oYA9l,Arab-London عرب لندن,40,9,مظاهرة ليلية في لندن يوستن سكويرتطالب بوقف جرائم الاحتلال الاسرائيلي #عرب_لندن,2023-10-21:08:47,h t t p s : / / s c o n t e n t . f t u n 1 5 - 1 . f n a . f b c d n . n e t / v / t 1 5 . 5 2 5 6 - 1 0 / 3 8 4 5 5 1 7 4 5 _ 3 4 5 0 6 6 7 9 1 2 3 1 5 0 1 _ 2 3 4 5 4 4 6 4 0 1 7 3 4 0 2 3 2 8 3 _ n . j p g ? _ n c _ c a t = 1 0 6 & c c b = 1 - 7 & _ n c _ s i d = 1 a 7 0 2 9 & _ n c _ o h c = w x n w 9 7 k O s l M A X 8 h x 9 h G & _ n c _ h t = s c o n t e n t . f t u n 1 5 - 1 . f n a & o h = 0 0 _ A f C M Q Z y g - N v O G k L 2 O I G _ 4 3 K p e l G D O Y J D d l W 3 0 l S F b t D R 6 w & o e = 6 5 5 6 6 6 F 5,https://www.facebook.com/arablondon4/posts/pfbid02TNrDEQL8kJAVoRoPV2EuH48MRKHUbKdyzi9J3efZncGcJF45UmdF78EF31e1oYA9l?__cft__[0]=AZXJkBaSOPlBzVqNjk31ndSY4yxdwnCPCmSK5-6wfws7kUeKits7yHgqFvOXsEHEU1fLgvCeKL-_WiM8O4C3g4ipdzaOfi9n1GlfYZj8tRetBpr8g-iCxt9NQkyB3r5Ep6qSpaAOusUPPuxKZHAF3ANWSLbNHo0ZPUyqDLqsnYA6e7hBPM6n2061j5v4CUugC5g65KEmdlstQ5z44nM5ht0Y&__tn__=%2CO%2CP-R,
pfbid028XYfyVgLqhU4WytLjaADWS4dcMBjs1XfsdsXuPAVAtbizgxG2k1iySiiThHyDQj9l,Arab-London عرب لندن,24,10,نقاش بين رجال الشرطة ومتظاهرين على خليفة اعتقال متظاهر مؤيد لفلسطين #عرب_لندن,2023-10-21:08:48,h t t p s : / / s c o n t e n t . f t u n 1 5 - 1 . f n a . f b c d n . n e t / v / t 1 5 . 5 2 5 6 - 1 0 / 3 8 5 5 4 8 2 0 7 _ 2 8 2 3 6 3 4 2 1 4 4 7 1 5 0 _ 8 0 9 4 6 1 0 8 1 4 2 6 6 5 3 4 0 8 0 _ n . j p g ? _ n c _ c a t = 1 0 7 & c c b = 1 - 7 & _ n c _ s i d = 1 a 7 0 2 9 & _ n c _ o h c = w x 9 F v T 3 y H p I A X - j P 1 P g & _ n c _ h t = s c o n t e n t . f t u n 1 5 - 1 . f n a & o h = 0 0 _ A f B y c k w T N D l b g h G V q k H 3 F K 4 g B _ E H - 4 b 4 n A T N C - s Q u v s F R A & o e = 6 5 5 5 B 4 1 2,https://www.facebook.com/arablondon4/posts/pfbid028XYfyVgLqhU4WytLjaADWS4dcMBjs1XfsdsXuPAVAtbizgxG2k1iySiiThHyDQj9l?__cft__[0]=AZU9EJmi_ecUOE8tSrgYEUNoTAQ2UDeD6rglgLnlrE0XHxLchFun_isMVcKjoU7QPp4d5IuIIC7RIfb7vW1NTZtfazAaFlUhm5rwDJtU3jbm8C0N0VACDcTXyal4s-nWsqNkRJGFlFut1-eV4_a7Nhbg9tFkjXZq4Pbymq_TskPIhcmqP4wi8rFbIJ3l8M0dQ-zTWyOm_fW3uTU1DCNqTG3G&__tn__=%2CO%2CP-R,- A لد‎ il & | g ع الآ‎ o 7 نكسي‎ .<- . - X f v 1 7 1 ل‎ L ( ١ 7 o ومتظاهرين على‎ dbpiljgly) نقاش بين‎ خلفية اعتقا [التظاهر مؤيد لفلسطين‎
pfbid02eT7ZWHviVFz7T2yMdndsALNXC2MSAY1FiX1VtHpYdXkdV8LfBCSVX87RU4cShFfnl,Arab-London عرب لندن,0,0,فيديو: معرض وثائقي في لندن يروي محنة الفلسطينيين منذ النكبة#عرب_لندن,2023-10-21:21:31,h t t p s : / / s c o n t e n t . f t u n 1 5 - 1 . f n a . f b c d n . n e t / v / t 1 5 . 5 2 5 6 - 1 0 / 3 8 4 5 4 0 9 3 8 _ 1 0 7 2 6 3 4 3 3 3 8 6 7 3 7 5 _ 5 7 9 6 4 5 3 5 4 5 1 0 7 2 1 9 4 7 6 _ n . j p g ? _ n c _ c a t = 1 0 7 & c c b = 1 - 7 & _ n c _ s i d = 1 a 7 0 2 9 & _ n c _ o h c = y k 1 c 9 o _ S 5 V s A X 9 Q y 4 w X & _ n c _ h t = s c o n t e n t . f t u n 1 5 - 1 . f n a & o h = 0 0 _ A f C J 3 t P V 2 w t o K N q 3 O X D r B s H h f D m d Y - e A R 0 7 p h Q H m t 9 l R t g & o e = 6 5 5 6 3 F 1 D,https://www.facebook.com/arablondon4/posts/pfbid02eT7ZWHviVFz7T2yMdndsALNXC2MSAY1FiX1VtHpYdXkdV8LfBCSVX87RU4cShFfnl?__cft__[0]=AZWJlwIHazj8eOQvKObFOMTETKilzF8QUFVkfk08i3IRWGb1mj1xlcO8NMc2nwu4O3D3Q1yFkyA8opqvOU_C3BjLvjBAaw5qi43amD2c8liVTYXPd_qN4w_w2wKl7xFhlvE-NOey8XP_oIIw8yLq5os1Rm-zKUOBDZBoZTnlmW0dS0rEDZsyGlw3H-FCeMBAQP1ilmoRMJ_SNzSeMKIlf4Rq&__tn__=%2CO%2CP-R,"S AP ممناك‎ ,4 ! . الله‎ , 0 00 3 2 b AR S أ‎ ٠ | o ¥"
pfbid0FLn9pAxt3RJeU1Db44MCzUw1K4mEKZoP93Q7j8ejDcT9vZFTXCJkT1pNcGXPKUuBl,Arab-London عرب لندن,0,0,مركز حقوقي يطالب الخارجية البريطانية بتفسير سبب سفر بريطانيين للمشاركة في العدوان على غـ.زة طالب المركز الدولي من أجل العدالة للفلسطينيين (ICJP) من مكتب الخارجية والكومنولث والتنمية (FCDO) تقديم توضيحات عاجلة بشأن موقف حكومة بريطانيا من البريطانيين الذين سيقاتلون في العدوان على غـ.زة.  حيث أشارت تقارير إلى أن مئات أو وربما الآلاف من المواطنين البريطانيين غادروا بريطانيا، منذ 7 أكتوبر 2023.… En voir plus,2023-10-21:22:05,h t t p s : / / s c o n t e n t . f t u n 1 5 - 1 . f n a . f b c d n . n e t / v / t 3 9 . 3 0 8 0 8 - 6 / 3 9 8 2 9 0 9 1 4 _ 8 1 1 8 5 1 3 3 0 9 4 6 7 4 6 _ 8 9 9 7 9 7 1 8 7 8 0 4 4 2 5 0 2 6 9 _ n . j p g ? s t p = d s t - j p g _ p 1 8 0 x 5 4 0 & _ n c _ c a t = 1 0 7 & c c b = 1 - 7 & _ n c _ s i d = 5 f 2 0 4 8 & _ n c _ o h c = N 1 t g E 2 V z d X I A X 8 z A 0 T _ & _ n c _ h t = s c o n t e n t . f t u n 1 5 - 1 . f n a & o h = 0 0 _ A f C X 0 I u P 2 B i z h C d X 2 S 9 O f 5 E 9 T F 6 V O L L S W y b G 6 h X v I i _ n r w & o e = 6 5 5 6 D 9 7 E,https://www.facebook.com/arablondon4/posts/pfbid0FLn9pAxt3RJeU1Db44MCzUw1K4mEKZoP93Q7j8ejDcT9vZFTXCJkT1pNcGXPKUuBl?__cft__[0]=AZU5Dcxxj01DO2IAA5RfBrF5LZ4Z0AxRzbv2wByEJi2_Sh-jzuDsqxdwz9kkDHNwx7bpJjtBmxF4zW8CgsMxORla3kKrNf4Ri4iyUzDij_6tw7YnqnOlT5jy0N3vBEfj1SGOq1h5Ki13hqvoR87q4A1bP21raCDD6iOE9y-fKCtXrZ1keY5eltzNZ6d3_PjhSL0-ehVpKzsrGCHDFBM5SHyQ&__tn__=%2CO%2CP-R,الا : L‏ . ~= ١ 1... I8‏ لاله T‏ ص ب الك ا سي اح s‏ 3 رن ا داشرالا e L B‏ ال
pfbid02fMRdsNSmBHb2MUmZMCMXb1CwiiEjNGej9RdbAHh6GTa1xVmuxRfgBfYRstbMW4P3l,Arab-London عرب لندن,0,0,موجز أخبار بريطانيا من موقع ومنصة #عرب_لندن الجمعة: 3 نوفمبر/ تشرين الثاني 2023https://arab-london.com/posts/22803https://arab-london.com/posts/22796https://arab-london.com/posts/22802https://arab-london.com/posts/22801https://arab-london.com/posts/22799,2023-10-21:23:23,h t t p s : / / s c o n t e n t . f t u n 1 5 - 1 . f n a . f b c d n . n e t / v / t 3 9 . 3 0 8 0 8 - 6 / 3 9 8 5 4 8 8 5 8 _ 8 1 1 8 3 1 0 7 4 2 8 2 1 0 5 _ 2 1 6 3 3 1 0 7 3 4 2 6 4 2 7 7 2 0 4 _ n . j p g ? s t p = d s t - j p g _ p 5 2 6 x 2 9 6 & _ n c _ c a t = 1 0 2 & c c b = 1 - 7 & _ n c _ s i d = 5 f 2 0 4 8 & _ n c _ o h c = 8 p G R B b S 6 o o g A X 8 g T 4 t l & _ n c _ h t = s c o n t e n t . f t u n 1 5 - 1 . f n a & o h = 0 0 _ A f A c V k q v U s H f x g b d h C Q w 9 i U f t I 5 H h s T g A W T 0 S P w U 6 T g l d A & o e = 6 5 5 5 3 E 8 A,https://www.facebook.com/arablondon4/posts/pfbid02fMRdsNSmBHb2MUmZMCMXb1CwiiEjNGej9RdbAHh6GTa1xVmuxRfgBfYRstbMW4P3l?__cft__[0]=AZUl-o-a7z4lsIT7WrQirHUs7pENXG3DR8OIzwdDkHVAzqFDZKIksG-Gy9J7u-lZjsHkBDWdgNIm8rijayjYja2WVLffjPB-LdmfFxfZBZTo2tBGd4PBZ1eYtUF2y_bAJpf3r1dNegy4rUrU7AYkVjw-KOcXNdlbJtFXRLUWr6Un2RZpiyzk-kJqLqr19atbebj_g_e5dcLe5RRH7vC3Cx13&__tn__=%2CO%2CP-R,"تح َل 3 [ o e‏ رغرب N 3‏ : H‏ 2 o‏ استطلاع: معظم البريطانيين يؤمنون بالتآثيرات الإيجابية © للهجرة على الرغم من خطاب الحكومة. م العاصفة سياران تضرب جنوب إنجلترا *» فيديو/ بريطانيا اليوم: كيف يمكن إغاثة عرب بريطانيا لغزة ابتداء من الكلمة وصولا للمواد الغذائية . إليكم الإجابة. © ""بريطانيا مذنبة"".. كتبت بالأحمر على واجهة مبنى وزارة. الخارجية البريطانية في لندن o‏ شاهد .. كير ستارمر: الزيادة في رهاب الإسلام مقلقة للغاية.. كل ذلك في بيئة حكم المحافظين كم تفاصيل لخي على صفحانا على مواق التوال لاجتماعي امو @ @t‏ مسسيس ل"
pfbid02Ty2p3qZbL3UGeFYAv9xxp76RLoW8gdYJjSoDC2Z63nsy7GhU9Ta1tfEcyGyJ15hXl,Arab-London عرب لندن,5,5,استطلاع جديد يكشف أن معظم البريطانيين يؤمنون بالتأثيرات الإيجابية للهجرة على الرغم من خطاب الحكومةحيث أظهر أحدث استطلاع للرأي لعام 2022 أنه لأول مرة أن غالبية المشاركين يعتقدون أن الهجرة كانت إيجابية للغاية بالنسبة لاقتصاد المملكة المتحدة (59%في المرتبة بين السابعة والعاشرة)، وأغنت الحياة الثقافية في البلاد (58%)، وجعلت البلاد مكان أفضل للعيش فيه (56%).#عرب_لندن,2023-10-21:23:36,h t t p s : / / s c o n t e n t . f t u n 1 5 - 1 . f n a . f b c d n . n e t / v / t 3 9 . 3 0 8 0 8 - 6 / 3 9 8 5 5 6 4 7 4 _ 8 1 1 8 2 4 6 4 0 9 4 9 4 1 5 _ 6 8 5 4 6 6 7 9 6 8 0 2 1 2 3 0 2 5 9 _ n . j p g ? _ n c _ c a t = 1 0 9 & c c b = 1 - 7 & _ n c _ s i d = 5 f 2 0 4 8 & _ n c _ o h c = V g s M g j e L - E w A X - z q d _ a & _ n c _ h t = s c o n t e n t . f t u n 1 5 - 1 . f n a & o h = 0 0 _ A f C W R W i X R p t 8 J h y J v p n v H U S 0 w Q 4 W f - x 7 L X - C H G R 4 R 6 1 6 e A & o e = 6 5 5 6 2 4 B D,https://www.facebook.com/arablondon4/posts/pfbid02Ty2p3qZbL3UGeFYAv9xxp76RLoW8gdYJjSoDC2Z63nsy7GhU9Ta1tfEcyGyJ15hXl?__cft__[0]=AZUD3sHA1IP2Np5J-F47Ws-aXdblWJBksxAMoQHboyv9kzAVUCUc235oIuc7un8BdjSeVBVCOfZs1ZOvwupqksZqKKd4xi9IGDzp5EdTXXALQ_u7jcL78lEa90nxbrMBQaxWPgbCbnstcD_vknt4YcDKd20EtKnP1uqeFSr-56rg5_LKP4NadBNlffcW9xEOwF7BXPKSvXqKKTz2kUh_S3YW&__tn__=%2CO%2CP-R,"UK Border oy h. -~ 1‏ ""“ IR 3;%333:!‏ ا & 27 : 75 ) ذو حي ا"
pfbid02vpuxKfDYgLNm2Nc2uzRqBgZDDvrgreiHQ8VSEKooh26YnyaMKxbFiKkdR96sTDPil,Arab-London عرب لندن,30,3,لطخ نشطاء واجهة مبنى وزارة الخارجية البريطانية في لندن بطلاء أحمر دموي، مع عبارة “بريطانيا مذنبة”، وذلك في الذكرى 106 لوعد بلفور.وكتبت مجموعة “العمل الفلسطيني” على موقع إكس “يرش الناشطون وزارة الخارجية في لندن، بعد 106 سنوات من توقيع بريطانيا على أرض فلسطين للمشروع الاستعماري الصهيوني”. كما اتهمت المجموعة المملكة المتحدة بمواصلة تسليح “التطهير العرقي الإسرائيلي للشعب الفلسطيني”.#عرب_لندن,2023-10-21:23:41,h t t p s : / / s c o n t e n t . f t u n 1 5 - 1 . f n a . f b c d n . n e t / v / t 3 9 . 3 0 8 0 8 - 6 / 3 9 8 2 8 3 1 2 6 _ 8 1 1 8 2 1 6 1 7 6 1 6 3 8 4 _ 4 4 5 6 8 5 3 8 3 2 8 8 9 9 0 3 2 4 9 _ n . j p g ? _ n c _ c a t = 1 0 3 & c c b = 1 - 7 & _ n c _ s i d = 5 f 2 0 4 8 & _ n c _ o h c = q b 0 y P N F H B w 0 A X 9 h 6 D d Z & _ n c _ h t = s c o n t e n t . f t u n 1 5 - 1 . f n a & o h = 0 0 _ A f C f 0 t q U T B P p 4 x G n C V w 6 Y W w r q 3 R N E 1 _ q r J 7 m L O e 4 q i j G y w & o e = 6 5 5 6 A 5 5 9,https://www.facebook.com/arablondon4/posts/pfbid02vpuxKfDYgLNm2Nc2uzRqBgZDDvrgreiHQ8VSEKooh26YnyaMKxbFiKkdR96sTDPil?__cft__[0]=AZX2YG4jpI8w03dXQX8vG11OilV9UjH6G1jl5cqRy9U06NE2Q9wW8393A2uZLqb9QKc15augpCYapIr8GJDdyWf266mLPtJdVVzacKamh9MkujSOadW6nTNAXmYgCAMThDcvsnBlY6ihogbTfi4Y2BwRV8DK0WqxnwkQZoKi-Xl8zjAomafl8tnq-tN5qWrlTwCyoDI0WoI6BVEwaKz3Zaw1&__tn__=%2CO%2CP-R,| ‘ مسج L b .‏ ل ) ا * 7# 0 : 2 ! [ ———— B 3 D¢ Dy —‏ bty F T‏ i‏ سابع A‏ ] 0 رخسي ال
pfbid0eZfeWSUFnT9fX7BqsMKdrCMxpn8ucuT7p8D5xSttgmLM6H82VUPUabibh5dVg3Hyl,Arab-London عرب لندن,3,7,العاصفة سياران تضرب جنوب إنجلتراأحدثت رياح عاتية وأمطار غزيرة تسببت بها العاصفة سياران، اضطرابا كبيرا في جنوب إنجلترا الخميس، مع تعليق المواصلات البحرية لعدة ساعات من ميناء دوفر وإغلاق مئات المدارس.وأغلقت جميع المدارس والمباني الحكومية في جيرسي أبوابها، فيما أوصت السلطات السكان بالبقاء في منازلهم، كما عُلِّق العبور معظم فترات الصباح، فيما نبه ميناء دوفر (جنوب شرق إنجلترا) إلى توقع حدوث تأخيرات في الساعات المقبلة.#عرب_لندن,2023-10-21:23:45,h t t p s : / / s c o n t e n t . f t u n 1 5 - 1 . f n a . f b c d n . n e t / v / t 3 9 . 3 0 8 0 8 - 6 / 3 9 8 3 9 2 6 0 7 _ 8 1 1 8 1 9 6 0 7 6 1 6 5 8 5 _ 5 1 5 5 0 5 6 6 0 1 0 1 8 6 2 0 9 7 0 _ n . j p g ? s t p = d s t - j p g _ p 1 8 0 x 5 4 0 & _ n c _ c a t = 1 0 8 & c c b = 1 - 7 & _ n c _ s i d = 5 f 2 0 4 8 & _ n c _ o h c = 1 q F 6 U O z 6 2 C 8 A X _ 3 n j 7 H & _ n c _ h t = s c o n t e n t . f t u n 1 5 - 1 . f n a & o h = 0 0 _ A f A d O t i 6 D B 6 U B H d Q v e p z 0 p u Y D W a - h e e e x A e K O Y 9 - U W T J W g & o e = 6 5 5 6 2 F 9 3,https://www.facebook.com/arablondon4/posts/pfbid0eZfeWSUFnT9fX7BqsMKdrCMxpn8ucuT7p8D5xSttgmLM6H82VUPUabibh5dVg3Hyl?__cft__[0]=AZXo0AkfmhZmKYe-fNe-trlR6YIq3QhQ8em7ufLmDO3ZlXdPUsE4T8YkvtM6Koq_5z_OGOyQs_pNE337gTehgSpFdqYwmmKp5N-uNiRdTtYykawQheKSUAEOgnzwjpnS_8h2hF64TkTPXE6VWo_B-KiLhj1xdhO4aR7ogkiDofpcR8a1r3e9_isrC_LDSldy7sL1FHPCjzASm6-j_uGHYDd2&__tn__=%2CO%2CP-R,"N‏ ل لال ب i 0 ey‏ ادا b‏ ااا | = يا قا ال ١ Mt MR‏ البلا ل ""1 راو لخ ey‏ ااا A X‏ رةه ؟ 0 s N,‏ ا ب ا . \ S #T‏ ابا : < لا د مقاط الأ e‏ .y TR T ounS‏ ب"
pfbid0NgUnYwHGz7S36jfa8ZPoVcPRjdyti2HAMzyc3LxH6FfygBHjG9arTUHuybwxtznJl,Arab-London عرب لندن,7,8,المجلس الإسلامي البريطاني: زيادة الإسلاموفوبيا بنسبة 140%منذ حرب غـ.زة ووزيرة الداخلية البريطانية سويلا برافرمان تثير الفتن والكراهية#عرب_لندن,2023-10-21:23:57,h t t p s : / / s c o n t e n t . f t u n 1 5 - 1 . f n a . f b c d n . n e t / v / t 1 5 . 5 2 5 6 - 1 0 / 3 9 8 3 5 1 1 9 5 _ 3 4 1 5 0 6 5 5 5 2 2 4 9 7 5 _ 3 0 8 9 7 2 5 9 4 6 5 2 6 5 3 6 7 8 _ n . j p g ? s t p = d s t - j p g _ p 1 8 0 x 5 4 0 & _ n c _ c a t = 1 0 5 & c c b = 1 - 7 & _ n c _ s i d = 1 a 7 0 2 9 & _ n c _ o h c = P K H V C g p G 4 w E A X - 9 1 v X D & _ n c _ h t = s c o n t e n t . f t u n 1 5 - 1 . f n a & o h = 0 0 _ A f B 0 a A a K j J 0 C k o w s 6 s D O h S r e i R m c C I _ b G 7 a i g V 5 N X y 4 l h g & o e = 6 5 5 5 B 7 0 6,https://www.facebook.com/arablondon4/posts/pfbid0NgUnYwHGz7S36jfa8ZPoVcPRjdyti2HAMzyc3LxH6FfygBHjG9arTUHuybwxtznJl?__cft__[0]=AZVXlQRz6rEIXs8d5LYVwpoQVFBNV9DIDdjexTvALUaGY0DbKPbU7GscIgu3UGj3QZcQn3BH4qn2jRRm2V_b13uQ-2yBd450k6apE1Jt-CrLXm80RhQoOIHA_NwfgdN-7v7Mb7Xjx1dvjHoXQdABEqSwfnT8IDVU_UT9UQt7RBSULIPwB-03LNdoBW2Jv2vEGcH0Ru3zl2FF8JWOJ69zDypT&__tn__=%2CO%2CP-R,« بريطانيا رنب > ود اين — i‏ 2 كه“ TV‏ \ اا ا ب 7 e‏ ) منذ جرب غزة ووزيزة الداخلية تثير الفتن والكراهية! f . ١ &=
pfbid0hQaHyhm3TjoNd6hnhU8AfEtP7C9WdfKLTtQJMZGDWpwpxL8n7SUDhz8BSCeeDhnal,Arab-London عرب لندن,0,0,الدبلوماسي الاسرائيلي السابق دانييل ليفي ، مقارنة مهمة بين فلسطين وأوكرانيا#عرب_لندن,2023-10-28:18:33,h t t p s : / / s c o n t e n t . f t u n 1 5 - 1 . f n a . f b c d n . n e t / v / t 1 5 . 5 2 5 6 - 1 0 / 3 7 5 2 3 6 4 5 7 _ 8 8 6 5 4 7 3 2 6 3 2 8 3 8 3 _ 2 6 8 3 1 0 8 4 5 6 0 9 7 3 5 4 0 5 5 _ n . j p g ? _ n c _ c a t = 1 0 7 & c c b = 1 - 7 & _ n c _ s i d = 1 a 7 0 2 9 & _ n c _ o h c = U c X 4 K n 7 A k G 4 A X 9 2 6 f U g & _ n c _ h t = s c o n t e n t . f t u n 1 5 - 1 . f n a & o h = 0 0 _ A f A m P a a K W m B N X Y e i B s I n n I c 5 E p l 3 _ S u 7 J B s F m b j 5 a x S D x Q & o e = 6 5 5 6 6 B A 0,https://www.facebook.com/arablondon4/posts/pfbid0hQaHyhm3TjoNd6hnhU8AfEtP7C9WdfKLTtQJMZGDWpwpxL8n7SUDhz8BSCeeDhnal?__cft__[0]=AZVicDEjOhr4VBAbAjl1c_UzlxSYD8n1LP3Dr2qormw7tG37dPMuzNkY6Z8A8BkqRjHmX-KTyT46W5Fq9YTf56Jl9cjYvsVM7dhxF2LUEJfaFkg5AQDrLqZqGHMyIBcy1dr1yXnWToKQHl322lcQ-rivARBtcQAqVzTvbm2mRdGA4yiZJTJcpuPI-9MrWfXO_M1JhRGv67nj5ow587OpERhH&__tn__=%2CO%2CP-R,- عرب ب ’ B‏ v =‏ | \ AgTm—— N‏ - | -| |
pfbid02Uk2UL6sdyhP3A11fvHRnq9AgmZy5Mn2eo8DYum7h3kDTCDzfxQdEhf12iDRSVJfvl,Arab-London عرب لندن,0,0,"المجلس الإسلامي البريطاني: ""زيادة جرائم الإسلاموفوبيا في لندن بنسبة 140% منذ بدء الحرب على غزة""حيث أظهرت أحدث بيانات وزارة الداخلية البريطانية في مارس/ 2023، أنه يتم استهداف شخصين مسلمين من بين 5 أشخاص في جرائم الكراهية الدينية، مما يظهر أن الجالية المسلمة المجموعة الدينية الأكثر استهدافا في البلاد، أي ما يعادل 39% من معدل جرائم الكراهية الدينية. وأوضح المجلس أنه، وعلى مدار هذا الصراع المدمر في غزة، شهدنا موجة من جرائم الكراهية، مع زيادة بنسبة 140% في جرائم الإسلاموفوبي… En voir plus",2023-10-28:19:17,h t t p s : / / s c o n t e n t . f t u n 1 5 - 1 . f n a . f b c d n . n e t / v / t 3 9 . 3 0 8 0 8 - 6 / 3 9 8 4 2 0 4 5 8 _ 8 1 1 2 6 0 0 9 4 3 3 9 2 0 3 _ 7 6 4 9 9 3 5 6 3 9 9 1 3 7 8 1 5 6 1 _ n . j p g ? s t p = d s t - j p g _ p 5 2 6 x 2 9 6 & _ n c _ c a t = 1 0 8 & c c b = 1 - 7 & _ n c _ s i d = 5 f 2 0 4 8 & _ n c _ o h c = W U J h V v 3 V 9 a o A X 9 H u X S T & _ n c _ h t = s c o n t e n t . f t u n 1 5 - 1 . f n a & o h = 0 0 _ A f B 2 o Z C u x r Q B D C J I 1 e w Q n h I D d c t 5 s 1 2 U o K r l P n y v 3 B a G q Q & o e = 6 5 5 5 E 5 F 5,https://www.facebook.com/arablondon4/posts/pfbid02Uk2UL6sdyhP3A11fvHRnq9AgmZy5Mn2eo8DYum7h3kDTCDzfxQdEhf12iDRSVJfvl?__cft__[0]=AZWdn6KMyZQmLguegv75_m73hfJq7rnNbZwMxskRCOxAY9pS9zPEOoPN1QEv8U98XbWkSE0qhyM3gkRNOF_hqTzjVWJVCKdHyKNEbK267DFvHC3FJmqaYseZPymJOowsbeNuA8ip3ZOJCQ39Z1G34NPVsZW0XUPd08WekDv4y9q7Uhq0zEB2YfMXmoWQnvxzSnBL_wL0_Jlfbapk48rxr3iS&__tn__=%2CO%2CP-R,"131 نا A ey‏ ا - اذا "" ا ب 0 م . حصنا 8 = - 2 1 0 ١ [\ الو‎ : د ميا The Muslim Council Britain"
pfbid0mJRPcpYyL9FayfCfzepPcb8ANBpJ8K76FpyFFMuY3RBqFowbBkZTJb4EyYL5BaF2l,Arab-London عرب لندن,0,0,"مديرة منظمة هيومان رايتس ووتش في المملكة المتحدة ياسمين أحمد: ""القانون الدولي أصبح موضع شك.. والقوة تحولت ليد الشعوب""#عرب_لندن",2023-10-28:21:46,h t t p s : / / s c o n t e n t . f t u n 1 5 - 1 . f n a . f b c d n . n e t / v / t 1 5 . 5 2 5 6 - 1 0 / 3 8 4 5 5 3 5 0 3 _ 3 6 9 5 8 7 7 6 8 7 4 9 5 5 6 _ 7 3 5 4 0 7 7 5 6 8 2 3 7 5 1 3 2 9 1 _ n . j p g ? _ n c _ c a t = 1 0 9 & c c b = 1 - 7 & _ n c _ s i d = 1 a 7 0 2 9 & _ n c _ o h c = C 5 C G 7 b Y l y o 0 A X 8 J I n V k & _ n c _ h t = s c o n t e n t . f t u n 1 5 - 1 . f n a & o h = 0 0 _ A f B D 8 2 n V g t d S m o p n j 6 J g n A n j O v 6 W T K q n z k q K c N 9 N l Z 7 D 4 Q & o e = 6 5 5 6 A A A 8,https://www.facebook.com/arablondon4/posts/pfbid0mJRPcpYyL9FayfCfzepPcb8ANBpJ8K76FpyFFMuY3RBqFowbBkZTJb4EyYL5BaF2l?__cft__[0]=AZUkB5F5h_4vFKtmKS9viCvC-Iq03r8jTOv3eYlSCKswEVHb6DLhudmm8XtwPHaEZhPsFJV2OMyKWnWonslf0zZdYuyvVigXDrbeYlJOYHAvwISY9u-1Uu6HsfTO0vFzNSRHNzzpcWrlU7aTD5e8jrPpu6s_f-daGyNdg-BO_2lwTeRuzzasLnlU4WGfCldaat976QhsiSTHd4tTDU34C4Ke&__tn__=%2CO%2CP-R,_ . حل . - ا مع ﬁ}‏ _ 0 هلوز ¢ g‏ وهو أننا في عصر جديد لم تعد في عصر |
