id,name,shares,comments,content,posted_on,image,post_url,image_content
pfbid0gCu7Bdsw12vAq32iWjqJ7dSKRNQaskyTfbUETVFjx2T6vHqDGUE7djstbUvZkyxcl,Nokta & Mouzika,0,0,مراحل تطوّر سيدي العربي كي تعملوا قدر ,2023-11-13:08:02,h t t p s : / / s c o n t e n t . f t u n 1 6 - 1 . f n a . f b c d n . n e t / v / t 3 9 . 3 0 8 0 8 - 6 / 3 4 5 6 1 6 2 3 0 _ 9 0 5 7 2 3 4 9 0 7 2 0 7 4 2 _ 7 6 2 8 6 5 3 5 6 3 6 6 2 3 6 7 5 0 3 _ n . j p g ? _ n c _ c a t = 1 0 5 & c c b = 1 - 7 & _ n c _ s i d = 5 f 2 0 4 8 & _ n c _ o h c = 0 4 0 e v V N j J Z o A X 9 K q J B Y & _ n c _ h t = s c o n t e n t . f t u n 1 6 - 1 . f n a & o h = 0 0 _ A f D 9 r y 5 j z g U 8 U 8 N S u T j b Y f h U w O D c n Y l 9 o 7 X d e I _ c u o B U m w & o e = 6 5 5 7 6 5 2 1,https://www.facebook.com/lahmarhamtisssss/posts/pfbid0gCu7Bdsw12vAq32iWjqJ7dSKRNQaskyTfbUETVFjx2T6vHqDGUE7djstbUvZkyxcl?__cft__[0]=AZWdNqMihBmLwS-p_TiPATD5WARxBKuaSXWOG_L1Wf0iQvustIG5NH4uokLQ_hnvMC777uCUIadLvq5Av97yDwHkuxDKeh3NJ0KokzO5PUT92cUA0TlcNz66CoMokYSI88B_HSTUx0jKH5bry5LIAI5jMdEPMr5KH4elGLVYI-HLb-0dMKk3LD22BzLN-VtjodT4ShPOC-EPrnyWfqhn7pPA&__tn__=%2CO%2CP-R,
pfbid0oMgM5NMxx4FGvKjx9Rvj1oTSg2V5DGGyUNESdSNEydBDsKaYG2eK1ZG4jpaGj1E8l,Nokta & Mouzika,0,0,"#سامي_الفهري ينشر صورة لوالدته من فترة شبابها و يعلق :""لقد قطعنا شوطا طويلا... لم يكن الأمر دائما سهلا لكنه كان دائما بالابتسامة""",2023-11-13:08:09,h t t p s : / / s c o n t e n t . f t u n 1 6 - 1 . f n a . f b c d n . n e t / v / t 3 9 . 3 0 8 0 8 - 6 / 3 4 4 3 1 7 3 5 2 _ 1 2 0 6 9 8 2 6 3 3 3 1 4 3 4 4 _ 8 6 4 5 7 1 4 1 8 4 5 5 0 1 3 0 7 8 2 _ n . j p g ? s t p = d s t - j p g _ s 6 0 0 x 6 0 0 & _ n c _ c a t = 1 0 1 & c c b = 1 - 7 & _ n c _ s i d = 5 f 2 0 4 8 & _ n c _ o h c = K _ F S o C A A F C w A X - 7 m e p A & _ n c _ h t = s c o n t e n t . f t u n 1 6 - 1 . f n a & o h = 0 0 _ A f D x s Z - C z K 1 W x P N _ J X V x Y c N 6 _ r t Q 9 f F u d 5 R 7 H f Z 1 d n j - 0 Q & o e = 6 5 5 7 A 6 9 A,https://www.facebook.com/lahmarhamtisssss/posts/pfbid0oMgM5NMxx4FGvKjx9Rvj1oTSg2V5DGGyUNESdSNEydBDsKaYG2eK1ZG4jpaGj1E8l?__cft__[0]=AZV1RHDCQC8nAiHOZVZWk4lxD5v1PCg-bvtNuwSCou8MF5wiMcCNjFeWmlTO_1mjrQTKIIw7UDjPwt7iE_fNexDa2kUfDRw-gZTYHOimoN-iz67ZkEV49CHERIAtkEeV3wQS0CfsEhqiE7yrvfb9B2PNXpMDgxDTB1trbw0qcUPa3hlTS0teSuvlEgs08KtyMI3v8S47-pcXFqmuv0Lp1foc&__tn__=%2CO%2CP-R,"i J .,‘:3{ ) T اك‎ b 7 N 7 مخ‎ 7 \TE ل‎ 7 أ‎ . 4 ِ ) { , ايك‎ 0 0 ] | ؤ‎ A > a oy 2 8 1"
pfbid022WwyVpCqKga1e5Tg38PfcUk11AND2RE32UNYtKG6WhPxoF8FdMzDjVK7qVDnTvHHl,Nokta & Mouzika,0,0,"أغبى مليونير في التاريخ اعتبر الكثيرون رجل الأعمال الأمريكي تيموثي ديكستر (1806-1747) ، الشخص الأكثر غرابة في عصره. رغم سذاجته حقق نجاحًا تجاريًا كبيرًا وأصبح من أثرياء أمريكا. أجرى ديكستر سلسلة من الصفقات الناجحة بشكل مذهل رغم حتمية فشلها طبقًا للمنطق والعقل.- نصحه بعض الأشخاص على سبيل السخرية أن يقوم بتصدير الفحم إلى مدينة نيوكاسل الإنجليزية، وهناك تعبير انجليزي شهير ""شحن الفحم إلى نيوكاسل"" والذي يقابل في العربية ""بيع الماء في حارة السقائين"" ذلك أن المدينة الإنجليزية في ذلك الوقت كانت رائدة العالم في تعدين الفحم، ولكن ماذا حدث؟أرسل ديكستر شحنات الفحم إلى المدينة، من حسن حظه اتضح أن جميع عمال المناجم المحليين مضربين عن العمل، ولم يكن هناك فحم في أي مكان، وبعد هذه الصفقة تضاعفت ثروته تقريبًا. ‏- أرسل ديكستر أيضًا قفازات من الصوف إلى جزر الهند الغربية، والتي تشتهر بارتفاع درجة الحرارة ولكن تصادف وجود بعض التجار الآسيويين الذين اشتروها منه لتصديرها إلى سيبيريا الروسية. في نهاية حياته نشر مذكرات بعنوان ""من أجل متعة العقول الذكية"" مع الكثير من الأخطاء الإملائية وعدم وجود علامات ترقيم على الإطلاق نجح الكتاب نجاحًا منقطع النظير !",2023-11-13:08:09,h t t p s : / / s c o n t e n t . f t u n 1 6 - 1 . f n a . f b c d n . n e t / v / t 3 9 . 3 0 8 0 8 - 6 / 3 4 4 2 7 7 9 0 7 _ 1 2 8 6 9 1 3 5 7 8 8 9 3 6 2 2 _ 8 6 0 3 7 3 6 1 9 0 4 5 1 0 4 0 6 4 1 _ n . j p g ? _ n c _ c a t = 1 0 7 & c c b = 1 - 7 & _ n c _ s i d = 5 f 2 0 4 8 & _ n c _ o h c = S s 6 s K B f A o v c A X 8 t - d s t & _ n c _ h t = s c o n t e n t . f t u n 1 6 - 1 . f n a & o h = 0 0 _ A f C 9 r S R 6 e L i t u A g r U T E J I i F S _ 8 W a L H L k V o s b H w Y m 0 g 8 h 0 A & o e = 6 5 5 6 8 E 3 1,https://www.facebook.com/lahmarhamtisssss/posts/pfbid022WwyVpCqKga1e5Tg38PfcUk11AND2RE32UNYtKG6WhPxoF8FdMzDjVK7qVDnTvHHl?__cft__[0]=AZXrwGTrZxeUpPe3zP9nmISNU3GqfWWL9gJJI5EOtzNYWaj2_bkr_Jg8lOugM7PJw9x3zWE-3snhHHqp0n28wnvz4JfcDo37vbfcX-C5FLULgRrDVFWqfM-Mn-9aoJG_GhH4tCOEFYJ9fNENhxW6iQqgrVKcFiBO5ylHWMjOnDbcva5C139Y9XKvfIWjVkDyzwZyFCoqHVZxBR7MFiQTcPTN&__tn__=%2CO%2CP-R,[ AT y S
pfbid02iesTveVgcMVdeP9TVa2xeFf2FqpWT4x1rRxX8peoscPS5amH3ADgzwxnTki8kgrCl,Nokta & Mouzika,0,11,إنا لله وإنا إليه راجعون                   انتقل الى جوار ربه المغفور له باذن الله                         السيد عبد الباسط القْطاري                             بسم الله الرحمن الرحيم«كُلُّ نَفْسٍ ذَائِقَةُ الْمَوْتِ وَإِنَّمَا تُوَفَّوْنَ أُجُورَكُمْ يَوْمَ الْقِيَامَةِ فَمَنْ زُحْزِحَ عَنِ النَّارِ وَأُدْخِلَ الْجَنَّةَ فَقَدْ فَازَ ومَا الحيَاةُ الدُنيا الاّ متاعُ الغرُور» صدق الله العظيمنسأل الله تعالى أن يغفر له ويرحمه ويكرم نزله ويوسع مدخله وأن يجازيه بالحسنات إحسانا وعن السيئات عفواً وغفرانا .. وأن يغسله بالماء والثلج والبرد وأن ينقيه من الذنوب والخطايا كما ينقى الثوب الأبيض من الدنس .. وأن يخلف عليه بدار خير من داره اوأهل خير من أهله .. وأن يرزق ذويه الصبر.....,2023-11-13:07:41,h t t p s : / / s c o n t e n t . f t u n 1 6 - 1 . f n a . f b c d n . n e t / v / t 3 9 . 3 0 8 0 8 - 6 / 3 3 8 5 5 1 6 2 6 _ 9 7 0 0 3 3 4 2 0 6 7 0 0 3 3 _ 9 1 2 5 3 0 0 6 0 2 7 2 7 3 1 9 4 2 1 _ n . j p g ? s t p = d s t - j p g _ p 5 2 6 x 2 9 6 & _ n c _ c a t = 1 0 8 & c c b = 1 - 7 & _ n c _ s i d = 5 f 2 0 4 8 & _ n c _ o h c = t p w t F t Y B X j g A X 8 y 9 1 s E & _ n c _ h t = s c o n t e n t . f t u n 1 6 - 1 . f n a & o h = 0 0 _ A f D c K 9 E g Y y U i S K q A h 2 i b 5 N Q r i I I B V G - Z Y Q T X t w I 3 l _ 6 A v Q & o e = 6 5 5 6 F 3 E F,https://www.facebook.com/lahmarhamtisssss/posts/pfbid02iesTveVgcMVdeP9TVa2xeFf2FqpWT4x1rRxX8peoscPS5amH3ADgzwxnTki8kgrCl?__cft__[0]=AZWqHbrQtTrN6RCxN31QYrBC8Ird0fOFISaFEJeVm_2GUrsLTxN88aw9nQYedtHOCZEO825C6hzvjC5aytdsxhkeF0Oo4N18m-_gYFHx1XofjJYJBnr6B7plO_zzLz1J2cppdlzlL0cAJVH7-KD4EjAwNHB2PNh-k6fgQnqHNV18aPuMddT-LQLeVkEUE1bnuxQWDp7mX_nn1ztUfaBmadge&__tn__=%2CO%2CP-R,إن لله وأن اليه راجعون يسم الله الرحمه o)‏ « يا \al‏ النَقُْ alinhall‏ ارج إلى لَه رَاهِيَةٌ مَرَهِيَةٌ 536 في ارم B3y‏ كن » صدة الله العظيم اليا § ب | ء v‏ N ]‏ iy‏ 1 \. A‏ و9 ل حم ‘ >< لله
pfbid0DqxUV3x3zFniXa9igZTpNYiX7bNJX7CUzvMhcxuvrwLyEfRJJSKa4H1HnxKKCeNJl,Nokta & Mouzika,3,1,محلا زينو ,2023-11-13:07:41,h t t p s : / / s c o n t e n t . f t u n 1 6 - 1 . f n a . f b c d n . n e t / v / t 1 5 . 5 2 5 6 - 1 0 / 3 3 8 9 3 0 4 4 9 _ 1 3 6 0 2 4 1 9 1 1 4 9 7 4 6 3 _ 3 7 9 8 2 6 9 5 1 6 5 8 1 5 9 6 6 0 0 _ n . j p g ? s t p = d s t - j p g _ s 9 6 0 x 9 6 0 & _ n c _ c a t = 1 0 0 & c c b = 1 - 7 & _ n c _ s i d = 1 a 7 0 2 9 & _ n c _ o h c = 1 N o 3 y f D 3 p Q w A X - o M U z e & _ n c _ h t = s c o n t e n t . f t u n 1 6 - 1 . f n a & o h = 0 0 _ A f D o a 3 4 O h o B u C - 3 L _ N L V f M x 0 x r 7 8 l q 9 O G l B v E w F V k d T o 1 w & o e = 6 5 5 7 2 D E B,https://www.facebook.com/lahmarhamtisssss/posts/pfbid0DqxUV3x3zFniXa9igZTpNYiX7bNJX7CUzvMhcxuvrwLyEfRJJSKa4H1HnxKKCeNJl?__cft__[0]=AZXl-BGXNWo0rL69_GEX_ZXnQw396HgaZx-pmga4E4Gz_UO9Cwe1wswFocS42H_nGN1uqLfijVXB6QJNuc8kFbPhwkC6lQQvY7tMNSS-ed8sr1LwqtZqXDaOBWie5HdJc6rK3S8g_Vz80SBrm5C1bBgFOg0IACqQFBJq1Bx4eDLkJZzY2AIKOi8fiDxDgttyTFkR9Tn96CJZi2zWzBa1DI2X&__tn__=%2CO%2CP-R,"ٍ: خم ب . ) Si / \’ ﬁ:, ض “المي ا"
pfbid027yYnFMBUfkH6wM7LgxmL5UrGbNAZFhb8KWiLkP4CmJJeLwVdqaSJgVtNFUV92gXol,Nokta & Mouzika,3,2,,2023-11-13:07:41,h t t p s : / / s c o n t e n t . f t u n 1 6 - 1 . f n a . f b c d n . n e t / v / t 3 9 . 3 0 8 0 8 - 6 / 3 3 8 8 7 5 6 5 8 _ 8 9 5 2 2 7 7 5 5 0 6 7 3 9 5 _ 3 3 0 2 2 2 2 1 3 1 7 2 7 0 9 0 6 3 0 _ n . j p g ? _ n c _ c a t = 1 0 2 & c c b = 1 - 7 & _ n c _ s i d = 5 f 2 0 4 8 & _ n c _ o h c = e j q j 3 Q 7 0 m W 8 A X 9 Z 3 J j R & _ n c _ h t = s c o n t e n t . f t u n 1 6 - 1 . f n a & o h = 0 0 _ A f C l T v U C s w c T _ I r u v 8 A X W E v 3 V Y 6 S - K F 1 m X L L X V G T c t 6 b k A & o e = 6 5 5 6 1 F 6 1,https://www.facebook.com/lahmarhamtisssss/posts/pfbid027yYnFMBUfkH6wM7LgxmL5UrGbNAZFhb8KWiLkP4CmJJeLwVdqaSJgVtNFUV92gXol?__cft__[0]=AZXjMOgTFDnWhmrptc1iCL89eiyfUYsfJQZA0-pripKajMfeDIfxwZn7wQnA2g9r1AlhccXW5qazOv0xL0ne9EolSl2gLwt9v-nVLOqHvXx3s38_lCyjohxJ0rZ74xpJZG93HT98duT2xUnsBWS8wN6EoMleWW4iHsUx4s9GpWHbIxTJObDdJvjEwhMreWspKyhNprZsqVUH8_Tpm0xj-YJk&__tn__=%2CO%2CP-R,شحال طوماطيش 0 ارواح يريفي اله ي: T\ \ J‏ مسي للب 7
pfbid02uZXRwwKCVZrsa6T1ubR5BGMrjRVoNgRAk18x1TUNJVHhnf1rMUTLhhkLne6e5RWfl,Nokta & Mouzika,0,0,نظرا للجفاف الكبير الذي تشهده معظم أنحاء الوطن ،نطلب من السلطات تنظيم صلاة الاستسقاء  في أقرب وقت ،والتضرع إلى الله وكثرة الاستغفار وإخراج الزكاة والصدقات ،ونسأل الله أن يغيثنا في هذا الشهر المبارك ,2023-11-13:07:46,h t t p s : / / s c o n t e n t . f t u n 1 6 - 1 . f n a . f b c d n . n e t / v / t 3 9 . 3 0 8 0 8 - 6 / 3 3 7 3 5 6 2 4 6 _ 8 8 7 5 5 7 0 0 2 5 4 0 4 2 3 _ 6 5 3 3 6 0 0 3 5 5 3 9 0 7 4 0 8 4 _ n . j p g ? _ n c _ c a t = 1 1 0 & c c b = 1 - 7 & _ n c _ s i d = 5 f 2 0 4 8 & _ n c _ o h c = m 2 H H 5 s V h h r s A X 8 1 h c t b & _ n c _ h t = s c o n t e n t . f t u n 1 6 - 1 . f n a & o h = 0 0 _ A f C l F 1 z R K M n N a w U 6 l L 6 y Y o G J C g v i Y p E t 4 T F T m r v a r o E Z 9 g & o e = 6 5 5 6 B 9 B 2,https://www.facebook.com/lahmarhamtisssss/posts/pfbid02uZXRwwKCVZrsa6T1ubR5BGMrjRVoNgRAk18x1TUNJVHhnf1rMUTLhhkLne6e5RWfl?__cft__[0]=AZU1oqU7c6KQL-lvbGb6L18DbhpYRlXCX8Nxp15DNxMyNZQu05dVxwxUFqbS0qWVtt5PUXGsM0IWdheCE5PucXIp5AsTZOt9Pad-dL6u6_KFQlrrEWpRg_pYhViTYNUNEPT4VyvZBJ3vnCQQnxg0oh79vp18g5imQdhkzV8fgtx34P8mBdZsBX4jffCbxzOdDY-5o6gBp5iBuimt9HgW_yTJ&__tn__=%2CO%2CP-R,"رطا / o‏ ) 1 0 ال باز ل الل I\ P‏ ل 11 1 0 ايز 00 ل 1 ١ Rl Y‏ زا 1 ابر 0 1 ) 0 0 ا الب لال ال 01 ل 00 o\‏ ا ل 0 LR A W‏ ا B Nk‏ i 0‏ ص عط ا ا ان Q7‏ 011 ا s‏ 7 2 ARG g B 0‏ > اا ا R‏ ا ل ل ل"" الا * ل ا"
pfbid0ES95JVBWZvNGK4VGazs5v5v3c72Nsp4UHcKRaP4iUAx3N7cYv6B8phRbZUfMbTLQl,Nokta & Mouzika,0,0,الممثلين الكل قتلهم مالحلقة الأولى ..,2023-11-13:07:48,h t t p s : / / s c o n t e n t . f t u n 1 6 - 1 . f n a . f b c d n . n e t / v / t 3 9 . 3 0 8 0 8 - 6 / 3 3 7 0 3 7 4 8 6 _ 2 3 5 7 1 3 6 0 8 9 2 6 6 5 2 _ 2 6 3 3 8 6 0 5 6 5 1 3 2 6 9 3 3 8 9 _ n . j p g ? _ n c _ c a t = 1 0 0 & c c b = 1 - 7 & _ n c _ s i d = 5 f 2 0 4 8 & _ n c _ o h c = j e h 4 6 z n O S - k A X _ 3 p 4 X m & _ n c _ o c = A Q l e W e Y O m q 0 z O s g v J B F T J 2 S R i U - Z - G X U P 9 0 N J H d m b S g y m M B E x d H W D O 3 q o 3 c m - R P 9 9 C 4 & _ n c _ h t = s c o n t e n t . f t u n 1 6 - 1 . f n a & o h = 0 0 _ A f A 0 b 1 7 Q 4 4 D J J 9 Z Z G T x 9 C u r 8 V J Q 4 1 Q a E X f d g S h 2 Q - T W - B g & o e = 6 5 5 6 D 4 1 3,https://www.facebook.com/lahmarhamtisssss/posts/pfbid0ES95JVBWZvNGK4VGazs5v5v3c72Nsp4UHcKRaP4iUAx3N7cYv6B8phRbZUfMbTLQl?__cft__[0]=AZUtnapAyisxUmYG0tscp9cJSUW5JJKzL0j2AKZ1hzQPn7n8z28QZGNfHKuS5i4qDkTr9nI9T7Frfkwoe7oJvsG-NAefNK7klSvf6ZVlMisNZ5A9Krem5wYQGyyaKaT4_IpRsZdRxtRLlkUq3e8BREtOyd734Xn7OapDefZCVW6VLL0WBMW0zX291WID90DgE2slY1gs2ii7L0wYhBB_fSk-&__tn__=%2CO%2CP-R,"ا ل مز F R .‏ ""8 0 ااا « -"
pfbid0F8DkE6ou7vZviNaFUv6aD2iY88rf2UztFbGjfi7r4yRo14sNUQzm2cTrYzihDZxdl,Nokta & Mouzika,0,0,مضيفة طيران ترجع في العصير مالكيسان لباكو العصيرهاكا علاش مانسافرش بالطيارةزايد مع النقل الريفي,2023-11-13:07:48,h t t p s : / / s c o n t e n t . f t u n 1 6 - 1 . f n a . f b c d n . n e t / v / t 3 9 . 3 0 8 0 8 - 6 / 3 3 7 0 1 5 9 6 7 _ 2 3 6 4 8 2 5 4 5 5 0 4 6 8 7 _ 6 3 5 1 3 7 7 5 1 5 6 3 0 4 1 0 6 4 9 _ n . j p g ? s t p = d s t - j p g _ p 5 2 6 x 2 9 6 & _ n c _ c a t = 1 0 3 & c c b = 1 - 7 & _ n c _ s i d = 5 f 2 0 4 8 & _ n c _ o h c = j i h 7 0 3 E 4 g m I A X _ O P q F 8 & _ n c _ h t = s c o n t e n t . f t u n 1 6 - 1 . f n a & o h = 0 0 _ A f A H d h q Q 5 L q a U S w 2 z X c 7 - P O K p M I T D j _ c v E 6 6 M C a m Y t i A N g & o e = 6 5 5 6 4 A 6 5,https://www.facebook.com/lahmarhamtisssss/posts/pfbid0F8DkE6ou7vZviNaFUv6aD2iY88rf2UztFbGjfi7r4yRo14sNUQzm2cTrYzihDZxdl?__cft__[0]=AZVDIgT_JaCuXE18VnukPkuNXIQVEcRSxluuIn6foYiRiTNBLvZctajHiA7wwyJWGQEKKvZBBecBIIPwil-gDjPdlGaLbtAR_1OKtno3G1ckNAgvo1gL9ZYm_wHdgGv8y5V3bUT6SLCuhTAyRUrZ6iLpxzsRv4bNnHY-hhkecxasn1lm3m6KBUQJWZBdOfyjh7SbUVCVxrPEl2gJmMaGt0gg&__tn__=%2CO%2CP-R,"7| )ً 1 , | 9 <l 1 & ! 2 8"
pfbid034Lt3uwkxaBf6MCVKkggWrzqbyDxYvRsVW9qBwBWJx8dXZ3m57vcKrG49YfQRBe6pl,Nokta & Mouzika,0,3,رمضانكم مبارك  ♡ ,2023-11-13:07:50,h t t p s : / / s c o n t e n t . f t u n 1 6 - 1 . f n a . f b c d n . n e t / v / t 3 9 . 3 0 8 0 8 - 6 / 3 3 6 8 7 4 5 2 5 _ 9 2 5 8 1 8 1 6 5 2 3 7 6 8 4 _ 4 5 5 4 8 5 4 2 0 0 5 6 1 0 2 2 5 3 0 _ n . j p g ? s t p = d s t - j p g _ s 6 4 0 x 6 4 0 & _ n c _ c a t = 1 0 6 & c c b = 1 - 7 & _ n c _ s i d = 5 f 2 0 4 8 & _ n c _ o h c = O 7 P I F Y O E F I E A X _ g i I Q x & _ n c _ h t = s c o n t e n t . f t u n 1 6 - 1 . f n a & o h = 0 0 _ A f D z r i t _ h f Y e E a Y n 3 f 4 d h k t v J 5 q 9 _ Z 9 l h Z W z r 2 2 l q Q Z x f Q & o e = 6 5 5 7 2 1 B A,https://www.facebook.com/lahmarhamtisssss/posts/pfbid034Lt3uwkxaBf6MCVKkggWrzqbyDxYvRsVW9qBwBWJx8dXZ3m57vcKrG49YfQRBe6pl?__cft__[0]=AZWzsl4JWal0Uxhq1GJO1GtkL3KveCNi212bhj-7C7uISDfFLnuqrY_mvGIBtX1m7ogRBztFiSeM0-zrh2_TCdNDm1qkeT3erAf9XzieqxmM8LCgmBst_HSGc89MZTYi1ZVQLRMVYsEDAjCHOhCFHm7RdBr5S9JVQoW3PCz37w7vcDSlEzdJmFCu2tYIF3n3AYs4Px582fdMZS0Z2iD2UISy&__tn__=%2CO%2CP-R,"ا | /)}/{ ل لحي . الون 0 ', دن ل و ا"
pfbid0wvoYAgGy3dfAFCPxMYhNfcGiz1Q1PGQnpPoQ6eKoetmz3kHXroTVFu9LT5twxTXjl,Nokta & Mouzika,1,5,تخيل يبقي ده صباحك كل يوم!⁦,2023-11-13:07:50,h t t p s : / / s c o n t e n t . f t u n 1 6 - 1 . f n a . f b c d n . n e t / v / t 3 9 . 3 0 8 0 8 - 6 / 3 3 7 5 1 5 7 5 5 _ 7 0 0 7 6 3 1 8 8 4 7 0 4 4 0 _ 9 6 1 6 3 8 3 4 1 2 2 5 4 7 9 7 9 8 _ n . j p g ? s t p = d s t - j p g _ p 5 2 6 x 2 9 6 & _ n c _ c a t = 1 1 1 & c c b = 1 - 7 & _ n c _ s i d = 5 f 2 0 4 8 & _ n c _ o h c = n L 9 _ U k w 3 u O 4 A X 9 o s D B X & _ n c _ h t = s c o n t e n t . f t u n 1 6 - 1 . f n a & o h = 0 0 _ A f D x r 0 T W M i 9 V E r O _ w - U C A P q _ 1 S L d m n 9 j L R r c k S e A p 4 E - - g & o e = 6 5 5 6 E 2 B F,https://www.facebook.com/lahmarhamtisssss/posts/pfbid0wvoYAgGy3dfAFCPxMYhNfcGiz1Q1PGQnpPoQ6eKoetmz3kHXroTVFu9LT5twxTXjl?__cft__[0]=AZXa9PH58825AhBlthdxZnsiEtHBFgipBm0I_Ykxp2eGwG6ZkAk0-UTaGw-iqO7HPCIdEfT-jVhHwEy-Y-8XYodKZs_nLz7FP5adYWbjulVpNlSJm1NPuBGhD1iBHPYWBKoZAWPEXOWQ_hsZ1of3bqWiztl1Qp0Azt4IkGALArf3kGofcPWGLOrLmAYoxbE-9-8e5IH_OtuY19GYil7FgD_C&__tn__=%2CO%2CP-R,"١‏ الأ 1د ؟ أي ا AN‏ 1 T >‏ W‏ يالل i 1 ١‏ ¥ / ‘ S -‏ - ١‏ N‏ ¥ الات الا ال لان UL‏ & ا للد 1 1 £ ال ا اق ا ا لا اح ص ل ا ا ا ل ال لزن 1 0"" الت ند اا أ الى لاا - اا . 0 0 B‏ )ا ل o i‏ ا عر ا ار 2007 ا را لأس"
pfbid0m8p1NDmuUNyYKCVBHRMYKzN884Rx7K1fp6b2kTPezstn3tacF7UzUDmNZpWkZjEul,Nokta & Mouzika,2,1, #عـــــــــــــاجل : مفتي الجمهورية التونسية هشام بن محمود يعلن تعذر رؤية هلال شهر رمضان ليكون الخميس 23 مارس 2023 أول أيام شهر رمضان المعظّم في تونس,2023-11-13:07:51,h t t p s : / / s c o n t e n t . f t u n 1 6 - 1 . f n a . f b c d n . n e t / v / t 3 9 . 3 0 8 0 8 - 6 / 3 3 7 1 6 3 0 2 8 _ 1 2 7 3 0 8 2 2 7 3 6 3 9 2 8 4 _ 7 8 5 5 3 5 9 1 4 9 8 0 9 2 9 0 5 3 9 _ n . j p g ? s t p = d s t - j p g _ p 5 2 6 x 2 9 6 & _ n c _ c a t = 1 0 1 & c c b = 1 - 7 & _ n c _ s i d = 5 f 2 0 4 8 & _ n c _ o h c = i C x q J U h T 4 m s A X 8 Y S M f K & _ n c _ h t = s c o n t e n t . f t u n 1 6 - 1 . f n a & o h = 0 0 _ A f D 8 E L d N L Z 1 o C X n - 8 c 8 C r 5 p Z P _ p 8 h 9 X F B H 8 6 j G 7 e _ E B k o A & o e = 6 5 5 6 7 9 1 1,https://www.facebook.com/lahmarhamtisssss/posts/pfbid0m8p1NDmuUNyYKCVBHRMYKzN884Rx7K1fp6b2kTPezstn3tacF7UzUDmNZpWkZjEul?__cft__[0]=AZUALyyLkJ9FyXc3GM5Akpqk_S0rZ8Zl9w4Gf4eflWCHCeWeb-crB4fjzAows2_Y7uWzW9WZPEUnlNpctxfCmV73YvMWws6OtLUQuBWNTvzrKqpLnpYxj7rPkCSzaeeUNtyZ9mUy3AKFeTd25KwpdB7vjbHsQPu_1ZkCJ_PqTJqZeyGAcTeOTAY2iEyj3AqU0sVIJp8RrQCmubezc9pT8U_0&__tn__=%2CO%2CP-R,اكد الخد A‏ حاط ا 7 b‏ 7
pfbid02TjbhxujK8sYw7hVgGvLLcpUGLTvBkfNFuMpFnDbycS56geffgVqiVv6KMrYEGNJpl,Nokta & Mouzika,0,2,الكل ماشي فيبالهم الادمين هكا  وانا في الحقيقة في اول كومنتار ,2023-11-13:07:51,h t t p s : / / s c o n t e n t . f t u n 1 6 - 1 . f n a . f b c d n . n e t / v / t 3 9 . 3 0 8 0 8 - 6 / 3 3 6 9 2 1 3 7 3 _ 1 0 2 3 3 1 8 3 7 2 4 0 6 8 0 9 _ 6 0 2 4 3 6 3 1 4 2 3 4 1 6 6 3 2 _ n . j p g ? _ n c _ c a t = 1 0 3 & c c b = 1 - 7 & _ n c _ s i d = 5 f 2 0 4 8 & _ n c _ o h c = w L N f H 9 p z R l o A X - w z t c 6 & _ n c _ h t = s c o n t e n t . f t u n 1 6 - 1 . f n a & o h = 0 0 _ A f A h M l j A R n O d r R H s m 9 O U Z T T G j F N x e P T K A U L J 1 9 T t 1 K J Q o w & o e = 6 5 5 6 4 F E C,https://www.facebook.com/lahmarhamtisssss/posts/pfbid02TjbhxujK8sYw7hVgGvLLcpUGLTvBkfNFuMpFnDbycS56geffgVqiVv6KMrYEGNJpl?__cft__[0]=AZXhF8BTPOcL1xBWxqFf6clbYgZOVETCYOfgX8oRexOGBolJe-3SzsrxwVvxCXxuqp-xT-nkXARywqt81gq4WODQWa5SQiYNUH4zNCUJYaYIO9G1gK5vtfPN3HMTFpw3uEh6Fh-Z9MSnroUPj34XlcAg_WLD7JV-moHjMVjlbkb6PdUaRRlf4KaeQuJJi9DOUbGPT3-BAp4MHu5af3n2Yq1V&__tn__=%2CO%2CP-R,. e | S ‘f - S— -~
pfbid0kczmrtjS2VAumg2YGAY6q6a1ixhKhrdS1WwqmnbS72Ssnqef2Z6vdUhnCGemjvJhl,Nokta & Mouzika,0,2,صاحبتك كيف تبكي ,2023-11-13:07:51,h t t p s : / / s c o n t e n t . f t u n 1 6 - 1 . f n a . f b c d n . n e t / v / t 1 5 . 5 2 5 6 - 1 0 / 3 2 8 0 3 6 0 5 1 _ 2 0 2 1 3 9 3 5 5 7 7 9 8 0 2 _ 5 7 6 3 0 8 1 2 0 2 6 8 4 2 4 3 7 6 8 _ n . j p g ? _ n c _ c a t = 1 0 3 & c c b = 1 - 7 & _ n c _ s i d = 1 a 7 0 2 9 & _ n c _ o h c = V h L x 4 T x 5 5 G s A X 8 i j 4 H J & _ n c _ h t = s c o n t e n t . f t u n 1 6 - 1 . f n a & o h = 0 0 _ A f B N 1 3 Z W 0 B N 8 B M - N 1 Q b 2 c D L S M m f 8 H O j n B y F x x v 0 q W 0 t S 7 A & o e = 6 5 5 6 C E 7 6,https://www.facebook.com/lahmarhamtisssss/posts/pfbid0kczmrtjS2VAumg2YGAY6q6a1ixhKhrdS1WwqmnbS72Ssnqef2Z6vdUhnCGemjvJhl?__cft__[0]=AZV8DTyrh6l3pmNyS38fn0pzaQoOWVfYK4_uA93Y3K_YqmZpyVZPwZDug7ULrNzQQ7TVIaU5HneTlKFJa34D7K8xBbbSYdV9a6QDiQRrupWbdfIOPZETN6Gd2JGjNyZyCS1Md-q26BqQLt0FM6dsyKPMfhgcQjxHxEk8dX_lmLY9s_As5-P5WeFFbsw7Iyk0YD3ElOmN6cz4dKYuJhCzHKgm&__tn__=%2CO%2CP-R,و 4
pfbid0vWnb7i7KgV8wEP1CB66yxd3UM9F51rcjrCkKWmrZgwHeRpJ32FLMnM5ypyrvMR2Tl,Nokta & Mouzika,0,0,,2023-11-13:07:55,h t t p s : / / s c o n t e n t . f t u n 1 6 - 1 . f n a . f b c d n . n e t / v / t 3 9 . 3 0 8 0 8 - 6 / 3 3 6 6 7 4 9 7 7 _ 1 6 6 6 0 2 0 3 9 5 9 7 2 0 2 _ 5 8 9 4 0 8 6 5 9 0 4 7 1 5 4 8 0 9 1 _ n . j p g ? _ n c _ c a t = 1 0 6 & c c b = 1 - 7 & _ n c _ s i d = 5 f 2 0 4 8 & _ n c _ o h c = U h G 2 r s u H E y Q A X 9 d 3 P n Q & _ n c _ h t = s c o n t e n t . f t u n 1 6 - 1 . f n a & o h = 0 0 _ A f D 8 v z A l u O f k J B W H J 4 n v Y U - X f 5 I S e 8 L g 0 b G p C Y Y 0 E R v K p Q & o e = 6 5 5 6 5 6 1 A,https://www.facebook.com/lahmarhamtisssss/posts/pfbid0vWnb7i7KgV8wEP1CB66yxd3UM9F51rcjrCkKWmrZgwHeRpJ32FLMnM5ypyrvMR2Tl?__cft__[0]=AZVmSJ_G_-kvXa2dWYhDJLN7A9DegXx7brOJLqngfQxB5t7l018_z81B1D9l7LAGC9ExkCNWDrMnqu7BuKTwtskPGhXbeI4zAfp4p8mp9Hwm_QRoUauDXm5TgFiw16aT6HbbmoCNJZKmbb_0IJx-lksuOSK-4V2xMtYEs4X4wXFCLuXfohcLRuHm04O2e4M-Ozk0y7cSbT-ENj2MWv4CIB2a&__tn__=%2CO%2CP-R,"برجي ألماني يعيش في تونس تحسوا مطلق مرتين و يدفع في النفقة o‏ : ا ل oy‏ ¢ 0 م ,+ للا ال ا كيه 1 \ & . جنا o e S‏ R S )‏ - ey‏ , e TR‏ - ب A‏"
pfbid09UbBp6c21dJMbaDnPhQZAcYta9wrjRGKWGBV59XUDMEU28JYdLJmRQn2kHZDugfBl,Nokta & Mouzika,0,3,- بلاهي اعطيني لحرابش متاع أمي- شسمها  - منجية ..,2023-11-13:07:57,h t t p s : / / s c o n t e n t . f t u n 1 6 - 1 . f n a . f b c d n . n e t / v / t 3 9 . 3 0 8 0 8 - 6 / 3 3 5 8 6 9 7 3 0 _ 7 5 4 3 6 6 9 6 2 8 6 8 2 1 9 _ 7 6 5 2 9 5 7 7 9 5 3 4 2 8 8 6 1 2 9 _ n . j p g ? s t p = d s t - j p g _ p 5 2 6 x 2 9 6 & _ n c _ c a t = 1 0 0 & c c b = 1 - 7 & _ n c _ s i d = 5 f 2 0 4 8 & _ n c _ o h c = v 6 0 A p 1 E b M 3 8 A X - u h c M 7 & _ n c _ h t = s c o n t e n t . f t u n 1 6 - 1 . f n a & o h = 0 0 _ A f D L n 1 V n M K c H p D N K h w b q d 1 _ K s 9 M 4 R A c 4 2 u M f I P W 8 v D 3 P 8 A & o e = 6 5 5 5 E 7 6 2,https://www.facebook.com/lahmarhamtisssss/posts/pfbid09UbBp6c21dJMbaDnPhQZAcYta9wrjRGKWGBV59XUDMEU28JYdLJmRQn2kHZDugfBl?__cft__[0]=AZUYXEaw8QbMujT2imPCmQhYAU_mWc2YJsD8MKbYiohUsrHHsoDtm0WxJAGuQ1N1INNqc769NiGMkKEXzRaKWlHGFxwd9q56wl0P8bAPEHRC5sNER4JFAXqOJfmQYGCU28r7ijpxAe2smzcDEg9On7NyejOsQ1wsaKvN5OQ3o_Bq0cq_tsVcF_evhft9xAalY8WcYVd0uMUdn_vfkUII31gp&__tn__=%2CO%2CP-R,"Bk i 1 L م0‎ 9 "" م‎ & - = 2 2 = L P - 14 T/ | نا‎ ُ ١ = N-""g ' 1 ا‎ للست‎ ١ ا‎ i i —_— ١ ١ ال‎ ]"
pfbid0AsWpUGs1vwEp34p74aB8iWgmLjJvDjHxauGGRraQdEa5UryRFm3LEKbDiQkqKccul,Nokta & Mouzika,4,13,العالم كله يمر بأزمة اقتصاديه = راس الفنانه احلام ,2023-11-13:07:57,h t t p s : / / s c o n t e n t . f t u n 1 6 - 1 . f n a . f b c d n . n e t / v / t 3 9 . 3 0 8 0 8 - 6 / 3 3 5 6 0 1 6 5 4 _ 1 5 4 0 2 2 3 7 4 2 0 3 6 9 4 _ 7 9 2 9 2 0 0 1 8 0 7 7 0 3 0 1 5 1 0 _ n . j p g ? s t p = d s t - j p g _ p 6 0 0 x 6 0 0 & _ n c _ c a t = 1 1 1 & c c b = 1 - 7 & _ n c _ s i d = 5 f 2 0 4 8 & _ n c _ o h c = _ L g 0 N f v J a I s A X 8 e Y r B Z & _ n c _ h t = s c o n t e n t . f t u n 1 6 - 1 . f n a & o h = 0 0 _ A f C k P 0 R J 8 p t R v Y m f 5 I T 7 J Y N x I a J t s j E 0 C s k G _ 1 G Z 5 E e Q 1 A & o e = 6 5 5 6 0 9 2 1,https://www.facebook.com/lahmarhamtisssss/posts/pfbid0AsWpUGs1vwEp34p74aB8iWgmLjJvDjHxauGGRraQdEa5UryRFm3LEKbDiQkqKccul?__cft__[0]=AZVeBIJlwvAWwBt4dgYhSJcWEgiz7lGNpB7FGvLK9osAL_TClWRF2ADAyW-iEe2RKcB7L2uoFMcPC7G79nbZdtdXbt4QzlFSKB3gqdeUuJVPfeRX9rT5JGuhvmLYjLdz6KiD5XSd7sSmgWyhAI12Q2Rx3p3BUTSvU8Mgv1NnGEtnP1QdIks1BcgQGWKLHs3ThSiVebqex7Ri7m00ykm3Nfkv&__tn__=%2CO%2CP-R,"TR 1 | g N ’ 574 87 2 5 & 8 B ل‎ \ 1 3 N A < . s o 6 ا‎ 01 ا ل‎ / اا ا‎ / i اا‎ 7 أل‎ o7 7 111 ا‎ 2 111 كحي ا‎ 1 اهدر‎ "" 21 1 RN"
pfbid027VvCxqbPwzGP141vPGZFKBAt1APg9r4jTwCLJGYqxWmixWdmgv4Ngs8BF8L1GHT9l,Nokta & Mouzika,3,9,التونسية أول ما يروح راجلها تاعب مالخدمة  ,2023-11-13:07:58,h t t p s : / / s c o n t e n t . f t u n 1 6 - 1 . f n a . f b c d n . n e t / v / t 3 9 . 3 0 8 0 8 - 6 / 3 3 5 6 4 8 6 3 6 _ 8 0 5 2 3 9 2 4 1 0 2 0 7 6 9 _ 3 7 1 6 7 5 2 2 8 6 4 6 8 6 8 1 5 6 8 _ n . j p g ? _ n c _ c a t = 1 0 1 & c c b = 1 - 7 & _ n c _ s i d = 5 f 2 0 4 8 & _ n c _ o h c = 3 3 i 2 Y _ 8 9 S p E A X _ p B 1 - 6 & _ n c _ h t = s c o n t e n t . f t u n 1 6 - 1 . f n a & o h = 0 0 _ A f D h p s a Y l t 9 S I 9 d 1 0 l 7 F 3 x f F p y m 1 i 3 m x _ Z s I D r R g F M L 8 N g & o e = 6 5 5 7 2 2 3 0,https://www.facebook.com/lahmarhamtisssss/posts/pfbid027VvCxqbPwzGP141vPGZFKBAt1APg9r4jTwCLJGYqxWmixWdmgv4Ngs8BF8L1GHT9l?__cft__[0]=AZXRLHmrCVYv_zXPXEj73bSZ7ASDXvQgiB5SbqgEAgS67FcFVt1SDsne-rh264Pbq_07px2pLoIMHpH_PRp0V58Lfv8mEr_L4_qP2ZpcVaGRT4jd8aBqWdynWgYN2u8nFaAJomNW9wiqJMGgvfN6HzyzBrK0WgF2-0B1BE1ALQPdH8jFdZ6434ATU-DYKGwj02yvjTgm1zhd7eJKIfXSrc5e&__tn__=%2CO%2CP-R,A i 2 ا‎ - 1 جع‎ |
