id,name,shares,comments,content,posted_on,image,post_url,image_content
pfbid02RoYqCyNYdWUKKqugiyNj2xDGF8yprLzV7jdZxRUqKGYkeepgvwac2HeH6wSiCwGJl,Qatar Foundation,0,0,"From a writing competition to medical school graduation, Salah's passion for medicine was ignited by his mother's inspiration.Today, he's fulfilling his dream of becoming a doctor as a graduate of Weill Cornell Medicine-Qatar.Congratulations Dr. Salah! #QFConvocation QF Alumni Program",2023-11-12:20:26,h t t p s : / / s c o n t e n t . f t u n 1 5 - 1 . f n a . f b c d n . n e t / v / t 1 5 . 5 2 5 6 - 1 0 / 3 4 5 2 8 8 8 8 9 _ 7 5 3 5 9 0 8 6 2 9 2 6 0 5 0 _ 7 1 8 0 1 3 2 4 0 1 1 8 9 3 2 8 8 9 6 _ n . j p g ? s t p = d s t - j p g _ p 9 6 0 x 9 6 0 & _ n c _ c a t = 1 1 0 & c c b = 1 - 7 & _ n c _ s i d = 1 a 7 0 2 9 & _ n c _ o h c = D N T 7 Z Z 3 X E K 0 A X 9 c Z W g I & _ n c _ h t = s c o n t e n t . f t u n 1 5 - 1 . f n a & o h = 0 0 _ A f A o V 1 l F 8 d W S c D X 1 4 P t M X 5 L Q N 9 2 i M v t b 0 u V 4 _ U s i R T m 2 n w & o e = 6 5 5 6 9 8 9 9,https://www.facebook.com/qatarfoundation/posts/pfbid02RoYqCyNYdWUKKqugiyNj2xDGF8yprLzV7jdZxRUqKGYkeepgvwac2HeH6wSiCwGJl?__cft__[0]=AZUVkwPMw7t-oDJ2uWk89uJ5i-3y1VKtU4CahgkNeBLBTxqdCjpP89SYkxpjXNF_Sba5cFP0r0MQ2mvPgJiphWM9rT2Rr3oPslRMiRhWtXZ23Yvn4mvndH-pMKbr6SFteqOX4XSxhSA2hx5ylhBxQlgbqHNRxFcOLxxqK4NnXjVfJ_29EkEHjwUAKKWb-YDIqC-78Uxgpz-wR-X5kt0bswPQXedEN3vCqo7XqhLVKNlGEA&__tn__=%2CO%2CP-R,"u[u‘LLl\.lLL[lLll\lssuux[uluu_u.uu.;u . - L . 1 ب‎ - 26 ل‎ L 1 ل‎ > . بت‎ 1 - o 4 1 p . .~ ; P '/',”\‘} / صم""‎ 0 ١ | \ - e AP "" S i لم يكن هناك مجال 0100( أ‎ ا ا 11 هال‎ i - there was no particular field"
pfbid0jrmQPaRcCbUYUmQaJYThQiYBEJXfUL9DJAJfRNMKGs1F1gbw9et38sPBwf7WWVrgl,Qatar Foundation,0,1,"We are incredibly proud of Abdulrahman, one of our recent Ph.D. graduates from Hamad Bin Khalifa University.His father's unwavering support and investment in his dreams have led to this proud moment.Congratulations, Dr. Abdulrahman! QF Alumni Program #QFConvocation",2023-11-12:20:26,h t t p s : / / s c o n t e n t . f t u n 1 5 - 1 . f n a . f b c d n . n e t / v / t 1 5 . 5 2 5 6 - 1 0 / 3 4 3 3 5 8 7 3 3 _ 2 4 8 4 0 2 1 1 7 7 3 0 2 8 1 _ 3 1 1 0 7 7 2 2 1 5 7 7 9 1 5 5 8 9 _ n . j p g ? s t p = d s t - j p g _ p 9 6 0 x 9 6 0 & _ n c _ c a t = 1 0 7 & c c b = 1 - 7 & _ n c _ s i d = 1 a 7 0 2 9 & _ n c _ o h c = y k f t R 6 m X a s M A X - K 6 v b j & _ n c _ h t = s c o n t e n t . f t u n 1 5 - 1 . f n a & o h = 0 0 _ A f B f b c u U 1 A h U R d a I C 8 c c w 2 o K t t 8 J d R h W U Z N k R V V i a g e H 8 Q & o e = 6 5 5 5 5 3 3 1,https://www.facebook.com/qatarfoundation/posts/pfbid0jrmQPaRcCbUYUmQaJYThQiYBEJXfUL9DJAJfRNMKGs1F1gbw9et38sPBwf7WWVrgl?__cft__[0]=AZXLvpZyaMIYQbqv5z4x5OxGhDfj9CQidjJGfArarxXMiJtnL2dzgx9lVHHv91Bkxc2W9Uf_qnc5-8gi9uf6-cF2k7vYSg9FjyaQBey00S8XmtUhOFFWSSNqauG9Jpz1s11EXjL7JuY1bNvjbG6DwX_o9MXdw-6KOp2nFWKPyVFYqWWS2THeVtJjCmrRsp4BdMnAKOpYlQX2rwrhXzcqlwmnEMCeE0xVOjj2ZclPrB2H9A&__tn__=%2CO%2CP-R,"RS0 ١١ s ١ \ \ جين‎ SRR y - L TR e اق ع‎ R وك لافلا‎ ke N ‘ 1 = GO0 AN AT Ay e % نل‎ PN VA \ اا اس ا ك2‎ 8 اسيلا‎ B s ال أ‎ 0 N T BRaD % ا ال 7 = ا‎ ب 7 هب كا‎ I, داوم‎ 7 . o 4 » ٠ 5 ١ 5 ( 8 ) TR e, أ ل‎ ا ا‎ b ثَ الي‎ g فقس‎ = هو الوالد أطال الله في عَمره.‎ T حت‎ my.father, may Allah grant him a 1009 life."
pfbid04TsZMMrrrNpTaBiBWeNZ3ccaHrUPSg5FTCQ1i9xdHByWdoH8MFsxpX9wmjWDGafTl,Qatar Foundation,2,2,نحن فخورون جدًا بخريجينا عبدالرحمن، أحد خريجي برنامج الدكتوراة من جامعة حمد بن خليفة.شكٌل دعم واستثمار والد عبدالرحمن في أبناءه دورًا كبيرًا في تحقيق هذه اللحظة الهامة في حياة عبدالرحمن.تهانينا دكتور عبد الرحمن. #حفل_تكريم_خريجي_مؤسسة_قطرHamad Bin Khalifa University QF Alumni Program,2023-11-12:20:26,h t t p s : / / s c o n t e n t . f t u n 1 5 - 1 . f n a . f b c d n . n e t / v / t 1 5 . 5 2 5 6 - 1 0 / 3 4 5 4 4 8 4 8 9 _ 2 1 1 3 5 2 2 9 5 2 1 7 7 7 6 6 _ 9 2 0 2 7 2 2 0 2 5 7 8 4 7 1 1 4 6 4 _ n . j p g ? s t p = d s t - j p g _ p 9 6 0 x 9 6 0 & _ n c _ c a t = 1 0 4 & c c b = 1 - 7 & _ n c _ s i d = 1 a 7 0 2 9 & _ n c _ o h c = d w 9 x U Z u 3 C i I A X _ 4 E V o P & _ n c _ o c = A Q m i - X 7 J S d S y k Y e b e 8 g H t q e z N S u 7 D o a K o b B x g _ L - 5 x K 5 H 2 L n B S 1 4 o x N - q 5 R e S R C 4 a O c & _ n c _ h t = s c o n t e n t . f t u n 1 5 - 1 . f n a & o h = 0 0 _ A f C y L w s q z i T l V 2 Y c M k a v l Z u 2 d 7 L j 8 Y H 3 G t N P l y B c E v F U j g & o e = 6 5 5 6 A 6 9 8,https://www.facebook.com/qatarfoundation/posts/pfbid04TsZMMrrrNpTaBiBWeNZ3ccaHrUPSg5FTCQ1i9xdHByWdoH8MFsxpX9wmjWDGafTl?__cft__[0]=AZUWWBqzcINObzMhFbK5m7b0Da-xlSK4ChRdcLlx1t3rmVqUS8lQfPiRPnUGo9RuNJOPQyxyZALoBPgu1rNXR5V0B1tBtLqtuV6eqNxp29jtNgMpS6nAaFhBrS1NWXspcMjAQCW5bYIr-Pj7pknQROqsbxiGXp3RfeeQdQdpdqEycr8H8k9HduurMeVwDcAekbuwMcAziWxB637AlvLNru1NRSixdSW6XmjEB38n0gTqCw&__tn__=%2CO%2CP-R,"""?' A% ١ \Niu% ,x""’ ٍ N W 7غ م 1 لا‎ بر ال راك | هآ ا‎ QN SRR سسا‎ Q- \ ا‎ T اك ل ا‎ 0 ¢ 8 > 0 2تَا ب اذك‎ e ‘ \' 2._15’.:‘.: 2 ا‎ الها الات‎ ا‎ DAl “اج نا‎ W, - > ٠ 7 ! - s 1 AN ات‎ R N N N .‘ N 8 ليلا‎ : o K. i i 9 ""1 4 ع‎ S, \ 'f‘ ( 8 & . ل‎ 1 5l : ) ; 0 e | Py s - =094l هو أقرب صديق لي في‎ allgll د‎ ًٍ father is my closest friend ever."
pfbid02sW3qADdkrgCFTYtY18wMvxWroydA8FhqJ3x4TTpizTBmY9xTgZBKLysWAZmqLTLZl,Qatar Foundation,1,1,"From “go study.. go study” to graduation day! Our Texas A&M University at Qatar graduate, Faisal, reflects on his family's unwavering support for his education, and how he's about to make them proud with his degree.#QFConvocation QF Alumni Program",2023-11-12:20:28,h t t p s : / / s c o n t e n t . f t u n 1 5 - 1 . f n a . f b c d n . n e t / v / t 1 5 . 5 2 5 6 - 1 0 / 3 4 4 6 2 6 3 1 7 _ 5 5 0 8 9 3 8 0 0 5 4 4 5 0 3 _ 1 0 4 4 5 9 0 9 3 2 5 1 6 1 2 5 7 2 5 _ n . j p g ? s t p = d s t - j p g _ p 9 6 0 x 9 6 0 & _ n c _ c a t = 1 0 3 & c c b = 1 - 7 & _ n c _ s i d = 1 a 7 0 2 9 & _ n c _ o h c = 9 6 - f F j T u W u 0 A X 9 8 5 a C Q & _ n c _ h t = s c o n t e n t . f t u n 1 5 - 1 . f n a & o h = 0 0 _ A f B f 0 7 l K 2 Z N m G h L T W 5 o r S i V _ l f D f e R w Y Y K f 6 c 1 z V f j T c r w & o e = 6 5 5 5 D E A A,https://www.facebook.com/qatarfoundation/posts/pfbid02sW3qADdkrgCFTYtY18wMvxWroydA8FhqJ3x4TTpizTBmY9xTgZBKLysWAZmqLTLZl?__cft__[0]=AZV-O1is0yfLw0SDMqezb1yqzQQmccwRoDq2er2uKLfFd5qU50zQudJd8uTImlCaNo6dDcyXmlG5nW8MOaRCwT-Us8FKXkKWZZpzsa5PKMJLbK42jAgTrwYlV_0eYp5PEsz0CB7fH4FIOZwIkloO1AdY3FY6BFCkuzNZgwXIow_Mltp2e21WqR1lqM6tYcPj8AcsZU-MNHTnB3nP_7_5egGNNHrtkQU_mk8zqzciaK1irw&__tn__=%2CO%2CP-R,"Tl‏ فخا 2 يحل ا 2 | ’ — حسما = QJ f/;"" | (= i‏ e ML‏ © لوم 0 BTN |‏ : /(;‘ = ’_/’777”’_”4"
pfbid02XCywrdTj3uuYgEikEqh7SQrVvXDCtURGASsWBvaq37jqQvZhPJJoHeVDvUXmWAkLl,Qatar Foundation,0,7,وراء كُل خريج وكُل خريجة، أمٌ داعمة مؤمنة بقدرات ابنها أو ابنتها.تُشاركنا اليوم خريجتنا عائشة المهندي، من جامعة جورجتاون في قطر، قصتها المؤثرة حول تفاني والدتها في التعليم مما جعلها تُواصل مسيرتها لتحصد درجة علمية خاصة بها.تهانينا لكُنّ#حفل_تكريم_خريجي_مؤسسة_قطرQF Alumni Program,2023-11-12:20:28,h t t p s : / / s c o n t e n t . f t u n 1 5 - 1 . f n a . f b c d n . n e t / v / t 1 5 . 5 2 5 6 - 1 0 / 3 4 5 7 5 7 5 6 2 _ 6 1 2 9 3 3 8 4 4 2 2 5 7 9 8 _ 3 4 6 1 7 5 5 8 0 5 4 7 3 9 1 6 8 6 0 _ n . j p g ? s t p = d s t - j p g _ p 9 6 0 x 9 6 0 & _ n c _ c a t = 1 0 1 & c c b = 1 - 7 & _ n c _ s i d = 1 a 7 0 2 9 & _ n c _ o h c = 2 J E M a l 8 x T y U A X 8 X 3 _ 5 6 & _ n c _ h t = s c o n t e n t . f t u n 1 5 - 1 . f n a & o h = 0 0 _ A f B 7 Z m Y t _ r Q 3 p m a R t I h x H m G H s h a O K S l G E x 8 9 w - j S V p o _ U A & o e = 6 5 5 6 A 3 A 1,https://www.facebook.com/qatarfoundation/posts/pfbid02XCywrdTj3uuYgEikEqh7SQrVvXDCtURGASsWBvaq37jqQvZhPJJoHeVDvUXmWAkLl?__cft__[0]=AZWqsGC6VM4iRDzS2MAoUG6RfVzQtcaOkHIJePY7YGbtYxPalfwDDK9ClQiY2Tx0of-jIMCSYtlGxYDckIemj_5RaNjZA-Hllppec7cxsBJKhH1liAXDMXEtzlnbVUM_yDpUsAWRKH4vrJs_pRED3LKUFZnYKOojaCOcHtNda7VsbRyHDjLbJRpAZYOfkA1eNce1qQT3LhtBa9gVmnSw7mffC7Qc2rwCTnVoNjXLWbpRtg&__tn__=%2CO%2CP-R,عائفة G‏ ! 8 / ؤ اه ¢ \ ١‏ 1 {‘ 49 ' ِ يا 3 » ف“ 0 أ هذا ل v 14 &‏ W T‏ sise‏ 1 ة / \
pfbid0D21jzqytbNETijgkDdoN37UvNNbHr8TLzCnpe5m3GQQVSD7MACpdSZTg1ve1sKH8l,Qatar Foundation,6,3,"To our Class of 2023, next week, you’ll embark on your next great adventure. We can’t wait to see you on the stage at #QFConvocation! May 10, 2023",2023-11-12:20:30,h t t p s : / / s c o n t e n t . f t u n 1 5 - 1 . f n a . f b c d n . n e t / v / t 3 9 . 3 0 8 0 8 - 6 / 3 4 5 6 1 7 3 2 2 _ 9 4 8 8 8 2 2 9 6 1 5 6 0 5 2 _ 4 4 8 6 3 2 3 7 7 5 9 9 3 4 2 9 5 9 4 _ n . j p g ? s t p = d s t - j p g _ p 6 0 0 x 6 0 0 & _ n c _ c a t = 1 0 4 & c c b = 1 - 7 & _ n c _ s i d = 5 f 2 0 4 8 & _ n c _ o h c = q 5 t 5 l K S F E j U A X 9 A r T u Y & _ n c _ h t = s c o n t e n t . f t u n 1 5 - 1 . f n a & o h = 0 0 _ A f A 7 7 o x w E h c e w S X U B J K d n N b b 6 b T a r - b 1 t q 5 t o P n w x r Q Z V w & o e = 6 5 5 6 8 B 6 9,https://www.facebook.com/qatarfoundation/posts/pfbid0D21jzqytbNETijgkDdoN37UvNNbHr8TLzCnpe5m3GQQVSD7MACpdSZTg1ve1sKH8l?__cft__[0]=AZUKuMqEdWPJqHW0OtUtpat_sHVBBYHG-JfR1PX2ynB1yhbmwkmfU8DkuG8D9REUCk11xhnPDKa69nJQgyqxH5-2VfcyHWtxU9KtSsHk5_0RnLihiF88G-I7yvdWZOYIY_s5A5ln9CHERb3dBO9Cg5lQMuqqf9Yftunol5cZGjYBKg8BGRzD6rRwpHbVb-4FqWHCCCk1JdEHLebLnYALDLLu&__tn__=%2CO%2CP-R,"- ب"" 1 رد << - 5ن نون يرابت 0 A, .‏ o > 8‏ : 71"
pfbid0xdYBxGnuL4C1tQqLGNNJNEeGjxLpvga8wQUy2K2WRTSjzqW4bXmSY43VbVWFsZg1l,Qatar Foundation,2,3,ها هم خريجونا دفعة 2023، محطتكم التالية من حياتكم على وشك أن تبدأ. نتطلّع للحظة تكريمكم الأسبوع القادم على منصة #حفل_تكريم_خريجي_مؤسسة_قطر. 10 مايو 2023,2023-11-12:20:30,h t t p s : / / s c o n t e n t . f t u n 1 5 - 1 . f n a . f b c d n . n e t / v / t 3 9 . 3 0 8 0 8 - 6 / 3 4 5 5 8 8 6 3 9 _ 2 0 1 8 3 2 3 3 2 1 8 6 6 8 4 1 _ 2 2 0 2 4 4 5 0 2 4 1 0 2 3 5 1 1 5 4 _ n . j p g ? s t p = d s t - j p g _ p 6 0 0 x 6 0 0 & _ n c _ c a t = 1 0 1 & c c b = 1 - 7 & _ n c _ s i d = 5 f 2 0 4 8 & _ n c _ o h c = r 2 w b a R p E - 5 I A X 9 m V g c r & _ n c _ h t = s c o n t e n t . f t u n 1 5 - 1 . f n a & o h = 0 0 _ A f D T S A 5 c 7 6 - l F V 4 y 3 e n B 2 r M N p 4 8 k x d q c X G k l q 9 2 8 4 o _ p O Q & o e = 6 5 5 5 7 6 2 3,https://www.facebook.com/qatarfoundation/posts/pfbid0xdYBxGnuL4C1tQqLGNNJNEeGjxLpvga8wQUy2K2WRTSjzqW4bXmSY43VbVWFsZg1l?__cft__[0]=AZUVZykQCpfceScOcWwfsGwY3hMz4CFDT51hAdabLLRdNVvRUQ40R8WnuTv1ZuF3mMKFijOYlwv24tB-E4GpqlgmFjWlwgODUveNDmaeCxuf-LJSiO85Tkt_eqj2qrN4LQCqP0kn-t4lk2Nwfc8gaCNtJsV0-fHOWldnC0h8hftjffYeGPQE4sYLgbe9SfP7LDheevkwiVX7FTiCb_rsp0dj&__tn__=%2CO%2CP-R,"- ب"" 1 رد << - 5ن نون يرابت 0 A, .‏ o > 8‏ : 71"
pfbid02jjEHWNSziDL3TWWcVABM3HWDaWGMPmYfeELCYyNooReiX3HRZSjVJJvmW7cRVx81l,Qatar Foundation,1,5,"It’s that time of the year Save the dates to celebrate this year’s graduating batch with your family, friends, and fellow graduating peers!* #QFConvocation, May 10* Aljam’a, May 11-13* Annual Alumni Forum, May 13 More details here: https://www.qf.org.qa/events/qf-convocation-2023",2023-11-12:20:35,h t t p s : / / s c o n t e n t . f t u n 1 5 - 1 . f n a . f b c d n . n e t / v / t 1 5 . 5 2 5 6 - 1 0 / 3 4 3 0 9 9 3 0 1 _ 1 2 8 1 9 7 3 8 9 9 3 6 2 8 7 1 _ 5 1 6 4 6 6 7 4 6 2 5 5 7 1 6 0 8 0 9 _ n . j p g ? s t p = d s t - j p g _ s 9 6 0 x 9 6 0 & _ n c _ c a t = 1 0 5 & c c b = 1 - 7 & _ n c _ s i d = 1 a 7 0 2 9 & _ n c _ o h c = 7 6 4 1 k F S P Y e 0 A X - 7 J U N 1 & _ n c _ h t = s c o n t e n t . f t u n 1 5 - 1 . f n a & o h = 0 0 _ A f B h H H k H c X H 3 P A E U k a H P - 5 Q f 3 R x K K J n J L 0 a z X l W k 5 q m M M A & o e = 6 5 5 6 B 9 5 A,https://www.facebook.com/qatarfoundation/posts/pfbid02jjEHWNSziDL3TWWcVABM3HWDaWGMPmYfeELCYyNooReiX3HRZSjVJJvmW7cRVx81l?__cft__[0]=AZXbR98QisbIluDmXZm6rWRvBcxuVOJXg9VolCFH9kCw22BIceoc7zAO2cJjTCSmJq6aP02K06iR6xqAYAeu4J5ScYrkyN-IR74FuGadPbEQmBvsOVYeAP96cniVGSIG0gUCLN0k0G1gr8GKSCophlm4D4cvwFNekgDPPdC7AvvugqP5RBK5RWJQuynyBFsCLnlbA2cxS0-SXSpCA0Oza5v5IEcOoSZ7m_BlPaOlM0d4Aw&__tn__=%2CO%2CP-R,ملتقى الخريجين السنوي 3 مايو 2023 ANNUAL ALUMNI FORUM‏ MAY 2023‏ 13
pfbid0Mwzp5LL3h6WrJ2PcjvT3yB9pApfTaTn5oqFPhGfH7xyVDaPjWDDre4LydyBi64HEl,Qatar Foundation,5,5,اكتشف مع راشد ونورة قصة الجمل  الذي تكلم مع الرسول محمد ﷺ و تعرف على قصة النبي نوح عليه السلام شاهد الحلقة الكاملة يومي الجمعة والسبت الساعة 3:45 مساءً على Qatar Television ,2023-11-12:20:05,h t t p s : / / s c o n t e n t . f t u n 1 5 - 1 . f n a . f b c d n . n e t / v / t 1 5 . 5 2 5 6 - 1 0 / 3 3 8 6 3 7 1 9 3 _ 1 2 7 0 5 6 1 3 5 3 5 4 2 8 4 4 _ 7 6 7 9 0 5 5 1 9 9 4 9 1 2 2 2 1 2 8 _ n . j p g ? s t p = d s t - j p g _ p 1 8 0 x 5 4 0 & _ n c _ c a t = 1 0 1 & c c b = 1 - 7 & _ n c _ s i d = 1 a 7 0 2 9 & _ n c _ o h c = 4 I 1 Z t v 5 k 0 w 0 A X 9 l v 4 d o & _ n c _ h t = s c o n t e n t . f t u n 1 5 - 1 . f n a & o h = 0 0 _ A f A c 9 x m O c T L d f 9 W W q x - 9 4 6 U U j c T I h O 1 i F g d 7 3 1 I p M y V S Y w & o e = 6 5 5 6 F 4 A 8,https://www.facebook.com/qatarfoundation/posts/pfbid0Mwzp5LL3h6WrJ2PcjvT3yB9pApfTaTn5oqFPhGfH7xyVDaPjWDDre4LydyBi64HEl?__cft__[0]=AZUEgi60-SpP3JaVTHEQyhM0PPkzYfdZl_Ubh9AlqL29QWyxVjtHP5f50caUu2WvwW3sFo8qyQKm_AJ51koYMGN1fvuaetkGcZgZexPTf6hm5No9Smzv2uFwUzMOyZV5dP9KwtH20crNBeCXymkIAikmzuJGZOC96i20mgxgIRveH0IsfW0jjGXxwnFQNbBzKVV8wumaFZFbeUC3Tm53gHzlBGqPVkaYj3E00i2GKWtbVg&__tn__=%2CO%2CP-R,"(. A «لنا‎ » f f g 1 | Y ,ٍ ا‎"
pfbid0KjTT5ZNDAG8NkWPhJJe8xMtaKUQAegYCJjDZqegb6owVnUNPiyT9y7JTA6KfpDxDl,Qatar Foundation,3,2,اكتشف مع راشد ونورة قصة الجمل  الذي تكلم مع الرسول محمد ﷺ و تعرف على قصة النبي نوح عليه السلام شاهد الحلقة الكاملة يومي الجمعة والسبت الساعة 3:45 مساءً على Qatar Television ,2023-11-12:20:05,h t t p s : / / s c o n t e n t . f t u n 1 5 - 1 . f n a . f b c d n . n e t / v / t 1 5 . 5 2 5 6 - 1 0 / 3 3 7 0 6 8 7 9 1 _ 5 5 6 2 5 5 3 4 3 2 6 5 1 6 3 _ 9 0 5 9 6 0 4 3 4 1 3 9 6 3 4 3 8 5 _ n . j p g ? s t p = d s t - j p g _ p 1 8 0 x 5 4 0 & _ n c _ c a t = 1 0 7 & c c b = 1 - 7 & _ n c _ s i d = 1 a 7 0 2 9 & _ n c _ o h c = n X b O S m O A W 6 I A X 8 j 6 - g v & _ n c _ h t = s c o n t e n t . f t u n 1 5 - 1 . f n a & o h = 0 0 _ A f D 6 n G x U - U y Q r b d t k u r W 4 m 0 Q 9 W 1 Y X m 0 n 3 j a S 2 U q l A 6 B d X w & o e = 6 5 5 6 D B 1 3,https://www.facebook.com/qatarfoundation/posts/pfbid0KjTT5ZNDAG8NkWPhJJe8xMtaKUQAegYCJjDZqegb6owVnUNPiyT9y7JTA6KfpDxDl?__cft__[0]=AZXZ4wNqboj5K6jjiPjwofd-J1psQOYlGzYREnyDEC6-AEYgRzIbcggUV5PaVmt9k9kCRPoDsvbMsUgMaM41IJvfXfAQ0VusOtM-79cNN0zgZerT4B41mT-4u1QQByFGKoY952mjCAk6VHgYehRA0tBSVEi6XjoPib4UPsTQA8ZboHfzzaSBdpAEkb9NjJ9tZOCeh3A0d3wFXumhVyymeRxU466MMoQELA_Wi2dDPNiKTA&__tn__=%2CO%2CP-R,"— دما وسح @""“ ...الا"
pfbid0fZSTStN8jK5YjxszTtbK6GeLaKdakmooEQt2qiRvLSNvZBKziNMQXtaiq5aShHzJl,Qatar Foundation,0,0,"Meet Bayan Khaled, a P-@ Iestinian alumna from Carnegie Mellon University in Qatar, who visited her homeland for the first time 5 years ago. Hear her experience of navigating her own land, but not without the occupation making her feel like a “foreigner.”",2023-11-13:14:01,h t t p s : / / s c o n t e n t . f t u n 1 6 - 1 . f n a . f b c d n . n e t / v / t 1 5 . 5 2 5 6 - 1 0 / 4 0 0 1 8 0 5 7 4 _ 2 4 2 8 5 1 4 8 5 2 1 2 2 0 0 _ 6 5 0 3 4 7 2 9 0 2 0 6 8 9 5 0 2 7 1 _ n . j p g ? s t p = d s t - j p g _ s 9 6 0 x 9 6 0 & _ n c _ c a t = 1 1 1 & c c b = 1 - 7 & _ n c _ s i d = 1 a 7 0 2 9 & _ n c _ o h c = n 1 i M R x - A S w Y A X 9 G _ t 4 i & _ n c _ h t = s c o n t e n t . f t u n 1 6 - 1 . f n a & o h = 0 0 _ A f B 2 j z o C i - H e j Y g D o l _ s M y N A M Z D 3 - 2 u A Y y r f O L W m R o 3 i u w & o e = 6 5 5 7 3 9 6 7,https://www.facebook.com/qatarfoundation/posts/pfbid0fZSTStN8jK5YjxszTtbK6GeLaKdakmooEQt2qiRvLSNvZBKziNMQXtaiq5aShHzJl?__cft__[0]=AZWlEpS4vsSow6N0fxSKNsIRvlgMf6jxTya74cfcS-p5gfStuh7VETevo98iZ7_qqbBp_WxTfpOr7yIQJnHT48nP1MRacpxEDIj_9mdkonFrL0UHr92WPwuxhs3Rt6Jg6_8hvGyEPiZFBf4YoAz1v5wPsDlvpcMHUZJL6BH70iNX35aQmXZFCI2FB54_v5fwL7vwiCskMlKS6cdG9IQJnklM&__tn__=%2CO%2CP-R,N L i AT - أصوات من أجل‎ | سا . .. الا مل‎ ١ o i PRl o' مم‎ Voices for Palestine 1 جب‎ . Ft. Bayan [ زا فس اص‎ 7 & - : ا وا‎ by & م‎
pfbid038NbEYtXm7xqkfnbnwMwt3esgyHDb45g4upmvg4GP1LspgoJsxjkY2VxsBV89bLoyl,Qatar Foundation,0,0,نحمل إليكم اليوم قصة بيان خالد، خريجتنا الفلـ-ـسـ ـطـ ينية من جامعة كارنيجي ميلون في قطر، والتي زارت وطنها لأول مرة من خمس سنوات. لنستمع إلى تجربتها المؤثرة وهي تجول في أرضها، ولكن ليس دون أن يشعرها الاحتلال بأنها “أجنبية”.,2023-11-13:12:43,h t t p s : / / s c o n t e n t . f t u n 1 6 - 1 . f n a . f b c d n . n e t / v / t 1 5 . 5 2 5 6 - 1 0 / 3 6 7 5 9 2 9 3 7 _ 7 2 5 0 1 0 5 0 6 2 3 6 3 4 8 _ 6 9 8 3 1 3 4 4 4 0 9 7 8 8 0 0 7 7 4 _ n . j p g ? s t p = d s t - j p g _ s 9 6 0 x 9 6 0 & _ n c _ c a t = 1 1 1 & c c b = 1 - 7 & _ n c _ s i d = 1 a 7 0 2 9 & _ n c _ o h c = s F v g 6 R 0 H D b Y A X _ x 1 J 2 n & _ n c _ h t = s c o n t e n t . f t u n 1 6 - 1 . f n a & o h = 0 0 _ A f D X U s 5 0 D h T G C a T e V V C b b 8 H k 6 1 k j m i s 3 d B p D 1 R S u A h 1 N s Q & o e = 6 5 5 6 2 0 7 4,https://www.facebook.com/qatarfoundation/posts/pfbid038NbEYtXm7xqkfnbnwMwt3esgyHDb45g4upmvg4GP1LspgoJsxjkY2VxsBV89bLoyl?__cft__[0]=AZUkVoZdYX4Lcp4KpxazMFP6QAtylQVk1OIGg50CSRpacS-c1vuWGJZUHaHu1nh2J4kSx3Ef2dvQvBRRlK1-AnlhV4t6vxG-qQu109_Jqw76PmaLwy28yJaBuyUTZcDlvJ8oKWpGt4di2FKHsXjWjhXysl9DHo_GYpMJCOSM5k-RX1CZUYIFzPxGXosHAapVJGMu-BR3RTTKRCiaL-HKqpQb&__tn__=%2CO%2CP-R,N L i AT - أصوات من أجل‎ | سا . .. الا مل‎ ١ o i PRl o' مم‎ Voices for Palestine 1 جب‎ . Ft. Bayan [ زا فس اص‎ 7 & - : ا وا‎ by & م‎
pfbid02wVFJZGQeDa7k2WcYL1fEStoTM8NgDNGhVwv2ghqKUXKKmvduoGa437Jr2jDX1kJPl,Qatar Foundation,0,0,"‏What does the icon """" mean to you? A delicious summer fruit? or a way to counter all sorts of bans?",2023-10-29:15:48,h t t p s : / / s c o n t e n t . f t u n 1 6 - 1 . f n a . f b c d n . n e t / v / t 3 9 . 3 0 8 0 8 - 6 / 3 9 8 3 1 3 6 9 2 _ 9 0 7 3 5 4 2 9 0 7 5 8 7 5 4 _ 3 0 3 5 3 7 4 2 4 5 1 0 7 3 3 2 7 9 3 _ n . j p g ? s t p = d s t - j p g _ p 6 0 0 x 6 0 0 & _ n c _ c a t = 1 0 6 & c c b = 1 - 7 & _ n c _ s i d = 5 f 2 0 4 8 & _ n c _ o h c = 1 4 C z S I K 4 U Z M A X 8 e a 3 S J & _ n c _ h t = s c o n t e n t . f t u n 1 6 - 1 . f n a & o h = 0 0 _ A f C p J e E T S 5 U 4 S X - I Q N c t z d G H Y v J o J k F 1 j m T d 7 4 8 l R J 1 u i A & o e = 6 5 5 7 A E 4 7,https://www.facebook.com/qatarfoundation/posts/pfbid02wVFJZGQeDa7k2WcYL1fEStoTM8NgDNGhVwv2ghqKUXKKmvduoGa437Jr2jDX1kJPl?__cft__[0]=AZWJ4SV4Dq6Jm-VR-ArL0524Ogy5KBr_ThJ3RjJfRI6TrqUw39lgEWkb1b8sEpHKpviRlkYNrIr5YksTBsIfoU3mps2ZH_jwSo7iHpvWnM-_efSgwsUWpTULwgZq366wezhZOq3KuQRja06M1KzU_lV1pHbGJ-OHYj5xvOHSBhr9Im85bGAw1HDZBuonrDMffk_hjpOd4-3u2Vwjpzzt_tgg&__tn__=%2CO%2CP-R,"| الفلسطيني:‎ ) ; 33""‘Palesti'n Aian . 1 0١ له‎ LN ?‘ & الور‎ : فى‎ VR الأ‎ ٠ 0 5 له ا‎ ¥ 3 LN . : / o B h . N ل / / رجا 0 2 j‏ ١ ! 2‏ ا"
pfbid02EnaK3QMMm2kzhcGgxgZmxnP9coKsZmkVcjkdMDwBrQxkLp9kvVmbSNyefHgGYwMl,Qatar Foundation,0,0,"ما الذي يعنيه لك هذا الرمز """"؟ أهي فاكهة الصيف اللذيذة؟ أم حيلة في مواجهة أنواع الحظر العديدة؟",2023-10-29:15:49,h t t p s : / / s c o n t e n t . f t u n 1 6 - 1 . f n a . f b c d n . n e t / v / t 3 9 . 3 0 8 0 8 - 6 / 3 9 8 2 8 9 0 3 1 _ 9 0 7 3 5 2 2 9 7 4 2 5 6 2 0 _ 5 4 3 2 6 6 0 3 0 4 4 5 6 0 4 2 3 7 1 _ n . j p g ? s t p = d s t - j p g _ p 6 0 0 x 6 0 0 & _ n c _ c a t = 1 1 0 & c c b = 1 - 7 & _ n c _ s i d = 5 f 2 0 4 8 & _ n c _ o h c = Z R O r n _ O - 7 s o A X 8 X j g 2 i & _ n c _ h t = s c o n t e n t . f t u n 1 6 - 1 . f n a & o h = 0 0 _ A f C j 1 A N w z z E f 9 u W 9 O 7 u E A F n 1 S 8 x D W D 1 W A b O H B x 2 f V t V h Y A & o e = 6 5 5 7 1 2 A E,https://www.facebook.com/qatarfoundation/posts/pfbid02EnaK3QMMm2kzhcGgxgZmxnP9coKsZmkVcjkdMDwBrQxkLp9kvVmbSNyefHgGYwMl?__cft__[0]=AZX7FRIj56dHMAy6l9gKrN69UqZmVxSnMjT_Wka-DhSkcnQnl9pS7JSnm_7MK8Ofs6rn4IJytRJ9QGTYffWoRJLXw8NjxhsxCAx-ESQgyh452rd1LBhb-Hj5wooX4Xki6a_F0pyH7HjojirhTlwEDjPY7alkcCSmJ6ccXJVkStmYtv6ziKV3zJEHi3DRj6bbU3h7QUcj1VjIBEDxWW-JR9y1&__tn__=%2CO%2CP-R,"| الفلسطيني:‎ ) ; 33""‘Palesti'n Aian . 1 0١ له‎ LN ?‘ & الور‎ : فى‎ VR الأ‎ ٠ 0 5 له ا‎ ¥ 3 LN . : / o B h . N ل / / رجا 0 2 j‏ ١ ! 2‏ ا"
pfbid02ZXRMXMBPiKURLumnCFC7HwJzni6cJk5KhSiQngU672pdLWHPwEPkvnuTSm6wMwdCl,Qatar Foundation,5,41,"Have you ever seen “explosion art”?Chinese artist Cai Guo-Qiang, illuminates the relationship between China and the Arab world through gunpowder drawings in his art piece, “Fragile.” He uses porcelain tiles that remind him of his hometown, Quanzhou, a historical sea trading link to the Arab world.",2023-11-13:14:17,h t t p s : / / s c o n t e n t . f t u n 1 6 - 1 . f n a . f b c d n . n e t / v / t 1 5 . 5 2 5 6 - 1 0 / 3 8 4 4 9 6 2 8 3 _ 3 3 0 6 4 7 5 3 9 4 9 9 2 8 8 _ 3 4 6 2 0 7 5 7 2 9 8 1 1 4 9 9 1 2 5 _ n . j p g ? s t p = d s t - j p g _ s 9 6 0 x 9 6 0 & _ n c _ c a t = 1 0 2 & c c b = 1 - 7 & _ n c _ s i d = 1 a 7 0 2 9 & _ n c _ o h c = 5 k U G O p f T O v E A X _ Z U w R C & _ n c _ h t = s c o n t e n t . f t u n 1 6 - 1 . f n a & o h = 0 0 _ A f D S d v x h g u Q d 4 U K l k Q l T h J s L i 1 o x l R Y T t d x P I - M d t 1 i D X Q & o e = 6 5 5 6 9 F B 7,https://www.facebook.com/qatarfoundation/posts/pfbid02ZXRMXMBPiKURLumnCFC7HwJzni6cJk5KhSiQngU672pdLWHPwEPkvnuTSm6wMwdCl?__cft__[0]=AZX8eZspQlwyBe9V1_mkv9UqIrANHAdCzVU-o06-HrvFSG8UK-iwtszRk4ve7fgPww91UzXXRFwHsD6tL17ifW1QEyT9UqezUCz0RoJMU5UgDATejj7QnjQFHMWxe7_27pSkIbCiSv_OlX9TXJ-p0sODmZhXhC9MoUHQpd00ZBjtUhAkEHqXnyyd6tbBHQJXm8jvn4Ky4DIlbsEG6Fw7OIMh&__tn__=%2CO%2CP-R,"e N‏ د | e‏ و كع ايو كير ا ا ا ا مات يد ا ل ري O S‏ لين اها e‏ ا الا ا لور ل ال Bl ol‏ ل ا T‏ لان لسن el T R‏ الل ارال 2 o NI o U P B oy 7‏ ال ا ا @)‘,;_\_4 5 JAJ) ZCYNGEA g ok‏ ; ا 0 ا تق g‏ 0 2 هكد ل اب وت لقا بقارم أ 3 درا م ليجل شاد الاو e‏ ا ان 7 ليم ا g‏ ا ,3,< SRR 8 W‏ ل لع الايد الت T o‏ ا 0 ا v e ©‏ ال am | ,l.’;‘ PR‏ ا ا 8 ا ا ا ال i‏ اس ساق مولز عت رحن الح e‏ ا الي ب يي ناد لا لال ا e S Rl e %‏ ا ا ايض ا 1 ل < ل سي | & Gl S AN‏ ; رهف الل تقر اام الحا oo e‏ ; . اك e‏ زيف ضار الود ادك ا لاد م ار , Lo =t o‏ | الا ا"" جاه الب و S‏ ااا N‏ الس اش لوم لم ا ام د فح لمحاو ا تتح ا ال ا 0 ا S e R‏ الي عاذي BT S‏ الا :gma‘%‘ et‏ it T T‏ = 7 A A i‏ ابي ISl ot L e,‏ 1 ] 0 اش اق ا = < اط AR‏ وار e s 9 o5‏ كان SRS‏ . يجا ال"
pfbid02UmECQoTMsFrEBKyL2zE39osd5vFozy1YZRcakieGw261XrM5rNevNhYr48Yrcaavl,Qatar Foundation,0,0,هل سبق وأن صادفت فنًا يُعرف بـ”فن الانفجار”؟الفنان ساي جوو تشانغ، وهو فنان صيني مقيم في نيويورك، اشتهر بهذا الفن، ووظفّه لتسليط الضوء على العلاقة التاريخية بين الصين والعالم العربي. ففي لوحته الفنية “هش”، والتي رسمها باستخدام البارود، استخدم الفنان بلاط البورسلين الذي يُصنع بالقرب من مسقط رأسه في مدينة تشوانتشو، أو مدينة الزيتون كما سماها العرب، وميناؤها الذي كان تاريخيًا نقطة للتجارة البحرية مع العالم العربي.,2023-11-13:14:17,h t t p s : / / w w w . f a c e b o o k . c o m /,https://www.facebook.com/qatarfoundation/posts/pfbid02UmECQoTMsFrEBKyL2zE39osd5vFozy1YZRcakieGw261XrM5rNevNhYr48Yrcaavl?__cft__[0]=AZVHGrwt8J_2Jw6Bzzn1mlJGvdAEkBB-DzPDj6UEgZWISAholEk4_HmBo6x_kV-EHnY3LEnqJu9VPfdxeOAcTfbvPgMBm_xm8aNFH1WHJ3cZq0ALgyxD3ifELlfMsXWSr7IuUT0UMYYqek3ImzWiJMq5EFQ5diAf62AM2iSksPgaOVQlR0Y-aCL-g-vPC195VJZxGJfJ8GeQSNC2O_LE9z5l&__tn__=%2CO%2CP-R,1
