id,name,shares,comments,content,posted_on,image,post_url,image_content
pfbid0XqEKojmNxGWDjFTz3hhd5NiD1JfyXMyD7GZrx73Hdo5yE3GDFntxVe3jE6BtzV6l,Screen Mix,17,195,واااااااااااااو ، أحد أهداف الموسم بدون شك ..دي ماركو يسجل هدف مذهل مذهل مذهلانتر يتقدم في المباراة بـهدف رائع للـغاية من منتصف الملعب ، تاااااااااااااااااااااااريخييبدو أن هناك منافس قوي على هدف بوشكاش الآن.#ScreenMix,2023-11-12:21:49,h t t p s : / / s c o n t e n t . f t u n 1 5 - 1 . f n a . f b c d n . n e t / v / t 3 9 . 3 0 8 0 8 - 6 / 4 0 0 8 3 3 0 3 7 _ 7 5 3 8 4 4 1 1 0 1 1 7 4 5 5 _ 3 3 1 7 4 4 9 3 4 1 9 0 9 9 5 5 4 7 1 _ n . j p g ? s t p = d s t - j p g _ p 5 2 6 x 2 9 6 & _ n c _ c a t = 1 0 3 & c c b = 1 - 7 & _ n c _ s i d = 5 f 2 0 4 8 & _ n c _ o h c = A j H C B q K A l d A A X 9 j y S G S & _ n c _ h t = s c o n t e n t . f t u n 1 5 - 1 . f n a & o h = 0 0 _ A f B 1 Z B T Y g 6 L h Z S Q H g C F L f w o w R a N H L E K c U E F K J K x v O V W x 3 A & o e = 6 5 5 5 5 8 5 F,https://www.facebook.com/ScreenMixx/posts/pfbid0XqEKojmNxGWDjFTz3hhd5NiD1JfyXMyD7GZrx73Hdo5yE3GDFntxVe3jE6BtzV6l?__cft__[0]=AZWRLZ7qxJdw8qLOh959_3BjOooEoTEf-XOV9jJKk9ufGHTO1h6D_BYr8LDNiitktKnaP5onA1rcptIepODA49tZlY-hFspw6tJJf7BLXHaz6eRFdj5CxCy-gGLzuE6qjCMKkNrIF9L03i-YzvLgId17f8bBtzXJAdwyPuvBxgKovHRqOOfBIDUcNQzrpzV3hB42nLRip_Gi6FzaAIFHESMo&__tn__=%2CO%2CP-R,”@“*_;r 5‏ ; 3 - — هم v‏ - : اليا o‏ جه أ - ة REENMIX.NET‏
pfbid02MqShdx9QZE3wRLYR86tVsRGMW6ZxwcYb7gMps1b9Vakzbwmb4QZU1GB6j5cCoBuTl,Screen Mix,0,0,إيسكو عاد من جديد يا رفاق ، الساحر عادأصبح منظر معتاد في كل مباراة ، في كل جولة ، في كل أسبوع ، إيسكو رجل المباراة. — إيسكو مع ريال بيتيس حتى الآن : 13 مباراة مع الفريق 9 مرات رجل المباراةعاد للحياة ، إيسكو عاد إليكم من جديد!#ScreenMix,2023-11-12:21:24,h t t p s : / / s c o n t e n t . f t u n 1 5 - 1 . f n a . f b c d n . n e t / v / t 3 9 . 3 0 8 0 8 - 6 / 4 0 0 7 2 4 8 8 5 _ 7 5 3 8 3 2 9 3 3 4 5 1 9 0 6 _ 4 8 9 3 2 2 6 1 8 8 3 9 3 9 0 2 6 4 8 _ n . j p g ? s t p = d s t - j p g _ s 6 4 0 x 6 4 0 & _ n c _ c a t = 1 0 1 & c c b = 1 - 7 & _ n c _ s i d = 5 f 2 0 4 8 & _ n c _ o h c = S O 5 7 d W k s _ n Y A X 9 X k a E Q & _ n c _ h t = s c o n t e n t . f t u n 1 5 - 1 . f n a & o h = 0 0 _ A f B B n f k p O z 8 p 8 V 4 B E h L 4 E z n H n N 8 h s G P 4 Y E d B r 7 3 9 3 X k j o g & o e = 6 5 5 5 6 4 F 3,https://www.facebook.com/ScreenMixx/posts/pfbid02MqShdx9QZE3wRLYR86tVsRGMW6ZxwcYb7gMps1b9Vakzbwmb4QZU1GB6j5cCoBuTl?__cft__[0]=AZWnqf6rRI28rRG8YujZtk5vqQwQhh5Ihp7K-ZbK54cLmVDhGZ6OwWItFOsCwY0Q7LDViePhP7kOcw6ESNKwozjdp-kaVl-UX9OwbjOXY5ovjGW_QUyBRRVKXu01xHQL3PVmVLU80reVWFPKI-Y_Z-y2slvCv1yLoXwZfzjkMHFqbZkVBAkKKz-VJ-2mXJIHEo8t0WSUUZWu94vwqWV6ZS-z&__tn__=%2CO%2CP-R,"1 s 0, 0"" ال‎ ب‎ هه : 2 ح‎ g ره‎ 0 7 1 «6 finetwo"
pfbid0u3VZiC2EnRRFgwLpDrzBfDgWwQbrs6YEziCx8F49BzWaYFRHdkELuDCwQXarfZnjl,Screen Mix,0,0,تعاقب فصول السنة الأربعة على جزيرة في فنلندا ! Jani Ylinampa#ScreenMix,2023-11-12:21:24,h t t p s : / / s c o n t e n t . f t u n 1 5 - 1 . f n a . f b c d n . n e t / v / t 3 9 . 3 0 8 0 8 - 6 / 4 0 1 6 7 6 3 6 8 _ 7 5 3 8 1 8 9 9 6 7 8 6 6 3 3 _ 4 5 4 3 0 8 2 9 1 4 1 5 2 7 9 3 0 9 0 _ n . j p g ? s t p = d s t - j p g _ s 6 0 0 x 6 0 0 & _ n c _ c a t = 1 & c c b = 1 - 7 & _ n c _ s i d = 5 f 2 0 4 8 & _ n c _ o h c = I A - R Z F H 2 l 2 s A X _ S r c S c & _ n c _ h t = s c o n t e n t . f t u n 1 5 - 1 . f n a & o h = 0 0 _ A f B H q Q p c v i G l j l 4 q A v 9 j n 8 9 3 1 U J G - o l a O F O 7 p 5 O G G V E g d A & o e = 6 5 5 5 C 2 4 9,https://www.facebook.com/ScreenMixx/posts/pfbid0u3VZiC2EnRRFgwLpDrzBfDgWwQbrs6YEziCx8F49BzWaYFRHdkELuDCwQXarfZnjl?__cft__[0]=AZWW4dJv1cE06E0qMnnsNQCJb3EeKUulndzmKUVKzWm-OlZmDiDC3rWxaxt1qnz9f2lYcsOHG1q7Qe74lZpbul0CdP2BugfndFDFNnfCE_nQhh5TNrnTYAD4I4AWjMYuqLcanYu2JXaqIX_EvGlX5EUSYmdEZekvZu3MIlNnLs4c9PdeQ1MHs4m9M7u_gcCEA0q8u2BnE5EyRlSW6BbjCUZj&__tn__=%2CO%2CP-R,Y il Mo ~ \K ل‎ 7
pfbid0o37WZgRBHfJr8AyY3mxCjRqFEE99VnvRvjHB46As5ySwau3bzC5tQYaQthq3ATDql,Screen Mix,147,413,• د25 | تشيلسي 0-1 السيتي• د29 | تشيلسي 1-1 السيتي• د37 | تشيلسي 2-1 السيتي• د45| تشيلسي 2-2 السيتي• د47| تشيلسي 2-3 السيتي• د67 | تشيلسي 3-3 السيتي• د85 | تشيلسي 3-4 السيتي• د90| تشيلسي 4-4 السيتيمباراة أقل ما يقال عليها أسطوريةمانشستر سيتي يستمر وحيدًا في صدارة البريمرليغ#ScreenMix,2023-11-12:20:24,h t t p s : / / s c o n t e n t . f t u n 1 5 - 1 . f n a . f b c d n . n e t / v / t 3 9 . 3 0 8 0 8 - 6 / 4 0 0 7 3 4 1 9 7 _ 7 5 3 7 9 6 7 4 6 7 8 8 8 5 8 _ 9 0 0 8 2 2 4 5 3 4 9 6 0 0 3 1 5 1 5 _ n . j p g ? s t p = d s t - j p g _ s 6 4 0 x 6 4 0 & _ n c _ c a t = 1 & c c b = 1 - 7 & _ n c _ s i d = 5 f 2 0 4 8 & _ n c _ o h c = Q k q J J W D M J 9 g A X _ L 0 E 4 W & _ n c _ h t = s c o n t e n t . f t u n 1 5 - 1 . f n a & o h = 0 0 _ A f B F c R c P p z m U b u 6 Q s Z H 4 5 8 B C d v Y Z 9 q T 9 D e 5 R Q Y w 8 u d 2 8 t Q & o e = 6 5 5 5 8 D 9 4,https://www.facebook.com/ScreenMixx/posts/pfbid0o37WZgRBHfJr8AyY3mxCjRqFEE99VnvRvjHB46As5ySwau3bzC5tQYaQthq3ATDql?__cft__[0]=AZWpEyo6YZYjt293doz6WZHAu6c5dbt6FJT9htC23Ej8G_gLkRrJ3T70wJ4GIzS1Wpkz9YH-TFfpdmbzUo8YiMNT4UiI10_aa3pjs_3FA0kLMBNw97epfbG6BwLk93M8IamiHhIlfozpflZNblGYvSQT8RvlAhB5TLZX0IqDeDqDJySfeABcrbEWH5kK17yO2S5mYgdQutIPY1RNm965zqQ3&__tn__=%2CO%2CP-R,"= 3 > - © ء و5 لز J 0 ) ) L2‏ ١""‏ ل ببسيس ا N‏ N 3‏ اك & 4 إن 1 ب [- BNy‏ g =T .‏ 1 i 4 6 )‏ & ا P, -‏ 2 جح { e‏ = ا ا 1 o‏ e‏ ا 10 به وإ 5 7 o‏ = 2 | ,;,: ‘ 1 3ج ١‏"
pfbid0SRGArU51dzvhjkuTinfUSPDMWujH3MwDT4nLsCPXnHJ2xJ4JEeUbzm3XjjK5Hvqyl,Screen Mix,22,242,تاااااااااااااااريخي :ليفاندوفسكي ينقذ برشلونة من متذيل الدوري ألافيس ، ويعود بريمونتادا رائعةفيسكا بارسا فيسكا كتالونيا .. عاد برشلونة الذي نعرفه#ScreenMix,2023-11-12:18:24,h t t p s : / / s c o n t e n t . f t u n 1 5 - 1 . f n a . f b c d n . n e t / v / t 3 9 . 3 0 8 0 8 - 6 / 4 0 0 7 6 2 2 4 7 _ 7 5 3 7 6 0 0 4 0 1 2 5 8 6 2 _ 8 3 0 3 7 4 4 0 5 8 3 6 3 5 2 4 6 5 0 _ n . j p g ? s t p = d s t - j p g _ s 6 4 0 x 6 4 0 & _ n c _ c a t = 1 & c c b = 1 - 7 & _ n c _ s i d = 5 f 2 0 4 8 & _ n c _ o h c = b 9 p D u V m g z L g A X _ U m N 9 W & _ n c _ h t = s c o n t e n t . f t u n 1 5 - 1 . f n a & o h = 0 0 _ A f D N V i A 2 L E A 7 l e v O w S U g 4 L Q z - Z z U E 9 D D Y c m d N E d n 8 z P v i A & o e = 6 5 5 6 2 2 D D,https://www.facebook.com/ScreenMixx/posts/pfbid0SRGArU51dzvhjkuTinfUSPDMWujH3MwDT4nLsCPXnHJ2xJ4JEeUbzm3XjjK5Hvqyl?__cft__[0]=AZVfAoifV6zRa1sIMl6SIjlvSM9YeuCV8NPXz-IunrVMTX0-ZjEa4bJqmJqFF-ADGBKV8kDxNoUREcfCGB3qyGI9UutCwxyTbnFBUVFI1h9I2VtSfvWtyEfNQHRtHxxqzmCcDbW7NXX6OIVlyuMuFjjQm3zxcmPS3UbMT072fNvw_u4vfr18o2y0LxI8C5iMu7iYmKpBQPCNAqr33ZQnuxAQ&__tn__=%2CO%2CP-R,"5 N ¥ 1 1:7 P - 7 ""١ 2 > 1 دمج - ب‎ - 18 ! . » f 01 8 5 A \.:; 9 ."
pfbid0wBZCaRQDQtRzCXcj62mBMzE1qtxY3e83wgF7VeBJ7EUCXzGBqvHpUxRqjKGid5zyl,Screen Mix,48,297,أسرع هدفين في الليغا هذا الموسم :ثارغوثا — في الثانية 17 ضد برشلونة سامو — في الثانية 18 ضد برشلونة جميعها سجلت على برشلونة!#ScreenMix,2023-11-12:18:24,h t t p s : / / s c o n t e n t . f t u n 1 5 - 1 . f n a . f b c d n . n e t / v / t 3 9 . 3 0 8 0 8 - 6 / 4 0 0 7 4 6 6 3 4 _ 7 5 3 7 5 0 8 4 0 1 2 6 7 8 2 _ 7 9 2 1 7 3 0 4 6 9 3 5 1 3 5 2 4 3 9 _ n . j p g ? s t p = d s t - j p g _ s 6 4 0 x 6 4 0 & _ n c _ c a t = 1 & c c b = 1 - 7 & _ n c _ s i d = 5 f 2 0 4 8 & _ n c _ o h c = I 2 c m 9 r T P r t k A X 8 p 9 W U r & _ n c _ h t = s c o n t e n t . f t u n 1 5 - 1 . f n a & o h = 0 0 _ A f B g n G E Y 2 3 x J o M C k y 4 F q Y z k O o P N 9 S o j T b f 6 0 t 1 Z s f X p m y Q & o e = 6 5 5 6 D C C D,https://www.facebook.com/ScreenMixx/posts/pfbid0wBZCaRQDQtRzCXcj62mBMzE1qtxY3e83wgF7VeBJ7EUCXzGBqvHpUxRqjKGid5zyl?__cft__[0]=AZUmaTtMYevHorGeOYJd6G7ljOWD1oKG00QH3tZ1Jvqe2feMQBynmui5Wj0GQfjTT9nJnhUCc_KKLeqUNqmBwUhvNQwqLT8Cx9sYk40RxcnwtBwDwC6NG2sHuJI0IJ7KPISaRJac7WJsZfs6EZAVn6d76XzUH5UyWoBbFDINMSOpst404dtbTG7yGqc8CeJYXyCfijQbKW-oLWmvxV4E80CJ&__tn__=%2CO%2CP-R,( s ' ري‎ Te o 2 Y وان‎ -
pfbid08WTPch2kzNW7RcGR9kK6Jr1iALn2XcRHzpiGcEMTDP1SrQxLj1W3UM1kweyniGpDl,Screen Mix,155,256,لاعبو كرة القدم كشخصيات GTA 6 أذهلوا عقولنا  Via: AI#ScreenMix,2023-11-12:17:24,h t t p s : / / s c o n t e n t . f t u n 1 5 - 1 . f n a . f b c d n . n e t / v / t 3 9 . 3 0 8 0 8 - 6 / 4 0 1 0 9 6 9 9 8 _ 7 5 3 7 1 3 9 4 6 7 9 7 1 3 8 _ 1 2 4 5 2 8 2 5 5 3 4 9 5 9 6 6 2 6 2 _ n . j p g ? s t p = d s t - j p g _ p 4 8 0 x 4 8 0 & _ n c _ c a t = 1 & c c b = 1 - 7 & _ n c _ s i d = 5 f 2 0 4 8 & _ n c _ o h c = X y 9 h D J w M a 8 w A X - V H O P M & _ n c _ h t = s c o n t e n t . f t u n 1 5 - 1 . f n a & o h = 0 0 _ A f D l T v 6 g b J L a 1 3 H G A f x _ t 9 3 X - G d 7 H O p M x 3 G i 5 T r b 7 4 Z z I A & o e = 6 5 5 7 1 2 8 3,https://www.facebook.com/ScreenMixx/posts/pfbid08WTPch2kzNW7RcGR9kK6Jr1iALn2XcRHzpiGcEMTDP1SrQxLj1W3UM1kweyniGpDl?__cft__[0]=AZXSKLxahOWqzgvQeuyxB9BuuzxMXwLkJ51C43yn1ulx3hucA80fkj4YfOo2G1TWMsdwq0t1BRUqsWR80pSJPaLc1-_IKgFnX9-9Obv4wCNzKlmAq2CuxLdeZZSkg_1t6uAyxQ-axOpVaKaInfpZTDkYCXYlXKLfIzNQ2wcJgyYGVjGWAoDTtd0JzRl16EKWWBcvN_STaBJb4GH_qgYPiZEl&__tn__=%2CO%2CP-R,"B 7 A > l || - 7 8 7 i 3 بي‎ ) S o حا‎ 3, ا‎ N < 0 Bt : 17م | ا‎ ‘ LI 1 ُ 0 7 b = L O\ ! 2 - - اح‎ gl ب‎ _ — 7 0 اي‎"
pfbid02KCzBF2Y2Z49WDAR5jKxMEHEHxTSbGW3wCanqeme13utq2pAzrDDyDwFkW1QTw28ul,Screen Mix,0,0,"من الذاكرة .. عرس بلا عريسأب يقيم لإبنته ""من متلازمة داون"" حفل زفاف بدون عريس من أجل أن يسعدها ويعوضها فقط #ScreenMix",2023-11-12:16:25,h t t p s : / / s c o n t e n t . f t u n 1 5 - 1 . f n a . f b c d n . n e t / v / t 3 9 . 3 0 8 0 8 - 6 / 4 0 0 7 4 6 4 7 2 _ 7 5 3 6 6 0 6 9 0 1 3 5 7 9 7 _ 5 8 9 2 7 9 2 9 8 1 3 2 4 0 9 9 2 4 3 _ n . j p g ? s t p = d s t - j p g _ s 6 0 0 x 6 0 0 & _ n c _ c a t = 1 & c c b = 1 - 7 & _ n c _ s i d = 5 f 2 0 4 8 & _ n c _ o h c = y V I m g 2 L b 1 2 k A X - A r n O h & _ n c _ h t = s c o n t e n t . f t u n 1 5 - 1 . f n a & o h = 0 0 _ A f A X V A 3 o N g t 1 Q _ m d v p r P x q s b U H H F 0 U Y R o _ m C s 8 k 6 _ P l 8 K A & o e = 6 5 5 6 3 6 F 0,https://www.facebook.com/ScreenMixx/posts/pfbid02KCzBF2Y2Z49WDAR5jKxMEHEHxTSbGW3wCanqeme13utq2pAzrDDyDwFkW1QTw28ul?__cft__[0]=AZVEL-pOfgkv8Sk_W8w5bVSfO-Ohzso2zGOw9ZF-c1jAMgnzwGaWvaKy2nO9hKnlIKZUyJYDncm9BKwP4dl9NC_OJH4w879Pl5uSGq8UI1I-dJPWtHpTx0SFjEJH4bB9PfSBjsMUuFCUmut8hfYuIi3YK4E7IfhqDIU02Bjwa2_PEzXHzqrW7-0t3G4gWmiNGyVsZJ4X0tiEVOHX61KEO4KO&__tn__=%2CO%2CP-R,0 اد‎ Y ْ ١ /
pfbid031eP8vHapNv3GzxLGgZBMter94Xux22sjyvjhCPPW3SL647m7WHaqv93RKEsZK7AUl,Screen Mix,0,0,| ميسي: كان لدي 6 أهداف في حياتي ، الأول هو الفوز بكأس العالم| الصحفي: والخمسة أهداف الأخرى ؟ | ميسي: سجلناهم في ريال مدريد عام 2010#ScreenMix,2023-11-12:15:25,h t t p s : / / s c o n t e n t . f t u n 1 5 - 1 . f n a . f b c d n . n e t / v / t 3 9 . 3 0 8 0 8 - 6 / 4 0 0 7 8 6 8 7 8 _ 7 5 3 6 3 3 8 5 3 4 7 1 8 1 4 _ 2 9 4 3 8 7 9 6 7 0 6 4 4 4 4 1 5 1 2 _ n . j p g ? s t p = d s t - j p g _ s 6 4 0 x 6 4 0 & _ n c _ c a t = 1 1 1 & c c b = 1 - 7 & _ n c _ s i d = 5 f 2 0 4 8 & _ n c _ o h c = Z w H C 2 o 6 p W I c A X _ j 3 R F 8 & _ n c _ h t = s c o n t e n t . f t u n 1 5 - 1 . f n a & o h = 0 0 _ A f D 2 D E A h 9 q x p w - T D k B G 4 U w c Q U f 3 5 x W 7 q f 7 q k m q O 6 W v S S 6 g & o e = 6 5 5 6 E B 2 3,https://www.facebook.com/ScreenMixx/posts/pfbid031eP8vHapNv3GzxLGgZBMter94Xux22sjyvjhCPPW3SL647m7WHaqv93RKEsZK7AUl?__cft__[0]=AZVs0KHDlG05nYXy2w3quyLjd_qEnltfI7797lnVn2ibyfFVOjNScV8r8u3ePPq3RjthZctxEwwoXOiY3HjpkYgo-EeBRnNCvKxcIGk3LD5zDKd3sGXqnH3xOIDiDqwomDRT9f08rzjwyiGqLIRTK7ujLPH03VBq2vv1wXiGrZqpCbaPqwJHs8MqeQcyB0MXIrjPbnb2aR-o61AcHproOohB&__tn__=%2CO%2CP-R,"| ساخر ّم مي \ ' RN 7 N >‏ اوم 7١‏ “5 . ) B AN‏ للا R‏ — A1 i‏ .""01"" mﬁég':l""l:- =‏ L‏ - بلا Tece‏ @ أ . R v‏ 1"
pfbid027Vosadqd2Cg5wnpxtpNNbEjNv9GW32ojuxWSaNhwTwiuteUFGYymEgimLnDR5WRTl,Screen Mix,296,160,الله يجيب على أدعيه العبد بثلاثة أشكال .. من أجمل المسلسلات التركية #ScreenMix,2023-11-12:14:25,h t t p s : / / s c o n t e n t . f t u n 1 5 - 1 . f n a . f b c d n . n e t / v / t 3 9 . 3 0 8 0 8 - 6 / 3 9 7 5 8 9 3 0 1 _ 7 5 3 6 0 4 8 1 3 4 7 4 7 1 8 _ 4 1 0 1 8 8 0 4 0 4 1 2 6 1 9 0 2 4 5 _ n . j p g ? s t p = d s t - j p g _ p 5 2 6 x 2 9 6 & _ n c _ c a t = 1 & c c b = 1 - 7 & _ n c _ s i d = 5 f 2 0 4 8 & _ n c _ o h c = r _ Z u G X _ C w b Y A X 8 q r i 3 8 & _ n c _ h t = s c o n t e n t . f t u n 1 5 - 1 . f n a & o h = 0 0 _ A f B 6 U _ B e K 6 z S 1 R b a j 8 - J q S g r g N K 8 z 6 l g t U Q 8 E q 4 T n P i Y O w & o e = 6 5 5 6 0 3 0 7,https://www.facebook.com/ScreenMixx/posts/pfbid027Vosadqd2Cg5wnpxtpNNbEjNv9GW32ojuxWSaNhwTwiuteUFGYymEgimLnDR5WRTl?__cft__[0]=AZW_44AFALLV37qRJRAtAVuiMRYvdQp2wjzLcvbIsMWblV8MlGMKFSxmExX92_PLhtZZ5Q1ailDXHHK8UFbaQu-hJ9UmB0gAds-DwVu26ikUzeGcQ2lfJIdgyueYQ4H4H0A5zFOTwdHweYlsiPns3U7qfuJ473Fnf0xVWnyrh1wbEuq9-hKQfo8p7iqI_QyF_4D8bgpf1fBO6qYL2H8rLcz-&__tn__=%2CO%2CP-R,"N 0 1 7 - 'Juﬁ;i&inﬁ_ الله يجيب على ادعية العبد‎ علا‎ لا ل‎ يقول نعم, يعطيك ما تريبدينه‎ ١ 7 ' يقول لا يعطيك الأفضل‎ 2 "" 5 [ٍ 4 هو أفضل من الأفضل]‎ Lo يقول انتظر, يعطيك‎"
pfbid0sEYQqRipd3ecSxKS6gNhFLFyotiTJSyrJ6eJVqeNXGUaskTHuiEMC7BRBZvsi2bQl,Screen Mix,138,166,كان عمري 26 عام كنت أعاني .. لم أكن أملك أي شئ وهذان الزوجان كانا يملكان متجر للأثاث في مدينة كليفلاندقد ساعداني وأعطوني أول تعاقد لشركة تنظيف السجاد الصغيرة التي أنشأتهاعندما أصبحت كوميديان وعمري 27 عاملم أملك أي مال للسفر .. فتكفلا بكل مصاريف سفري حتى وصلت الفاتورة ل 11 ألف دولار لاني كنت أحاول السفر في كل مكان لأحقق شئ من نفسي لقد ساعداني .. ولقد أصبحت غني الآن وسأساعدهما كما ساعداني#ScreenMix,2023-11-12:13:25,h t t p s : / / s c o n t e n t . f t u n 1 5 - 1 . f n a . f b c d n . n e t / v / t 3 9 . 3 0 8 0 8 - 6 / 4 0 1 5 7 7 6 3 1 _ 7 5 3 5 7 8 1 4 0 1 4 4 0 5 2 _ 4 2 6 1 0 6 1 1 3 6 1 0 9 7 8 7 3 7 2 _ n . j p g ? s t p = d s t - j p g _ s 6 4 0 x 6 4 0 & _ n c _ c a t = 1 & c c b = 1 - 7 & _ n c _ s i d = 5 f 2 0 4 8 & _ n c _ o h c = 6 A A u P 6 9 i H j E A X 8 d P 3 9 r & _ n c _ h t = s c o n t e n t . f t u n 1 5 - 1 . f n a & o h = 0 0 _ A f B T a U y M N k G d 3 X D 0 f l b T H H u Z d X T 9 Q T x M Z n t _ a C h T S Z x g y Q & o e = 6 5 5 5 E 3 6 3,https://www.facebook.com/ScreenMixx/posts/pfbid0sEYQqRipd3ecSxKS6gNhFLFyotiTJSyrJ6eJVqeNXGUaskTHuiEMC7BRBZvsi2bQl?__cft__[0]=AZXth5L0by1bVYdXvFJa1XQUSIxaQSV6rf9SV9N4fYJG00qJB60Zhp-fup8zeuwvdRYODHXedSI1h45XabWRW82NNoqc5VydQ1hB5ApZDN85IcyKhE46rgWMpa4a9QU-cF1dM4xbHr1QVwe5AuvC4bCuvmLOEZqgKV6sh97LW-9AeujEpunkha17-OuhxehlRgMJ1gT9Olb_yQ_WrHRo88F9&__tn__=%2CO%2CP-R,"Bl 7.‏ ; ) “Q‘ﬂﬁ‏ == / ""1 © . لأسا اكه إل : ~ ز 7 يه ا - . ) oy‏ T8 7/‏ ) i‏ / 3 7 الأصيل لا ينسى من ساعد أبداً ستيف هارفي مع من ساعدوه أيام فقره"
pfbid02mnpF7XXK7Z22Mze6HXuXWTqWayjZtSb5r3cFP1DmYtSeqH9RPW5oxqmZ24zMko6Ml,Screen Mix,22,257,لاعب وحيد الذي فعلها مع 3 أندية مختلفةإنه الــ GOAT الحقيقي ليونيل ميسي #ScreenMix,2023-11-12:12:25,h t t p s : / / s c o n t e n t . f t u n 1 5 - 1 . f n a . f b c d n . n e t / v / t 3 9 . 3 0 8 0 8 - 6 / 3 9 9 6 8 3 1 8 9 _ 7 5 3 5 5 4 2 6 6 8 1 3 1 0 6 _ 2 6 5 1 2 1 8 9 6 5 2 2 0 9 0 4 9 7 6 _ n . j p g ? s t p = d s t - j p g _ p 5 2 6 x 2 9 6 & _ n c _ c a t = 1 0 6 & c c b = 1 - 7 & _ n c _ s i d = 5 f 2 0 4 8 & _ n c _ o h c = D V b b 8 S d f e f I A X - M x o J C & _ n c _ h t = s c o n t e n t . f t u n 1 5 - 1 . f n a & o h = 0 0 _ A f C o P n b 3 - a p x m Z a T z D W Y I b C 0 I k r g Y u 0 Q i V C 5 f f i n 2 4 A E D w & o e = 6 5 5 5 4 E E 5,https://www.facebook.com/ScreenMixx/posts/pfbid02mnpF7XXK7Z22Mze6HXuXWTqWayjZtSb5r3cFP1DmYtSeqH9RPW5oxqmZ24zMko6Ml?__cft__[0]=AZU-PnIg37CSWYUDMySK_kB3ODWzGkH8wtzmMNc6Rv_2h0YL5wWwAt3Rs3mzUdauRI9xX1GzmSMHVn21m0DIPvd5QPap-Z0H1o76RVBVbd9Z7Eenn9HlqdF3Pm5F71XdH_GJ7ysCS-JtzP_Y5Wc-mvWY0R5Ra3ZkL_zJI_ahGnrkAU36943qaziVOoeggYBAKQ24Zv-wuz-zqzG8_BfuqOg4&__tn__=%2CO%2CP-R,"e‏ ودع - < & ol | =‏ عن © PR‏ ل ا ""78 © 1"
pfbid0NBeZVS2mtthQC7SNuXm2dhhNg6NYy8yzWXnKmj4Fk4td9QDEBU4upkQdb6y2St8Yl,Screen Mix,163,964,تأثير الزمن .. ملكة الجمال الفنانة الشهيرة صوفيا لورين بين الماضي والحاضر #ScreenMix,2023-11-12:11:25,h t t p s : / / s c o n t e n t . f t u n 1 5 - 1 . f n a . f b c d n . n e t / v / t 3 9 . 3 0 8 0 8 - 6 / 4 0 1 6 2 8 0 8 9 _ 7 5 3 5 3 1 3 3 3 4 8 2 0 6 6 _ 4 6 2 5 6 5 4 4 0 1 4 8 6 5 7 5 9 1 5 _ n . j p g ? s t p = d s t - j p g _ p 5 2 6 x 2 9 6 & _ n c _ c a t = 1 & c c b = 1 - 7 & _ n c _ s i d = 5 f 2 0 4 8 & _ n c _ o h c = 3 h C T x q _ U k z k A X 9 N Y Q m 0 & _ n c _ h t = s c o n t e n t . f t u n 1 5 - 1 . f n a & o h = 0 0 _ A f B D M Q W S t 6 r o B l m C x q V l w 6 N s X r M W l 5 i H N D o 0 4 5 a R n Y J Q n Q & o e = 6 5 5 6 B 9 1 A,https://www.facebook.com/ScreenMixx/posts/pfbid0NBeZVS2mtthQC7SNuXm2dhhNg6NYy8yzWXnKmj4Fk4td9QDEBU4upkQdb6y2St8Yl?__cft__[0]=AZUVMFRCDlQiHEJ-8ofAPWSrdZsSWo7ak3Vvm94QiJ7hsMt8pO1atWlCH5B8TVLtT_Y2P_VIDhihuPFre7es1u38s55WoLdct15wcyavWVr4KgEV4h2nHPtW0eAHUmz4FCze9w4ALMoEg1_hHzOTFN-Eeyha4FsBxF5LZaqkeoYS1VsdaUJKxMCiS5aedHvVbMq16hP0EqmM0TlMlir_Ym5K&__tn__=%2CO%2CP-R,Ny o : < A 4 يق
pfbid0FVWuscyx9heynZ8LYrqp2nkDe1bv8GoMWa9H94vdnGsQqWe3T6gF9q5XrTsfsJyol,Screen Mix,0,0,نَقِّل فُؤادَكَ حَيثُ شِئتَ مِنَ الهَوى ، ما الحُبُّ إِلّا لِلحَبيبِ الأَوَّلِروح رونالدو ستظل خالدة في الملكي ريال مدريد #ScreenMix,2023-11-12:00:25,h t t p s : / / s c o n t e n t . f t u n 1 5 - 1 . f n a . f b c d n . n e t / v / t 3 9 . 3 0 8 0 8 - 6 / 4 0 2 1 5 5 7 2 6 _ 7 5 3 2 7 7 2 6 6 8 4 0 8 0 6 _ 2 7 2 6 9 0 1 7 5 5 6 7 9 6 9 8 2 7 9 _ n . j p g ? s t p = d s t - j p g _ s 6 4 0 x 6 4 0 & _ n c _ c a t = 1 0 7 & c c b = 1 - 7 & _ n c _ s i d = 5 f 2 0 4 8 & _ n c _ o h c = j f o r m w t r O Q s A X 9 q 6 N u l & _ n c _ h t = s c o n t e n t . f t u n 1 5 - 1 . f n a & o h = 0 0 _ A f A l x T u 3 h g 5 g 8 d 3 1 X G a 3 1 1 q J J p j R 6 w j B e V T 7 K t m t U s O w N w & o e = 6 5 5 5 B 1 2 F,https://www.facebook.com/ScreenMixx/posts/pfbid0FVWuscyx9heynZ8LYrqp2nkDe1bv8GoMWa9H94vdnGsQqWe3T6gF9q5XrTsfsJyol?__cft__[0]=AZUSxx_9-Bf0p7E90BwegE29ElanmI1rxKyBUjsCr0V-brs3TzyH3x4tnPWBFzy6TpQCh4EP0tq523PxwaSpVx0c4pcyGu1jk9ghFn4JOHggvNqb7qFkkke15bnIw3OTN_XTdeKu2_dxrdPPlcVGB_P0RzGVk5eFXQdI021M0CyvKUBkQJF8ylJt_IpA5KHAN0K5E7sbsoXuPr4udxcjNH6F&__tn__=%2CO%2CP-R,"i iy 2 P Ay N B & 1 4 1 1 7 7 8 ‘ ) “ ﬂ/i/;}’é’S / i AN leﬂ ) ١ i \ ,: 7K اج ا‎ N ‘ . A I Emiay ل‎ N NS mlar[%”_ «© 3 ال‎ A بي أ‎ A =% - Yy \ | 7"
pfbid0cTTiatZYn4X2hpp4FD2jrgYWNK9Wi4peCffp3r96QQGMBCUZQY3FUBm7PtDUJpbPl,Screen Mix,0,0,تاااااااااريخي :ريال مدريد يسحق فالنسيا 5-1 ويحافظ على المركز الثاني برشلونة سيلعب غدًا من أجل الحفاظ على المركز الثالث رودريغو في مباراة اليوم أمام فالنسيا : صنع الهدف الثاني  صنع الهدف الثالث سجل الهدف الرابع سجل الهدف الخامسفينيسيوس جونيور في مباراة اليوم أمام فالنسيا : سجل الهدف الثاني سجل الهدف الثالث رجل المباراة#ScreenMix,2023-11-11:23:25,h t t p s : / / s c o n t e n t . f t u n 1 5 - 1 . f n a . f b c d n . n e t / v / t 3 9 . 3 0 8 0 8 - 6 / 4 0 0 8 1 4 7 3 4 _ 7 5 3 2 6 4 0 1 6 8 4 2 1 3 1 _ 2 3 5 3 2 8 4 8 7 8 0 1 2 8 2 4 4 2 7 _ n . j p g ? s t p = d s t - j p g _ s 6 4 0 x 6 4 0 & _ n c _ c a t = 1 & c c b = 1 - 7 & _ n c _ s i d = 5 f 2 0 4 8 & _ n c _ o h c = j a a - u 1 M I B t M A X 8 1 X r R O & _ n c _ h t = s c o n t e n t . f t u n 1 5 - 1 . f n a & o h = 0 0 _ A f A 1 5 z R f J E f V g 3 d - A 7 6 3 H S R y 1 t d 9 Q z u 1 s P u E m 6 z Y p C w q i A & o e = 6 5 5 6 0 0 F A,https://www.facebook.com/ScreenMixx/posts/pfbid0cTTiatZYn4X2hpp4FD2jrgYWNK9Wi4peCffp3r96QQGMBCUZQY3FUBm7PtDUJpbPl?__cft__[0]=AZWGJueOpdRQZPanrCyGLVqc3B_r9i3wTUcuv6e3pqra2DykZdbI30efeiRRI1dxW9ObBje-DnBLMPH-ut9p0ikJXdPLdWu_-So0gAUj64dKdH6e4XXNdIhMScdDEluXPO0S4rQoWch5tMF_ul9yi46YyPcyBl_1GM6xPuNbDxXB-9gn9t10lNU0PwaD-LqPW3Fy1zOEgzPL7fnuzGG_VMJs&__tn__=%2CO%2CP-R,"p e 2 R Wz \5‘(& ) & ,' \ 8 A ’ 2 o }: N TP H R 7 ١ - -"
pfbid0AmckN6U5xkjergByfsPGQ2Chd6q1fozzu2gsForEe29pQCAdJpQGrRsHdWW2rvJCl,Screen Mix,73,442,عاااااااااجل :موسم الرياض يقترب من التوقيع رسميًا مع نادي إنتر ميامي ليكون ثالث فرق بطولة كأس موسم الرياضتفاصيل بسيطة متبقية لمشاهدة مواجهة تاريخية بين النصر بقيادة الدون رونالدو ضد إنتر ميامي بقيادة البرغوث ميسي في الرياض ، وسيتم التأكيد فور الإعلان الرسمي#ScreenMix,2023-11-11:23:25,h t t p s : / / s c o n t e n t . f t u n 1 5 - 1 . f n a . f b c d n . n e t / v / t 3 9 . 3 0 8 0 8 - 6 / 4 0 0 8 4 4 9 8 3 _ 7 5 3 2 5 8 1 9 0 1 7 6 0 4 7 _ 2 4 8 1 4 1 1 7 3 5 9 6 9 8 5 8 2 1 _ n . j p g ? s t p = d s t - j p g _ p 5 2 6 x 2 9 6 & _ n c _ c a t = 1 & c c b = 1 - 7 & _ n c _ s i d = 5 f 2 0 4 8 & _ n c _ o h c = X t _ F q b c q m t E A X 9 0 z N H e & _ n c _ h t = s c o n t e n t . f t u n 1 5 - 1 . f n a & o h = 0 0 _ A f D G A u U m K 8 r 9 Z j M v o F M C R j i A j t p 8 X k z Y I R 1 S I W Q N P K 3 z z Q & o e = 6 5 5 5 9 F E 4,https://www.facebook.com/ScreenMixx/posts/pfbid0AmckN6U5xkjergByfsPGQ2Chd6q1fozzu2gsForEe29pQCAdJpQGrRsHdWW2rvJCl?__cft__[0]=AZWKFXektF6rsDDiXE7NSNhhns5Osb_y_jzrdSxqskFVSGKS_2H94cSTCYR-G5bk5fSgcMUgNQoet1xWs8Ct3tsFSOci_jZvqiEuyvW9gfhRB0Ib3Nip4eM-P_L5UAC4-KKvUUwp3FtjcKEOw4lg8IgHTzkXWv26ZUWp4tX9ZPP97xSe9ij0aylmp0Sj341GFBQvzeS4_lgDlX8Hs24_offt&__tn__=%2CO%2CP-R,"M oz e داك‎ TR & - F % | RS = ا‎ 7 | 0 ""7 ادها م ال‎  - p aa — اص ا‎ ال د اهو‎ في الرياض .. قد نشاهد الرقصة الأخيرة‎ والتحدي الأخير بين رونالدو وميسي‎ SCREENMIX.NET"
pfbid02Pb7rTsSghvv8Ew7id5pBqTzasRdteD4kjogB96A8nLDKazPQPNgQr8EX5zjdfkiPl,Screen Mix,37,325,"صحفي عربي : تكلم الفرنسية ؟المدرب المغربي حسين عموتة : ""لماذا اتكلم باللغة الفرنسية.. اللغة العربية هي الأولى ولغتنا الأم.. نحن لسنا فرنسيين.. اللغة العربية هي لغة القرآن""...مؤتمر صحفي عام 2017..#ScreenMix",2023-10-07:16:27,h t t p s : / / s c o n t e n t . f t u n 1 5 - 1 . f n a . f b c d n . n e t / v / t 3 9 . 3 0 8 0 8 - 6 / 3 9 7 5 4 8 3 0 4 _ 7 4 9 8 9 0 3 4 0 5 1 2 8 3 2 _ 1 8 4 9 0 3 3 4 2 3 2 4 4 0 3 9 0 2 1 _ n . j p g ? s t p = d s t - j p g _ p 5 2 6 x 2 9 6 & _ n c _ c a t = 1 0 9 & c c b = 1 - 7 & _ n c _ s i d = 5 f 2 0 4 8 & _ n c _ o h c = H e d m p Q D V 7 x 4 A X _ S S u 2 S & _ n c _ h t = s c o n t e n t . f t u n 1 5 - 1 . f n a & o h = 0 0 _ A f C - K q N R E p U 8 l 6 f R I 6 g j Q G b d z R 7 L V S 7 J a A P r f X R - T u D a o Q & o e = 6 5 5 6 5 7 E 8,https://www.facebook.com/ScreenMixx/posts/pfbid02Pb7rTsSghvv8Ew7id5pBqTzasRdteD4kjogB96A8nLDKazPQPNgQr8EX5zjdfkiPl?__cft__[0]=AZW2j4750A-u1Q0OWmNU-fG2PDDSYgYPMTvEqnDrdoRrVP87E3_Sn_frK7ax1rjuQRl_uXVVNHDDZMYBGoui6x-coRUtxY6km718Nvls9H6NSbF-nXCAvRSH9wMF8QE0UwTZB-X9d-VY2OmOr2Tk2jP8TSneOhU0yFZz2qMDWkDGOyJRFTc-1il-NCLQGB-z3oCH9hIMOt7fatEYAALyoTVW&__tn__=%2CO%2CP-R,"1 .) < امسا إن B‏ 4 ‘ المدرب المغرى aall paiiy‏ "" القرآن nP'.uﬂl‏"
