id,name,shares,comments,content,posted_on,image,post_url,image_content
pfbid024oxzKRqEEmX7zV7YjJUHUoN4LAmNdTBnCyJBW5WYGJ6FP1A26KtcNiUCMregYBpSl,XBANX ARMY,116,508,الوداد يخسر نهائي السوبر ليغ .. مكتابش ,2023-11-12:17:14,h t t p s : / / s c o n t e n t . f t u n 1 5 - 1 . f n a . f b c d n . n e t / v / t 3 9 . 3 0 8 0 8 - 6 / 3 9 9 6 5 6 7 9 3 _ 7 4 9 0 3 6 0 8 0 5 9 4 3 3 4 _ 5 3 0 9 3 0 1 9 9 2 1 4 3 1 6 7 3 2 9 _ n . j p g ? s t p = d s t - j p g _ s 6 4 0 x 6 4 0 & _ n c _ c a t = 1 1 0 & c c b = 1 - 7 & _ n c _ s i d = 5 f 2 0 4 8 & _ n c _ o h c = x 6 O f f J c j C Y E A X 9 S u M g 7 & _ n c _ h t = s c o n t e n t . f t u n 1 5 - 1 . f n a & o h = 0 0 _ A f B W G Y p h l G S E z c b A L C H k n q 1 N I x r O p _ l F L E u o 4 8 A O s p 7 7 4 A & o e = 6 5 5 6 3 3 7 1,https://www.facebook.com/XbanxArmy.Officiel1/posts/pfbid024oxzKRqEEmX7zV7YjJUHUoN4LAmNdTBnCyJBW5WYGJ6FP1A26KtcNiUCMregYBpSl?__cft__[0]=AZVMXbxCcr5qoIdwJ5GbeqAaoUAZsl-C6eAuKLWp2MkLd3c9iJ8SBKU7ZCOB_bKzgkD5F5eURvx3cmjFcXHFzLivGQkJ060xNfgDWmYhUyMSFFKrlY7NJAveD3u5kH77jLmMq593VjfpGjs700fN6NtI6_tOAUCAPuzPH752f6ki1yhLoTQXpHS9gaPgF5eYhAdpJdY2-FMOyfqf2tTFlUr1&__tn__=%2CO%2CP-R,"! < ~ - ‘ﬁ{ 2o Ui AR e L ؤ‎ ٍِ ¥ ""rg.‘,u; 828 1101 L| نر 3 1 مي‎ i"
pfbid02WdnMV22EprZKnANnQ6pWtuLnDuUw9o82SGq3B2iPv93jB1aFsqjTw494SVLUWcAJl,XBANX ARMY,3,377,. بروووجولة من أي بلاد كتشجع الوداد المغربي اليوم .......هاد القناة خاصة بنتائج المباريات??https://t.me/santabetssد,2023-11-12:13:14,h t t p s : / / s c o n t e n t . f t u n 1 5 - 1 . f n a . f b c d n . n e t / v / t 3 9 . 3 0 8 0 8 - 6 / 4 0 1 1 4 9 5 0 6 _ 7 4 8 9 3 5 5 8 0 6 0 4 3 8 4 _ 3 5 8 6 7 2 2 6 0 1 9 5 3 4 1 3 6 7 5 _ n . j p g ? s t p = d s t - j p g _ p 5 5 2 x 4 1 4 & _ n c _ c a t = 1 0 1 & c c b = 1 - 7 & _ n c _ s i d = 5 f 2 0 4 8 & _ n c _ o h c = N W O n Q 4 U B u v 8 A X - r U f i X & _ n c _ h t = s c o n t e n t . f t u n 1 5 - 1 . f n a & o h = 0 0 _ A f A K x I P 1 T Q U V w I D Q q B h P 7 1 v r X i 5 f 3 g B 7 P _ S p g d n F B Y 6 V i A & o e = 6 5 5 6 6 F 2 B,https://www.facebook.com/XbanxArmy.Officiel1/posts/pfbid02WdnMV22EprZKnANnQ6pWtuLnDuUw9o82SGq3B2iPv93jB1aFsqjTw494SVLUWcAJl?__cft__[0]=AZXPrhXCA5N2icNpYuoy83z1BC2yRnb_ZvhNgw5g9XpKuQRqeqMn1j9R002Mj6WxKUtpqXDXv34FYaVs6GlYIGYIfwBWKZow2wa6j5TvF_OnpxAOLd2kqM_rXx9qa1cQZ6BXz2ReZq1f9FJxOvKqfJXrnO_8EFo6UUbtjfgNUPgjUT7kg4wMIR2w3QHel6Rsj5W7ymmjuCNqCd6a0357saiD&__tn__=%2CO%2CP-R,0 فال‎ T My U اد تن‎ 1 2 T ما‎ حا ا‎ - &S [ 71 : : 71 1 118 (S AT ير‎
pfbid02vwFMxedaNECDYFtYWxu7EY8KZTHqLgEsr7HyymvTPjzzH9LRUmNuC3FjvGj8ULeBl,XBANX ARMY,22,357, المغاربة اليوم سيقفون مع الوداد ويشجعونها. سيهـتز كل المغـرب من طنجـة الى الكويرة فرحا بفوووووز الوداد المغربي ان شاء الله ,2023-11-12:10:14,h t t p s : / / s c o n t e n t . f t u n 1 5 - 1 . f n a . f b c d n . n e t / v / t 3 9 . 3 0 8 0 8 - 6 / 4 0 1 0 2 7 1 3 9 _ 7 4 8 8 5 6 9 5 7 2 7 8 9 1 3 _ 2 0 8 2 5 5 6 7 1 8 6 8 6 9 2 3 7 5 1 _ n . j p g ? s t p = d s t - j p g _ p 1 8 0 x 5 4 0 & _ n c _ c a t = 1 0 5 & c c b = 1 - 7 & _ n c _ s i d = 5 f 2 0 4 8 & _ n c _ o h c = H z 3 S B G G y f 6 0 A X 9 X c e W U & _ n c _ h t = s c o n t e n t . f t u n 1 5 - 1 . f n a & o h = 0 0 _ A f B j o j C m 2 6 0 y l 2 p w 8 v r 5 6 8 M 7 4 C L I c K H V e i R 9 y d A p P u W 1 U w & o e = 6 5 5 5 B 7 8 0,https://www.facebook.com/XbanxArmy.Officiel1/posts/pfbid02vwFMxedaNECDYFtYWxu7EY8KZTHqLgEsr7HyymvTPjzzH9LRUmNuC3FjvGj8ULeBl?__cft__[0]=AZVUI7WrfqJKfGYML9u1Hd3o-DeqsgtFbvbww197Cyv9tjen7PdTkD2aDA5duw96FBEElOb8wskoQsz7m03zE5Gn9BHW_NM6kXlGYFfweypQtuv4fNwtIuuUNXdhIg7kWkPi7vZcoKmwzUQPq3FCLqg_2N8a04Gq_rGV7yeEeDUkhYuBTs4j4kdj5rlxXnpDQnJJAxDxkkxSNpQ7jyQfkv-1&__tn__=%2CO%2CP-R,"3= سر 7 . s B‏ ١‏ ذا له 0 N‏ اوعس أ 4 يحدلا ف 8 : من« o - & "" . AN TSy~~~ WY 1 - A7) N شالع‎ = B 0 ا‎ ا ب ا"" رد‎ y ."
pfbid02ZNgbTuAKc9aWKU5fCMhtgYuvzvEvXMJcB4y8Tc57GLKuL22HAwMhTsoCqmCf6mKAl,XBANX ARMY,131,370,بالزربة وبدون سابق إنذار لقيت راسي كنطل على 40 عام و أنا مزال عاقل  كنسمع بنادم فعمرو 35 كنقول تبارك الله كبير  هاد خونا والواعرة هي فاش تنكون دايز من الدرب وكنشوف الدراري الصغار مقصرين كرة كنبدا نسمع بلاتي بلاتي يدوز الرجل ههههه ويلا جات فيا الكرة كيگولو لي : سمح لينا أعمي هاد عمي ايلا بديتي تسمعها بزاف يعني وليتي شيباني بالاوراق هي الطابع ديال التقاعد /المهم أنا عارف هادو هوما البوادر ديال الشيخوخة ولكن كنظن باقي ناقصني جوكير واحد ونكمل الطابلو وهو نكون واقف شي نهار فالطوبيس وينوض شي واحد ويخليني نگلس بلاصتو ومن هاد المنبر أي واحد ضرب الثلاثينات خصو يعرف أنه لعب جميع المباريات ديال الذهاب و بدا عندو الإياب بكري .. لألي تڤاليدا باقي غا الروتور أمسكين ,2023-11-11:23:14,h t t p s : / / s c o n t e n t . f t u n 1 5 - 1 . f n a . f b c d n . n e t / v / t 3 9 . 3 0 8 0 8 - 6 / 4 0 1 0 8 6 0 0 3 _ 7 4 8 5 9 8 7 4 7 3 0 4 7 3 4 _ 2 7 3 9 1 1 0 5 9 2 5 0 7 3 1 3 5 5 1 _ n . j p g ? _ n c _ c a t = 1 0 7 & c c b = 1 - 7 & _ n c _ s i d = 5 f 2 0 4 8 & _ n c _ o h c = 0 B q O P j S d x y s A X 8 5 2 V M j & _ n c _ h t = s c o n t e n t . f t u n 1 5 - 1 . f n a & o h = 0 0 _ A f B r E A P E 2 b I P - 7 a h f z 6 I X F 1 u 8 7 O r x G p t g 7 B m B l p 4 K b M v H Q & o e = 6 5 5 6 2 5 5 D,https://www.facebook.com/XbanxArmy.Officiel1/posts/pfbid02ZNgbTuAKc9aWKU5fCMhtgYuvzvEvXMJcB4y8Tc57GLKuL22HAwMhTsoCqmCf6mKAl?__cft__[0]=AZXr9IllTlVLxAh1OxrDHte0v5qIh6P9zCrBju8XThnhZnwDjoYubCeE-IEv65wE_xkG908-SFKOxkpOOC-YdrhiXqc2Ey0mgZThYEvWbYzhwH9LBpGuCdB8Y2Fso2sR_M46oxC4hkWzoDJRKN_ieXLBj-OlcV2G1rrcZGWxEk5ZNvylFnpZ0api3-bpyxFiRvA7fWADi-zcrX0KnOI_bv3X&__tn__=%2CO%2CP-R,م جا # e‏ 1 70 ص }\ ل 1 oy‏
pfbid0egz62VKMfTyqYLFM1WCdC1RNmYbx58m9HBYNZ6yTmsUKFCj9Kv25dNhs1sekgb1jl,XBANX ARMY,143,243, مايمكنش على ماتش الهباال الهباال ,2023-10-07:17:41,h t t p s : / / s c o n t e n t . f t u n 1 5 - 1 . f n a . f b c d n . n e t / v / t 3 9 . 3 0 8 0 8 - 6 / 3 9 9 7 2 3 4 9 7 _ 7 4 5 2 4 8 3 2 7 6 3 9 7 7 6 _ 6 1 2 6 9 6 3 7 5 5 5 0 8 6 6 4 0 4 8 _ n . j p g ? s t p = d s t - j p g _ p 5 2 6 x 2 9 6 & _ n c _ c a t = 1 0 6 & c c b = 1 - 7 & _ n c _ s i d = 5 f 2 0 4 8 & _ n c _ o h c = r B y 9 K j T Z 7 2 M A X _ h A p f E & _ n c _ h t = s c o n t e n t . f t u n 1 5 - 1 . f n a & o h = 0 0 _ A f D n 5 j L b 0 A M r K T P r Z W Z w T 9 Y S O F z M h l U J a M f t L L Z o b j D i l g & o e = 6 5 5 5 5 9 8 7,https://www.facebook.com/XbanxArmy.Officiel1/posts/pfbid0egz62VKMfTyqYLFM1WCdC1RNmYbx58m9HBYNZ6yTmsUKFCj9Kv25dNhs1sekgb1jl?__cft__[0]=AZWpTD1g36eTz2chb8E_YUNLEkj2DWxtOcUKY-c8ho7iuocC4wvVIWueabbokyYv7BrH__sgjVrwnXl5xnLm6D2BYRA-UCuw1LSECnVfgDur2Udw2wgdGAcKIb4j0nL8tL0D3LObU2bQp3OwMsqnxZN-B4sgdmqe4YZ4iUV8psgDj5Okl_6APGLkTygvxR27A7EC6JvJmrg0doKQzPdSGm1b&__tn__=%2CO%2CP-R,"M . ’ a 7 & 790 . * يا ا نوكت‎ 1 &\ ا بلا‎ 0 6 h EYIeL-v / اليا‎ | 5 5 2 1 8 Sy o o % (B 8 1 oy ® , 1 =7 85 { : t م‎ § \"
pfbid0LM4RJs3qeUoVeZHX1Jy2HDGUCC9TxGtKiBDizf7bpPwUXY9cZtLa5i1QtZ9fvDSDl,XBANX ARMY,14,23,بشفاء العاجل منتصر الحتيمي بطل في الشوط الأول..,2023-10-07:19:27,h t t p s : / / s c o n t e n t . f t u n 1 5 - 1 . f n a . f b c d n . n e t / v / t 3 9 . 3 0 8 0 8 - 6 / 3 9 9 0 7 8 6 2 1 _ 7 4 5 2 2 8 4 6 4 3 0 8 4 2 9 _ 4 0 0 4 8 1 7 9 1 7 2 5 7 9 3 7 0 2 5 _ n . j p g ? _ n c _ c a t = 1 0 4 & c c b = 1 - 7 & _ n c _ s i d = 5 f 2 0 4 8 & _ n c _ o h c = W D U t e n I N l N o A X 8 2 S x - x & _ n c _ h t = s c o n t e n t . f t u n 1 5 - 1 . f n a & o h = 0 0 _ A f D P Z P 7 D p 6 I C - L x Y G R H - w k d u x K l T 4 S v i K y a O p R H B a l u 9 l Q & o e = 6 5 5 5 D 2 5 1,https://www.facebook.com/XbanxArmy.Officiel1/posts/pfbid0LM4RJs3qeUoVeZHX1Jy2HDGUCC9TxGtKiBDizf7bpPwUXY9cZtLa5i1QtZ9fvDSDl?__cft__[0]=AZU4L472cgpRx0MDrBnG062i76OVaQhDxF9pdF0BS2pPZ_QEEe1IL9Trxk--vs3qp_7JN8EDeiLmJr0JgE5bXnMnpsKakWPX7XVLr0jk10MtB8-FALmVxQ4Aar37BtswPhRd6dWLmHx_Bf_7Jl66vE9Jxm7S6UFRPdZjuKDUiCDISc_QMB_3LjLFoV9kwxXGrPgZH_vbN9aoSBsDw9RIhadW&__tn__=%2CO%2CP-R,Nl &) ١ Y ايا‎ W السو‎
pfbid02RWx4TQHuMqst44X8ZNKscv8EYw3J2SQCxivYS73qu9tTD1t1crPsh5YHpnf3kXeTl,XBANX ARMY,10,157,لي تفرج فـ المباراة الوداد الرياضي إبان هنا و قل لنا اش بان ليك فـ الشوط الأول ,2023-10-07:19:34,h t t p s : / / s c o n t e n t . f t u n 1 5 - 1 . f n a . f b c d n . n e t / v / t 3 9 . 3 0 8 0 8 - 6 / 3 9 9 0 2 1 6 4 6 _ 7 4 5 2 2 6 4 5 4 3 0 8 6 3 0 _ 9 9 0 5 9 7 0 2 1 4 7 8 2 0 1 4 4 8 _ n . j p g ? s t p = d s t - j p g _ p 1 8 0 x 5 4 0 & _ n c _ c a t = 1 0 5 & c c b = 1 - 7 & _ n c _ s i d = 5 f 2 0 4 8 & _ n c _ o h c = 2 S D 9 R 0 R j E U A A X _ m A P r - & _ n c _ h t = s c o n t e n t . f t u n 1 5 - 1 . f n a & o h = 0 0 _ A f B 3 5 3 m _ K 9 e 4 K w x G _ o 9 6 _ l I B A h Y b y u s w u 0 g 6 i Z X A 3 1 K b f Q & o e = 6 5 5 6 0 4 1 8,https://www.facebook.com/XbanxArmy.Officiel1/posts/pfbid02RWx4TQHuMqst44X8ZNKscv8EYw3J2SQCxivYS73qu9tTD1t1crPsh5YHpnf3kXeTl?__cft__[0]=AZUVvJPuyUX8F2NSBet5v1miE8ANCfwYGhwx3xs9i4VrT2g0Fk41Zqfj9CmbIF9dyTgNfcJNVaJLpzhIaaQnyJdPCdVejrsIKeCqTlSH16o8fvy_9e6ryQWMhm-7DQL3ZsUSdoJRtRlYXCqGS8MPz_w33_aFWnn_gms7VTyUGjGw0SuVl3sEfDCpjSmEfDsyvX2Dxvjp_7j1VGoo2zV61WPN&__tn__=%2CO%2CP-R,"الم 2 ‘t & g 2l‏ اي - يوحن ناوا ول B‏ د Z S‏ ام A‏ أ ,. 2107 ١ N = .‏ — % - خالاو 5 ا 1 4 ""8 ير A‏ اع اد"
pfbid0EnEZjn43PNTdFwbddcjGs5iXNwQ9AUgfssxcCyeniKFeAzrr3RWWNB6izNJS5J3yl,XBANX ARMY,0,0,منتصر مرضي الوالدين و مرضي الجمهور ...… En voir plus,2023-10-07:20:29,h t t p s : / / s c o n t e n t . f t u n 1 5 - 1 . f n a . f b c d n . n e t / v / t 3 9 . 3 0 8 0 8 - 6 / 3 9 9 0 4 3 4 6 5 _ 7 4 5 2 2 1 4 2 0 9 7 5 8 0 0 _ 3 4 5 6 4 8 6 6 5 8 1 4 3 1 9 4 9 4 6 _ n . j p g ? s t p = d s t - j p g _ p 1 8 0 x 5 4 0 & _ n c _ c a t = 1 0 4 & c c b = 1 - 7 & _ n c _ s i d = 5 f 2 0 4 8 & _ n c _ o h c = 6 j O u v o e c F O U A X 9 M Z P C N & _ n c _ h t = s c o n t e n t . f t u n 1 5 - 1 . f n a & o h = 0 0 _ A f A Z T P k 0 N 1 9 6 S H R a A h 9 X E z 7 8 L w Q F v Z h 6 - 4 u k R P P - Z V I V b A & o e = 6 5 5 5 5 0 B 4,https://www.facebook.com/XbanxArmy.Officiel1/posts/pfbid0EnEZjn43PNTdFwbddcjGs5iXNwQ9AUgfssxcCyeniKFeAzrr3RWWNB6izNJS5J3yl?__cft__[0]=AZVc04ZyjA7-92AdzVnxaBpOc0PGIfKV8ZIMmSOiIMtcf202w0Uzk_nQrhKYMRciKV5VilVhMymrKtc5AsSpMtem6MpO5j2yC8OwAC7fypz6np1jpiGdIsS3_mmTZCAnQvYrebrunO4oscOx-hLyyxHZ6eIXcceFlw1O0kIXJ5-iijvedKU-i4fzniWnrtvBRI3kzziT5z5ZgWgv6Zzve_Bq&__tn__=%2CO%2CP-R,5 / الجا 1 0 ; ا ا وحوح د - 5 Y‏ ناما فا e‏ ا AT‏ + راس Tl ol S‏ - الا دان gl ‘‏ ¥ -
pfbid02BtGXWrNW88L4Uk85HPBNqYCLd2MgB4HwWAjE7hbGiLaEPtDKpLNNuYieWEgpMfyol,XBANX ARMY,0,0, برجولة من أي مدينة غادي تشجع الوداد المغربي اليوم ,2023-10-08:05:32,h t t p s : / / s c o n t e n t . f t u n 1 5 - 1 . f n a . f b c d n . n e t / v / t 3 9 . 3 0 8 0 8 - 6 / 3 9 9 2 0 5 5 2 6 _ 7 4 5 0 4 4 3 5 7 6 6 0 1 7 3 _ 3 5 8 0 6 5 4 9 5 8 4 9 5 1 9 3 4 3 _ n . j p g ? s t p = d s t - j p g _ p 1 8 0 x 5 4 0 & _ n c _ c a t = 1 0 1 & c c b = 1 - 7 & _ n c _ s i d = 5 f 2 0 4 8 & _ n c _ o h c = 9 2 v G e 6 p m h l I A X - p S c h D & _ n c _ h t = s c o n t e n t . f t u n 1 5 - 1 . f n a & o h = 0 0 _ A f A 8 n 1 Y m l l X P 7 u Y 6 - J 9 r 3 t c s 0 w d 9 m s N c F - j Z 4 S d Y V x a _ T g & o e = 6 5 5 7 1 1 6 C,https://www.facebook.com/XbanxArmy.Officiel1/posts/pfbid02BtGXWrNW88L4Uk85HPBNqYCLd2MgB4HwWAjE7hbGiLaEPtDKpLNNuYieWEgpMfyol?__cft__[0]=AZWxrrXNVIvTeqOMnLOj7mpwEkvPf8rjmBBAo_0M2YAby3F1I3jWLDJSGXhCdZeItObBm9G3Yk5UvNd9oV02lMSJGroGhDfa0HJMQGbcku9ydqWzmwEa8IlG5wtj2vzRAb5PHf_8uMeBIFTj2lqsbtmgWalRdiRz9njNiCi6dGI-sJWtyDWRyFA5ch_76_ECWKQDSlgc7udlbmRur-B3HjmP&__tn__=%2CO%2CP-R,"ِ, ( الل P‏ ل 01 o R‏ البو ا اله ال NG‏ T ٠٠‏ اليا املو 8 = ال ا ا o o,‏ ا كس ال اناا لمكد2ه ال ا D‏ كس G‏ ل ا P‏ .ا ل ل ل P e‏"
pfbid02UERw2QypE5BterVRVWMihNv7QVoxWfkz3ADpnGA6rgz78NQWA7AhpufwQ14cm93yl,XBANX ARMY,49,103,اليوم نهائي بدون بكاء و بدون شكاوى وبلاغات .. صانداونز فريق محترم جدا وان شاء الله اللقب ودادي تابعونا على الأنستغرام https://instagram.com/xbanx_army.officielle,2023-10-08:11:47,h t t p s : / / s c o n t e n t . f t u n 1 5 - 1 . f n a . f b c d n . n e t / v / t 3 9 . 3 0 8 0 8 - 6 / 3 9 9 4 7 3 4 7 5 _ 7 4 4 9 5 7 4 9 1 0 0 2 1 9 3 _ 2 5 3 5 2 9 7 7 4 7 9 3 7 1 8 3 1 6 1 _ n . j p g ? s t p = d s t - j p g _ p 8 4 3 x 4 0 3 & _ n c _ c a t = 1 0 4 & c c b = 1 - 7 & _ n c _ s i d = 5 f 2 0 4 8 & _ n c _ o h c = e y p C m E w Q d n 0 A X 8 D i _ u W & _ n c _ h t = s c o n t e n t . f t u n 1 5 - 1 . f n a & o h = 0 0 _ A f C i w - c t o W v R B 0 J h 4 b x W K 6 E K v y d U j V q v b j c V m h F Q h B r O s Q & o e = 6 5 5 5 5 7 B D,https://www.facebook.com/XbanxArmy.Officiel1/posts/pfbid02UERw2QypE5BterVRVWMihNv7QVoxWfkz3ADpnGA6rgz78NQWA7AhpufwQ14cm93yl?__cft__[0]=AZW3FKUTBmEcRBAvg0t8Tqv53_Cb2qOgwbt_BBQjrlhzsYqtGBD16icSI7wWen0lVrcrRCte8nWqdLcs_z1KT_C3cDmzWm643EsVg-6D0OW7TQLbiTR53zXl9OKTGwTKaRMyYAmYzkNoJQDN8lzIsyOeR1-nljEcUDCpELPm95_1C7iYSVWvKpTUrg3BQC10WAa9MmPypFazOlP1lPB8uHDf&__tn__=%2CO%2CP-R,"5 رمعي الا واوا اويا = له‎ : A v ol Bra 5 LR R سي ل‎ (b P ال الي‎ /% ) 8, بش‎ oo w5 % o @it e P g R Bt A & L محرا‎ e 2R ل ل‎ e ا‎ G LTI Tt ري‎ o it P SR ekp LT SR T تم‎ . 3 4 gl ا‎ L e, g i A2 3% د يد > خا حب الا‎ ) i % s e 2t 5 WA R ا اوم ال‎ ص ا ميق‎ AVRE ا ام‎ حا‎ Y A ! - ل‎ : 2 رضم‎ ST «ﬁ""‘ ارا‎ s /*v%\ M5 7 5% AR 0 ا‎ = 2 A 3 7 0 \% RN 2 ع‎ % e rw: SN ا ا ام‎ e et & o\ DTS خب ام و الوا‎ ل‎ gy BT VN RO Lt ol Akl 2: B A الت‎ g ا اي‎ By :f‘é*:;d e i AT ‘Q""fvfh:flﬁv""‘%""‘a ادي‎ “اي 2و0 0 5949 ا تو ال بم ا ا‎ اح ا ا حو رار عن 1 ل‎ 8 5 £ '"",3’ 0 أ و‎ S (| aer R el gyl § G ا .ل ا‎ A عب ا ا ا = اا 1 1 را‎ # 57 “ 9 5 S Sl T I e, م أي‎ R ؟ امام‎ @ e Y 2"
pfbid02JCfipoWNoaPe6QGMWW8787ygVpkj4j5ZGXKQEJvRAZgH4aUTqi8eR5kx7f3AoWExl,XBANX ARMY,148,716,هادشي ماشي NBA او الولايات المتحده الامريكيه ، هذا جمهور الرجاء البيضاوي في مباراه كرة السلة  تابعونا على الأنستغرام  https://instagram.com/xbanx_army.officielle,2023-10-14:17:40,h t t p s : / / s c o n t e n t . f t u n 1 5 - 1 . f n a . f b c d n . n e t / v / t 3 9 . 3 0 8 0 8 - 6 / 3 9 8 8 5 6 4 6 0 _ 7 4 4 6 5 9 0 7 7 6 9 8 7 0 1 _ 8 2 2 1 6 7 0 8 0 1 2 0 5 6 5 3 0 4 3 _ n . j p g ? s t p = d s t - j p g _ s 6 4 0 x 6 4 0 & _ n c _ c a t = 1 1 0 & c c b = 1 - 7 & _ n c _ s i d = 5 f 2 0 4 8 & _ n c _ o h c = C q m J Y 0 0 R l 4 k A X - J y c h 1 & _ n c _ h t = s c o n t e n t . f t u n 1 5 - 1 . f n a & o h = 0 0 _ A f B 2 7 L o D X 8 o 6 E U Z 2 C G x 0 R T 3 G T R r S 9 P O C h 1 U y j J c j e q 3 v Z A & o e = 6 5 5 5 4 5 4 F,https://www.facebook.com/XbanxArmy.Officiel1/posts/pfbid02JCfipoWNoaPe6QGMWW8787ygVpkj4j5ZGXKQEJvRAZgH4aUTqi8eR5kx7f3AoWExl?__cft__[0]=AZXv_4UT2kT7yt1ieAZWEyl-acMyA_lamj4xiz7_9A9X8tPS_r-z0Nre2Zlcq0nK3vI16MyA754Tdeq-ldB8CqOBrJD-l441p7cvFPn_kzZaW2DmSmvzfiOl-EDNE-U2UexGZ_1nJq5_7wW_BwpKgjSgzMebKXuvvAmfjU5pMM_YwqKDIkIxaeREzjPmfzEh3FboGEvJAztwu90_vpdshqn9&__tn__=%2CO%2CP-R,- - i > - يه‎ . Ry . ١| لم ارا‎ ب‎ N مسا‎ لو و ا ل ا ا‎ = AR سس‎ ال‎ B b i ٠ | . gttt I b BEs = L SRS 0 ! i - o W SRR S الخ 8 = ‘ 3خ‎ 2 و اي‎ ) s - R وا‎ Poh e g AT اليه‎
pfbid02rvrDMNZAo2hKJhfeBXtgtGdBc3U9e23Dhio8xKacQvXbZdtS4Typb42BWS49CwLol,XBANX ARMY,187,198,دخل لانتستغرام و دير متابعة للاعب المغربي انور غازي و ماتسولنيش علاش  هاد الولد فات الرجولة من لهيه ,2023-10-15:08:36,h t t p s : / / s c o n t e n t . f t u n 1 5 - 1 . f n a . f b c d n . n e t / v / t 3 9 . 3 0 8 0 8 - 6 / 3 9 8 7 6 5 4 9 4 _ 7 4 4 4 2 4 9 8 4 3 8 8 7 7 7 _ 5 7 8 7 6 3 8 2 2 4 6 0 5 2 3 6 9 8 6 _ n . j p g ? s t p = d s t - j p g _ s 9 6 0 x 9 6 0 & _ n c _ c a t = 1 1 0 & c c b = 1 - 7 & _ n c _ s i d = 5 f 2 0 4 8 & _ n c _ o h c = B k 6 z b G M y k i k A X _ D B v S v & _ n c _ h t = s c o n t e n t . f t u n 1 5 - 1 . f n a & o h = 0 0 _ A f D 5 6 p Y k s 2 3 b 4 u 5 Z 2 - 7 2 _ T 5 6 F z Z j F 7 j s F n n f 3 D t Z x 7 b z 1 g & o e = 6 5 5 5 C F F 5,https://www.facebook.com/XbanxArmy.Officiel1/posts/pfbid02rvrDMNZAo2hKJhfeBXtgtGdBc3U9e23Dhio8xKacQvXbZdtS4Typb42BWS49CwLol?__cft__[0]=AZXi_wwGHrVnfAMJqHJkZFVe-T3RMogXwlZYotf9s_nahqF6WLNZXSzqfz_533drZ5AMO13SRqqlIJmsIK-1oqRKxWI4TMOz8I2vqYIP9WufjvLjc7ySWKFwHZAApgDZ4ISaoK_vkeQ8t7Wgt2wsT9KxARNZipu_-9ydvA7TCmV9sp3hmbyExeiU0v6YSgGqSjZ7rhPhZQsENBRNR-9efdn5&__tn__=%2CO%2CP-R,& elghazi21 © L 151 308 K 201 Publications Followers  Suivi(e)s Anwar اع‎ Ghazi Athléte Suivi(e) v Ecrire Adresse e-mail
pfbid028LQavphL9Mhh6awJcQJzxkmhyZ2uQppSw8CNua94HywU888JTquMDJW4THocf4srl,XBANX ARMY,418,87,سنة الله عز و جل في خَلْقِه,2023-10-21:14:24,h t t p s : / / s c o n t e n t . f t u n 1 5 - 1 . f n a . f b c d n . n e t / v / t 3 9 . 3 0 8 0 8 - 6 / 3 9 8 7 0 7 3 9 9 _ 7 4 4 1 3 4 6 9 4 4 1 7 8 0 6 _ 3 8 2 7 5 5 7 9 1 6 1 2 1 3 3 3 0 6 3 _ n . j p g ? s t p = d s t - j p g _ s 6 0 0 x 6 0 0 & _ n c _ c a t = 1 0 9 & c c b = 1 - 7 & _ n c _ s i d = 5 f 2 0 4 8 & _ n c _ o h c = f 8 a 4 r R w x o 7 U A X _ H N _ r u & _ n c _ h t = s c o n t e n t . f t u n 1 5 - 1 . f n a & o h = 0 0 _ A f D A x N S 3 i S n 8 f Z b d - T _ c j M T u E j x 6 c - E h 8 J 7 1 m H P t d U H w - w & o e = 6 5 5 6 D 1 3 6,https://www.facebook.com/XbanxArmy.Officiel1/posts/pfbid028LQavphL9Mhh6awJcQJzxkmhyZ2uQppSw8CNua94HywU888JTquMDJW4THocf4srl?__cft__[0]=AZVqW3LYEGJygpUxVxrSmkgHqFkXMTsEOyv0PobX1Li19liuY8t4_IJk5Pg0HtolU56YRqm05JojP-RNtUjSaiWDquKdB3G09lCjM-DHw9AMW9e-S7UDHLdfqaMVvlZuGJ7iPI4As3IlyOyfHiTA2IWVncAe1GQZ-g3KyeXeg81KbPaF1U7pvt1Qp7PsoINpjzmKWk-2c27t_vOhxKcDUytJ&__tn__=%2CO%2CP-R,s B |
pfbid0T2Rn7j6SaHbgEMJsmsfB8py7usgqTbN3PTtL9CfM2ZUckFBLe3Scz4wPRCLjrAQ4l,XBANX ARMY,43,48,لي عندو شي طموبيل ولا مطور دخل لرابط ودير نمرة د البطاقة الوطنية ديالك وشوف واش عندك شي بروصي ربما اكون عندك ومفراسك وتزاد عليك حتى تولي فشي جنحةرابط في التعليق,2023-10-21:19:48,h t t p s : / / s c o n t e n t . f t u n 1 5 - 1 . f n a . f b c d n . n e t / v / t 3 9 . 3 0 8 0 8 - 6 / 3 9 8 7 4 1 7 8 6 _ 7 4 4 0 5 3 1 6 4 4 2 5 9 5 9 _ 2 2 6 4 4 8 1 7 5 1 3 5 1 1 3 4 1 1 _ n . j p g ? s t p = d s t - j p g _ s 6 0 0 x 6 0 0 & _ n c _ c a t = 1 0 2 & c c b = 1 - 7 & _ n c _ s i d = 5 f 2 0 4 8 & _ n c _ o h c = S U I p 4 z b 4 6 l 0 A X - 1 l r 3 g & _ n c _ h t = s c o n t e n t . f t u n 1 5 - 1 . f n a & o h = 0 0 _ A f D B t - s T t u a B A f f M S I C o V y n q q x m D Z _ s S Q T O K H 8 d u P q Y s G w & o e = 6 5 5 5 B A C 3,https://www.facebook.com/XbanxArmy.Officiel1/posts/pfbid0T2Rn7j6SaHbgEMJsmsfB8py7usgqTbN3PTtL9CfM2ZUckFBLe3Scz4wPRCLjrAQ4l?__cft__[0]=AZUc4q9-zNzrqA8znDU8tuflWOOK-jA4IPB6Il2XtjyObnJD_nqa_2nY0p-9SC2nrvbWg9dEuf1N2KiAHCXr-PSbDKd_74cUJNdfuPYT5cXavlVspqQSeWngFS7m5IJRFbvhpuzOb6V_VzvTvJ8SHzQI-YUlWPY8LE4v2ZZHf8KUJYkdjrT3LRPDrDDaqGcXTmeB28vJemYinQipCLz3yIXL&__tn__=%2CO%2CP-R,"I ‘‏ ا الا R i 5‏ i‏ اق وا دج : @ | ءا الحا 7 £ 7 دا ااي ا ا | = el a8‏ ال I‏ ا اا 1 G‏ لا 1 للب A,‏ اا الا - iz‏ اا م ارخا الله I I L‏ ) زا ا ال كاسع عو ووو ”..- 1 e =‏ ات 27 W),‏ 0 1 ع e‏ = i [‏"
pfbid034WbmYkHoMXQ6rX8PRdq1J7ji8TMyHbgkxoPKbnfzAkBYLfpg8pJN4QBvoBC4a2Dul,XBANX ARMY,2,479,ناس لي محافظة على صلاتها ويلاه جاو من صلاة الجمعة يبانو هنا بكل إفتخار ويقولو لنا ما كان موضوع خطبة اليوم في مساجدكم تقبل الله منا و منكم صالح الأعمال ,2023-10-22:02:43,h t t p s : / / s c o n t e n t . f t u n 1 5 - 1 . f n a . f b c d n . n e t / v / t 3 9 . 3 0 8 0 8 - 6 / 3 9 8 2 9 0 0 8 3 _ 7 4 3 9 2 3 8 5 1 1 0 5 5 5 7 _ 8 2 7 7 3 0 2 6 6 9 5 4 1 0 2 9 1 4 3 _ n . j p g ? _ n c _ c a t = 1 0 9 & c c b = 1 - 7 & _ n c _ s i d = 5 f 2 0 4 8 & _ n c _ o h c = - G A R Z _ e M I f s A X _ v l x d U & _ n c _ h t = s c o n t e n t . f t u n 1 5 - 1 . f n a & o h = 0 0 _ A f C x 8 p 3 V d t 0 0 y 8 N q g 1 W _ b _ y h J t f M g 6 j i x u B G H _ t K F S m h Z w & o e = 6 5 5 6 A 3 6 F,https://www.facebook.com/XbanxArmy.Officiel1/posts/pfbid034WbmYkHoMXQ6rX8PRdq1J7ji8TMyHbgkxoPKbnfzAkBYLfpg8pJN4QBvoBC4a2Dul?__cft__[0]=AZXduStnNYLJl52a3c3ArRa8N8SJAcm0aMJwHAQtNEmxL3lA3OZUMXyPhBeTsC99-VJhc-CciXzno7jk3YKwKkl1pgvISUEMXkt_5VuIuVWMLf4cPIGgvcusp0xEZhIJl7IukUj7hV5a32XvnvHe8I74bN3_08IJqIuCxGBGQTtlmkw-DVqz3K2ddfRpPItlEiPjdxby607e9FINWHe77476&__tn__=%2CO%2CP-R,"& 6 q لماجي ا‎ : م ال‎ i W7 3 / 7 ,- 1% E ' - ﬁ Y. 0 o [ 2 ! ] 005 = . ال‎ ' W ﬂra f%-,z« م لح - = .ا‎ A 0 ل وله‎ ¥ - Bt 2 5, ) : َ 7 . oo - 8 ا‎ © ="
pfbid0JTJb2RBSUYamincXnNXVZGduzYBJPu6jePnhwZRbnSEfPoWspUjTiBV49hDe5stJl,XBANX ARMY,0,0,اي واحد فينا باغي يغير الوضعية ديالو للأحسن و الأفضل و يعيش والديه احسن عيشة و يحقق ليهم ولو القليل فحقهم فهاد الدنيا.لكن قدر الله ما شاء فعل ربي بغاه و داه لعندو و مشا معاه  داك الحلم و هدف حياتو لي داخلين فيه الوالدين بنسبة كبيرة حنا الحمد لله الفطرة ديالنا فيها الاسلام و عارفين بلي الـمـ.وت علينا حق...الله يرحم أسامة و يرحم جميع المسلمين والمسلمات ,2023-10-28:11:30,h t t p s : / / s c o n t e n t . f t u n 1 5 - 1 . f n a . f b c d n . n e t / v / t 3 9 . 3 0 8 0 8 - 6 / 3 9 8 7 1 9 6 3 4 _ 7 4 3 5 8 9 1 5 4 4 7 2 3 6 0 _ 1 8 9 6 1 4 5 8 7 4 2 6 1 3 6 9 7 3 4 _ n . j p g ? s t p = d s t - j p g _ p 5 2 6 x 2 9 6 & _ n c _ c a t = 1 1 1 & c c b = 1 - 7 & _ n c _ s i d = 5 f 2 0 4 8 & _ n c _ o h c = Q k R d j y Z P a 4 E A X 8 s 7 y 7 o & _ n c _ o c = A Q m 4 7 Y F h 7 A 4 D g f Q W n 6 j P P c i c 2 z R 7 k 9 J X M q X k T J M 5 O Q B I 1 c g H S F s 2 8 H R Q b t B q M V t z t P w & _ n c _ h t = s c o n t e n t . f t u n 1 5 - 1 . f n a & o h = 0 0 _ A f B G E 3 l h 2 x 3 i J i e H 5 z x M 6 B V h Z v 7 Z e u I O t s m P 3 v G S V l K Y 4 Q & o e = 6 5 5 5 B D 7 1,https://www.facebook.com/XbanxArmy.Officiel1/posts/pfbid0JTJb2RBSUYamincXnNXVZGduzYBJPu6jePnhwZRbnSEfPoWspUjTiBV49hDe5stJl?__cft__[0]=AZVPF55j28nbuKTl2ckrrtDqM0z6oaRejeu2PzhTFuz0TRLM37x5PWz_EWkFphrhLGrz93dRBageMHW7vohFvmVlGUZUjjHVIEIEtWGS58sVd4uyQXgwMZy7uiAky-MVg959DwuWN02fC_qx81vNKOG9rh-hW6qyPfQyTah7Ud6eDt5bjOl0ov8N6qv72yq2xqernE-WcsymnQMx1FjPnilw&__tn__=%2CO%2CP-R,& N
pfbid032B56MhwgvkN8eYeoq7bxwLmnsCST3sjQwBpQC6jXksD34nqEQnoSqghaB17NFvvsl,XBANX ARMY,73,131,إنا لله وإنا إليه راجعون لاعب الوداد الرياضي أسامة فلوح في ذمة الله.. ,2023-10-28:11:50,h t t p s : / / s c o n t e n t . f t u n 1 5 - 1 . f n a . f b c d n . n e t / v / t 3 9 . 3 0 8 0 8 - 6 / 3 9 8 1 1 1 1 8 4 _ 7 4 3 5 8 2 4 6 1 1 3 9 6 9 6 _ 2 1 2 9 4 3 7 9 6 7 5 3 2 1 7 9 8 4 9 _ n . j p g ? s t p = d s t - j p g _ s 6 4 0 x 6 4 0 & _ n c _ c a t = 1 0 9 & c c b = 1 - 7 & _ n c _ s i d = 5 f 2 0 4 8 & _ n c _ o h c = Z F p X Z f e d K C Q A X - W o q o Q & _ n c _ h t = s c o n t e n t . f t u n 1 5 - 1 . f n a & o h = 0 0 _ A f A m M A Z e k c l i G B O b 9 a Y h N z d s 1 j X 1 9 Y X B 2 n v A X L Q I V N G 9 w w & o e = 6 5 5 6 1 6 5 1,https://www.facebook.com/XbanxArmy.Officiel1/posts/pfbid032B56MhwgvkN8eYeoq7bxwLmnsCST3sjQwBpQC6jXksD34nqEQnoSqghaB17NFvvsl?__cft__[0]=AZXxmBvK1t_r9iO91HL7ivZMoInkgPMLUhG80pGHarwgb9jTbIdgOOd-dckESTOkoZ5d9sTVhn-efd_hy_0czLgAPRQOWleveCvqd_YgawTovScx2KHLI4NwTfyR6MqcvFBhFFeeao6c0J2EuVWK5tVNHUMc9jcUpGDNPEtxVTHUcXh0--M7XDDeh3lcn6E3ytqQjYw38fGaLEWZCFKfzmMm&__tn__=%2CO%2CP-R,M s نر‎ & i == - ol k=== ﬂ d الذي‎ د‎ '
pfbid02rrGBGrrdobL4sbUuexGLZ35fCJKizN4G5NWZMgVyffaMawZng1ke4eHvFhBKkp4Dl,XBANX ARMY,6,81,كل الدعم ولدنا نصير مزراوي ,2023-10-28:18:40,h t t p s : / / s c o n t e n t . f t u n 1 5 - 1 . f n a . f b c d n . n e t / v / t 3 9 . 3 0 8 0 8 - 6 / 3 9 8 6 6 6 4 1 3 _ 7 4 3 4 7 5 8 4 7 8 1 7 0 2 4 _ 5 4 5 4 3 3 2 0 4 8 3 4 1 7 1 2 0 0 7 _ n . j p g ? _ n c _ c a t = 1 0 7 & c c b = 1 - 7 & _ n c _ s i d = 5 f 2 0 4 8 & _ n c _ o h c = 0 J u g p j f R v F o A X _ A 2 N a j & _ n c _ h t = s c o n t e n t . f t u n 1 5 - 1 . f n a & o h = 0 0 _ A f D A 1 P M s K 0 k v F l m m D Y J i n q v p l o - q e 1 e X r U S A q z 8 3 E F S f C A & o e = 6 5 5 6 9 8 8 4,https://www.facebook.com/XbanxArmy.Officiel1/posts/pfbid02rrGBGrrdobL4sbUuexGLZ35fCJKizN4G5NWZMgVyffaMawZng1ke4eHvFhBKkp4Dl?__cft__[0]=AZXVrDzpWUGziQq9WMzmFMbPHOCuKvwGkTiF0ufyhEttFo8leUjU47N7L-dGqRGjBwHJNNU_WgizpDMdPwN_QcKYRQ84_a3dZbEql1BLBaPZ0rU2VGc3shRP-P0Haa8I7zZfgQAaJW4hpJ_taWCsokUHKfhO_BqqS3G6UclTfTXkbut56nDnjuGcr6KL9ZAEY9APWkgTicDGwy38NHFz7crX&__tn__=%2CO%2CP-R,"= 0 بج‎ i / 0"" ل‎ v, | ١"
